issue_id,reporter,component,keywords,summary_proc,description_proc,Performance,files
5,Tulika Agrawal,Network Server,0, network server protocol error select fail order specifi, report armi file derbi dev list use network server one tri execut select statement fail sql except ex divid zero order claus specifi part select server throw distribut protocol except instead appropri error repro use ij util ij gt connect jdbc derbi net localhost db user password ij gt creat tabl int int row insert updat deletedij gt insert valu row insert updat delet without order fine gt attempt divid zero fine ij gt select fn mod error db sql error sqlcode sqlstate sqlerrmc order die ij gt select fn mod order error execut fail due distribut protocol error caus dealloc convers drda data stream syntax error detect reason note problem drda conn thread java file process command method case code point opnqri block code case sql except call writer clear buffer use ensur opnqflrm sent back client opnqryrm qrydsc may written buffer opnqflrm call clear buffer replac someth smarter instead full clear caus problem shown back buffer write made sinc begin case code point opnqri block,0,
19,Ramandeep Kaur,Services,0, npe tri creat databas directori allow, open bug behalf daniel debrunn bug occur embed derbi derbi network server derbi network server might best secur except thrown tri creat databas disallow directori sqlstate bug reproduc ij like drive inaccess disk cd rom ij gt connect jdbc derbi wombat creat true error xj fail creat databas wombat,0,java/engine/org/apache/derby/iapi/services/monitor/PersistentService.java;java/engine/org/apache/derby/impl/services/monitor/PersistentServiceImpl.java;java/engine/org/apache/derby/impl/services/monitor/TopService.java;
38,Mamta A. Satoor,SQL,0, make lock non reserv keyword derbi sinc reserv keyword sql standard, sinc lock reserv keyword sql standard derbi make lock reserv keyword,0,java/engine/org/apache/derby/impl/sql/compile/sqlgrammar.jj;
42,Sunitha Kambhampati,Services,0, use encrypt store length inform extern key servic properti, use derbi databas encrypt provis provid key use encrypt extern key case key store databas ad secur use inform extern key use encrypt databas servic properti right key length store servic properti store servic properti,0,java/engine/org/apache/derby/impl/services/jce/JCECipherFactory.java;
44,Lance Andersen,JDBC,0, support like escap, request support select foo like escap function work jdbc rdbm combo includ db db univers driver function benefici tool well appserv gener sql ejbql,0,java/engine/org/apache/derby/iapi/reference/SQLState.java;java/engine/org/apache/derby/iapi/types/Like.java;java/engine/org/apache/derby/impl/sql/compile/sqlgrammar.jj;java/engine/org/apache/derby/loc/messages_en.properties;
45,Lance Andersen,SQL,0, request support cast like claus, request support cast like claus exampl select id quantiti name price pnum productejb tabl name like cast varchar support db eas migrat db derbi,0,java/engine/org/apache/derby/impl/sql/compile/LikeEscapeOperatorNode.java;java/testing/org/apache/derbyTesting/functionTests/master/LOB.out;java/testing/org/apache/derbyTesting/functionTests/master/dynamicLikeOptimization.out;
85,A B,SQL,0, npe creat trigger tabl default schema exist, background connect derbi db user id password default schema user exampl connect ij gt connect jdbc derbi db user user password pwd default schema someus problem turn tabl exist non default schema default schema case someus exist yet object creat schema attempt creat trigger use qualifi name lead null pointer except derbi engin repro ij creat databas default schema someus ij gt connect jdbc derbi db creat true user user password pwd creat tabl non default schema case call itko ij gt creat tabl itko int row insert updat delet schema itko exist exist schema itko default schema someus exist creat object schema yet tri creat trigger itko non default schema ij gt creat trigger trig updat itko row mode db sql select sy systabl error xj java except java lang null pointer except look derbi log file show stack trace given word look like compil schema field sy systrigg get set end null caus npe subsequ process java lang null pointer except org apach derbi impl sql catalog sysstat row factori make sysstat srow sysstat row factori java org apach derbi impl sql catalog data dictionari impl add sp descriptor data dictionari impl java org apach derbi impl sql execut creat trigger constant action creat sp creat trigger constant action java org apach derbi impl sql execut creat trigger constant action execut constant action creat trigger constant action java org apach derbi impl sql execut misc result set open misc result set java org apach derbi impl sql gener prepar statement execut gener prepar statement java org apach derbi impl jdbc emb statement execut statement emb statement java org apach derbi impl jdbc emb statement execut emb statement java org apach derbi impl jdbc emb statement execut emb statement java org apach derbi impl tool ij ij execut immedi ij java org apach derbi impl tool ij util main catch util main java org apach derbi impl tool ij util main go util main java org apach derbi impl tool ij main go main java org apach derbi impl tool ij main main core main java org apach derbi impl tool ij main main main java org apach derbi tool ij main ij java,0,java/engine/org/apache/derby/impl/sql/execute/CreateTriggerConstantAction.java;java/testing/org/apache/derbyTesting/functionTests/master/triggerGeneral.out;java/testing/org/apache/derbyTesting/functionTests/tests/lang/triggerGeneral.sql;
88,Daniel John Debrunner,Test,0, run suit summari round incorrectli, exampl output run suit report file test run pass test pass fail test fail singl failur lead fail pass round pass percentag round fail percentag,0,BUILDING.txt;build.xml;java/testing/org/apache/derbyTesting/functionTests/harness/GenerateReport.java;
90,Ron Reuben,Tools,0, dblook display messag key instead associ text, use derbi version execut java org apach derbi tool dblookinstead get usag messag get cslook usag similarli use dblook gener databas schema output text contain key one instead associ text cslook timestamp lt gt cslook db name lt sampl gt cslook db url lt jdbc derbi sampl gt append log fals cslook schema header creat schema samp cslook tabl header creat tabl samp tray receiv timestamp sourc char subject char note text varchar,0,
94,Sunitha Kambhampati,Store,0, lock releas properli possibl relat occur lock escal, follow scenario lt code snippet gt string sel select updat prepar statement ps conn prepar statement sel int val ps set max row val result set rs ps execut queri string in updat set current rs get cursor name prepar statement ps conn prepar statement in ps set int iter rs next ps execut updat print lock tabl inform system println lock tabl commit transact print lock tabl conn conn commit lt end code snippet gt run transact twice caus lock timeout second time seem like lock releas properli tabl even transact commit connect close also condit seem happen lock escal tabl lock occur increas lock escal threshold prevent lock escal row level lock lock releas properli print lock inform see row level lock tabl also tabl level lock result lock escal commit resultset close row level lock releas thu second iter test unreleas row level lock caus lock timeout happen case second iter test lock tabl show previou row lock null transact id right transact run default isol level read commit default lock escal threshold set http incub apach org derbi manual tune perf html idx attach program reproduct reproduc problem less number row tabl pleas run program follow derbi properti set derbi lock deadlock trace truederbi lock escal threshold,0,java/engine/org/apache/derby/impl/store/raw/xact/RowLocking2.java;java/testing/org/apache/derbyTesting/functionTests/master/derby94.out;java/testing/org/apache/derbyTesting/functionTests/suites/storetests.runall;java/testing/org/apache/derbyTesting/functionTests/tests/storetests/copyfiles.ant;java/testing/org/apache/derbyTesting/functionTests/tests/storetests/derby94.sql;java/testing/org/apache/derbyTesting/functionTests/tests/storetests/derby94_derby.properties;
100,Mamta A. Satoor,JDBC,0, add support insert function use jdbc updat resultset api, jdbc api introduc abil updat delet insert row resultset use method java program languag rather send sql command jira entri track insert row function use jdbc api,0,java/client/org/apache/derby/client/am/ResultSet.java;java/client/org/apache/derby/client/am/ResultSet.java;java/engine/org/apache/derby/impl/jdbc/EmbedResultSet.java;java/engine/org/apache/derby/loc/messages_en.properties;java/engine/org/apache/derby/loc/messages_pt_BR.properties;java/shared/org/apache/derby/shared/common/reference/SQLState.java;java/testing/org/apache/derbyTesting/functionTests/master/DerbyNetClient/jdk14/updatableResultSet.out;java/testing/org/apache/derbyTesting/functionTests/master/DerbyNetClient/updatableResultSet.out;java/testing/org/apache/derbyTesting/functionTests/master/jdk14/updatableResultSet.out;java/testing/org/apache/derbyTesting/functionTests/master/updatableResultSet.out;java/testing/org/apache/derbyTesting/functionTests/tests/lang/updatableResultSet.java;
117,Felipe Leme,Network Server,0, patch improv net servlet, hi minor enhanc net servlet chang cloudscap derbi bundl ad pt bt know languag bundl alreadi languag set java improv use trace directori init paramet use document use current valu shown user tri chang improv function handl request local instanc mozilla use instead separ countri languag show screen port server run ad new srv ort number messag key info send trunk patch chang felip,0,java/drda/org/apache/derby/drda/NetServlet.java;java/drda/org/apache/derby/loc/drda/servlet_en.properties;java/drda/org/apache/derby/loc/drda/servlet_pt_BR.properties;java/drda/org/apache/derby/loc/drda/servlet_de_DE.properties;java/drda/org/apache/derby/loc/drda/servlet_es.properties;java/drda/org/apache/derby/loc/drda/servlet_fr.properties;java/drda/org/apache/derby/loc/drda/servlet_it.properties;
122,Daniel John Debrunner,Test,0, suit jdk skip incorrectli se, sinc se super set jdk jdk test run se,0,
123,Geoff Soutter,SQL,0, derbi incorrectli round doubl valu insert numer, insert doubl valu field defin numer use prepar statement set doubl derbi may incorrectli round number exampl numer field doubl end valu databas work fine oracl databas problem occur doubl cannot repres exactli actual valu sql decim set core valu use big decim doubl construct big decim sql decim set width use valu set scale desir scale big decim round note big decim javadoc recommend doubl constructor avoid reason one fix appear chang sql decim set core valu doubl avoid use doubl constructor big decim use doubl string big decim string look would work expect doubl string special round abil convert back,0,java/engine/org/apache/derby/iapi/types/SQLDecimal.java;java/engine/org/apache/derby/iapi/types/SQLDouble.java;java/engine/org/apache/derby/iapi/types/SQLReal.java;java/engine/org/apache/derby/iapi/types/UserType.java;java/testing/org/apache/derbyTesting/functionTests/master/dml099.out;java/testing/org/apache/derbyTesting/functionTests/master/ejbql.out;java/testing/org/apache/derbyTesting/functionTests/master/floattypes.out;java/testing/org/apache/derbyTesting/functionTests/master/outparams.out;java/testing/org/apache/derbyTesting/functionTests/master/parameterMapping.out;
127,Thomas Browne,SQL,0, alias column recogn group order combin, work tri integr derbi mondrian rolap engin uncov bug derbi queri involv column alias group claus order claus exampl mondrian gener follow queri select store store countri store store state store store citi store store name store store type store store manag store store sqft store groceri sqft store frozen sqft store meat sqft store coffe bar store store street address store store group store store countri store store state store store citi store store name store store type store store manag store store sqft store groceri sqft store frozen sqft store meat sqft store coffe bar store store street address order store store countri store store state store store citi store store nam ewhich valid sql test queri outsid mondrian environ still receiv error column store store countri tabl list appear within join specif outsid scope join specif appear claus group list sql state error code howev remov one three element alias group order order use alias name queri work combin element caus problem ie follow queri work correctli select store store countri store store state store store citi store store name store store type store store manag store store sqft store groceri sqft store frozen sqft store meat sqft store coffe bar store store street address store store group store store countri store store state store store citi store store name store store type store store manag store store sqft store groceri sqft store frozen sqft store meat sqft store coffe bar store store street address order store store countri store store state store store citi store store nam eselect store store countri store store state store store citi store store name store store type store store manag store store sqft store groceri sqft store frozen sqft store meat sqft store coffe bar store store street address store store group store store countri store store state store store citi store store name store store type store store manag store store sqft store groceri sqft store frozen sqft store meat sqft store coffe bar store store street addr sselect store store countri store store state store store citi store store name store store type store store manag store store sqft store groceri sqft store frozen sqft store meat sqft store coffe bar store store street address store store order store store countri store store state store store citi store store nam eselect store store countri store store state store store citi store store name store store type store store manag store store sqft store groceri sqft store frozen sqft store meat sqft store coffe bar store store street address store store group store store countri store store state store store citi store store name store store type store store manag store store sqft store groceri sqft store frozen sqft store meat sqft store coffe bar store store street address order,0,java/engine/org/apache/derby/impl/sql/compile/OrderByColumn.java;java/engine/org/apache/derby/impl/sql/compile/ResultColumnList.java;java/engine/org/apache/derby/impl/sql/compile/TableName.java;java/engine/org/apache/derby/impl/sql/compile/sqlgrammar.jj;java/testing/org/apache/derbyTesting/functionTests/master/orderby.out;java/testing/org/apache/derbyTesting/functionTests/tests/lang/orderby.sql;
128,Kathey Marsden,Network Server,0, network server give npe sql except null argument error xbm, network server network server throw npe one argument sql except null reproduc tri creat databas root directori linux run secur manag trace came extra url sin jvm java issu network server throw npe one argument sql except null code argument variabl part messag object arg ce get argument int arg null amp amp lt arg length sqlerrmc arg string separ except seem null argument seem right error xbm directori sin jvm test db cannot creat error xbm directori sin jvm test db cannot creat org apach derbi iapi error standard except new except standard except java org apach derbi impl servic monitor persist servic impl run persist servic impl java java secur access control privileg nativ method org apach derbi impl servic monitor persist servic impl creat servic root persist servic impl java org apach derbi impl servic monitor base monitor boot servic base monitor java org apach derbi impl servic monitor base monitor creat persist servic base monitor java org apach derbi iapi servic monitor monitor creat persist servic monitor java org apach derbi impl jdbc emb connect creat databas emb connect java org apach derbi impl jdbc emb connect lt init gt emb connect java org apach derbi impl jdbc emb connect lt init gt emb connect java org apach derbi impl jdbc emb connect lt init gt emb connect java org apach derbi jdbc driver get new emb connect driver java org apach derbi jdbc driver connect driver java org apach derbi impl drda databas make connect databas java org apach derbi impl drda drda conn thread get conn databas name drda conn thread java org apach derbi impl drda drda conn thread verifi user id password drda conn thread java org apach derbi impl drda drda conn thread pars secchk drda conn thread java org apach derbi impl drda drda conn thread pars drda connect drda conn thread java org apach derbi impl drda drda conn thread exchang server attribut drda conn thread java org apach derbi impl drda drda conn thread session initi state drda conn thread java org apach derbi impl drda drda conn thread run drda conn thread java cleanup action complet gmt thread drda conn thread derbi daemon databas sin jvm test db drdaid fail creat databas sin jvm test db see next except detail gmt thread drda conn thread derbi daemon databas sin jvm test db drdaid directori sin jvm test db cannot creat gmt thread drda conn thread derbi daemon databas sin jvm test db drdaid nf fb fail creat databas sin jvm test db see next except detail gmt thread drda conn thread derbi daemon databas sin jvm test db drdaid nf fb nullnulljava lang null pointer except org apach derbi impl drda drda conn thread write sqlcagrp drda conn thread java org apach derbi impl drda drda conn thread write sqlcard drda conn thread java org apach derbi impl drda drda conn thread pars drda connect drda conn thread java org apach derbi impl drda drda conn thread exchang server attribut drda conn thread java org apach derbi impl drda drda conn thread session initi state drda conn thread java org apach derbi impl drda drda conn thread run drda conn thread java nulljava lang null pointer except org apach derbi impl drda drda conn thread write sqlcagrp drda conn thread java org apach derbi impl drda drda conn thread write sqlcard drda conn thread java org apach derbi impl drda drda conn thread pars drda connect drda conn thread java org apach derbi impl drda drda conn thread exchang server attribut drda conn thread java org apach derbi impl drda drda conn thread session initi state drda conn thread java org apach derbi impl drda drda conn thread run drda conn thread java,0,java/drda/org/apache/derby/impl/drda/DRDAConnThread.java;
129,Mamta A. Satoor,JDBC,0, derbi throw truncat error warn ca ting paramet constant char char bit datatyp data larg datatyp, derbi throw truncat except warn data larg cast constant paramet charact string bit string data type follow ij exampl constant big datatyp get cast toij gt valu cast hello char hel row selectedij gt valu cast char bit data row select follow code snippet use paramet jdbc program execut updat creat tabl ct clob follow formatt load data charact string data org apach derbi test function test util formatt repeat char notic prear statement bound length st con prepar statement insert ct valu cast varchar st set string data derbi throw except ps execut time charact paramet silent truncat st execut,0,java/drda/org/apache/derby/impl/drda/DRDAConnThread.java;java/engine/org/apache/derby/iapi/services/io/CounterOutputStream.java;java/engine/org/apache/derby/iapi/sql/ResultSet.java;java/engine/org/apache/derby/iapi/types/SQLBinary.java;java/engine/org/apache/derby/iapi/types/SQLBit.java;java/engine/org/apache/derby/iapi/types/SQLBlob.java;java/engine/org/apache/derby/iapi/types/SQLChar.java;java/engine/org/apache/derby/iapi/types/SQLVarbit.java;java/engine/org/apache/derby/impl/sql/execute/BasicNoPutResultSetImpl.java;java/engine/org/apache/derby/impl/sql/execute/NoRowsResultSetImpl.java;java/engine/org/apache/derby/impl/sql/execute/TemporaryRowHolderResultSet.java;java/shared/org/apache/derby/shared/common/reference/SQLState.java;java/testing/org/apache/derbyTesting/functionTests/master/LOB.out;java/testing/org/apache/derbyTesting/functionTests/master/Rllmodule1.out;java/testing/org/apache/derbyTesting/functionTests/master/Rllmodule2.out;java/testing/org/apache/derbyTesting/functionTests/master/Rllmodule3.out;java/testing/org/apache/derbyTesting/functionTests/master/Rllmodule4.out;java/testing/org/apache/derbyTesting/functionTests/master/RowLockIso.out;java/testing/org/apache/derbyTesting/functionTests/master/aggbuiltin.out;java/testing/org/apache/derbyTesting/functionTests/master/cast.out;java/testing/org/apache/derbyTesting/functionTests/master/dml083.out;java/testing/org/apache/derbyTesting/functionTests/master/dml149.out;java/testing/org/apache/derbyTesting/functionTests/master/heapscan.out;java/testing/org/apache/derbyTesting/functionTests/master/lockTable.out;java/testing/org/apache/derbyTesting/functionTests/master/readlocks.out;java/testing/org/apache/derbyTesting/functionTests/master/rlliso2multi.out;java/testing/org/apache/derbyTesting/functionTests/master/rlliso3multi.out;java/testing/org/apache/derbyTesting/functionTests/master/rollForwardRecovery.out;java/testing/org/apache/derbyTesting/functionTests/master/subqueryFlattening.out;java/testing/org/apache/derbyTesting/functionTests/master/triggerGeneral.out;java/testing/org/apache/derbyTesting/functionTests/master/update.out;java/testing/org/apache/derbyTesting/functionTests/master/updatelocksJDBC30.out;java/testing/org/apache/derbyTesting/functionTests/master/xaAnotherTest.out;java/testing/org/apache/derbyTesting/functionTests/master/xaOffline1.out;java/testing/org/apache/derbyTesting/functionTests/master/xaSimpleNegative.out;java/testing/org/apache/derbyTesting/functionTests/tests/lang/CastingTest.java;java/testing/org/apache/derbyTesting/functionTests/tests/lang/LockTableQuery.subsql;java/testing/org/apache/derbyTesting/functionTests/tests/lang/cast.sql;java/testing/org/apache/derbyTesting/functionTests/tests/store/LockTableQuery.subsql;
