issue_id,reporter,component,keywords,summary_proc,description_proc,Performance,files
892,Myrna van Lunteren,Test,0, add mechan specifi polici file individu function test, would nice abl specifi test specif polici file get handl similar exist properti get specifi test app properti file suit suit properti file file copi correct place note old function test har oppos junit test includ check properti call server polici file har jvm java name left polici file use network server renam derbi test polici file instanc use anywher present specif network server would nice could expand use remov default polici file use derbi test polici file function test util also current properti use run test traction probabl get pass run suit run list confirm work properti get document lt trunk gt java test readm htm,0,java/testing/org/apache/derbyTesting/functionTests/tests/derbynet/sysinfo_app.properties;java/testing/org/apache/derbyTesting/functionTests/tests/derbynet/sysinfo_withproperties_app.properties;java/testing/org/apache/derbyTesting/functionTests/tests/lang/copyfiles.ant;java/testing/org/apache/derbyTesting/functionTests/util/derby_tests.policy;java/testing/README.htm;java/testing/org/apache/derbyTesting/functionTests/harness/RunTest.java;java/testing/org/apache/derbyTesting/functionTests/harness/jvm.java;java/testing/org/apache/derbyTesting/functionTests/suites/build.xml;java/testing/org/apache/derbyTesting/functionTests/util/build.xml;java/testing/org/apache/derbyTesting/functionTests/util/copyfiles.ant;java/testing/org/apache/derbyTesting/functionTests/util/derby_tests.policy;java/testing/org/apache/derbyTesting/functionTests/util/useprocessfalse.policy;java/testing/org/apache/derbyTesting/functionTests/harness/RunTest.java;java/testing/org/apache/derbyTesting/functionTests/harness/jvm.java;java/testing/org/apache/derbyTesting/functionTests/tests/derbynet/NSinSameJVM.policy;java/testing/org/apache/derbyTesting/functionTests/tests/derbynet/OutBufferedStream.policy;java/testing/org/apache/derbyTesting/functionTests/tests/derbynet/build.xml;java/testing/org/apache/derbyTesting/functionTests/tests/derbynet/dataSourcePermissions_net.policy;java/testing/org/apache/derbyTesting/functionTests/tests/derbynet/getCurrentProperties.policy;java/testing/org/apache/derbyTesting/functionTests/tests/derbynet/sysinfo.policy;java/testing/org/apache/derbyTesting/functionTests/tests/derbynet/sysinfo_app.properties;java/testing/org/apache/derbyTesting/functionTests/tests/derbynet/sysinfo_withproperties.policy;java/testing/org/apache/derbyTesting/functionTests/tests/derbynet/sysinfo_withproperties_app.properties;java/testing/org/apache/derbyTesting/functionTests/tests/derbynet/testSecMec.policy;java/testing/org/apache/derbyTesting/functionTests/tests/jdbcapi/build.xml;java/testing/org/apache/derbyTesting/functionTests/tests/jdbcapi/secureUsers1.policy;java/testing/org/apache/derbyTesting/functionTests/tests/lang/build.xml;java/testing/org/apache/derbyTesting/functionTests/tests/lang/copyfiles.ant;java/testing/org/apache/derbyTesting/functionTests/tests/lang/errorStream.policy;java/testing/org/apache/derbyTesting/functionTests/util/derby_tests.policy;
903,Daniel John Debrunner,Test,0, remov use string byte string byte int int constructor test lead non portabl behaviour, constructor use java default platform encod convert byte string typic lead bug platform differ encod replac code use fix convers altern mechan call requir use comment requir org apach derbi test function test test jdbcapi blobclob blo borg apach derbi test function test test jdbcapi resultsetorg apach derbi test function test test lang coalesc testsorg apach derbi test function test test store stream column gener list use java search eclips refer constructor string byte string byte int int occurr java test,0,java/testing/org/apache/derbyTesting/functionTests/tests/jdbcapi/resultset.java;java/testing/org/apache/derbyTesting/functionTests/tests/lang/coalesceTests.java;java/testing/org/apache/derbyTesting/functionTests/master/j9_22/errorCode.out;java/testing/org/apache/derbyTesting/functionTests/master/j9_22/errorcode.out;java/testing/org/apache/derbyTesting/functionTests/tests/jdbcapi/blobclob4BLOB.java;java/testing/org/apache/derbyTesting/functionTests/tests/jdbcapi/resultset.java;java/testing/org/apache/derbyTesting/functionTests/tests/lang/coalesceTests.java;java/testing/org/apache/derbyTesting/functionTests/tests/store/streamingColumn.java;
904,Mike Matrigali,Test,0, big decim error diff derbyal lang procedur test run derbi net client jdk specif, derbi regress test failur follow test recent fail derbi build also fail ran fine havenot time narrow note separ master test jdk specif master could see start procedur jdk derbi net client derbynetmat derbynetmat del lt expect sql except big decim convers except convert overflow occur numer data type convers see attach throwabl gt expect sql except big decim convers except convert overflow occur numer data type convers see attach throwabl caus except class org apach derbi client convers except convert overflow occur numer data type convers del lt expect sql except invalid argument paramet index inout paramet gt expect sql except xn del lt expect sql except big decim convers except convert overflow occur numer data type convers see attach throwabl gt expect sql except big decim convers except convert overflow occur numer data type convers see attach throwabl caus except class org apach derbi client convers except convert overflow occur numer data type convers test fail end procedur jdk derbi net client derbynetmat derbynetmat,0,java/testing/org/apache/derbyTesting/functionTests/master/DerbyNetClient/jdk13/procedure.out;
918,Andreas Korneliussen,Test,0, introduc new test type run junit test current har, seem includ new unit test derbi need make new java class main method pars command line set testsuit run like java program basic run junit test test type java instead everi junit test go derbi test suit would propos differ strategi propos introduc new test type call junit current test type sql sql unit java multi demo unit junit use java org apach derbi test function test har run test lt test case class name gt junitto run junit test instead java org apach derbi test function test har run test lt anoth class main method gt java start test type junit run test class may simpli use thejunit textui test runner class main method take test case class name paramet junit textui test runner run test defin suit method test case class think strategi make easier integr new unit test current test suit sinc save troubl creat java class main method everi test,0,java/engine/org/apache/derby/impl/sql/execute/ScrollInsensitiveResultSet.java;java/testing/org/apache/derbyTesting/functionTests/harness/RunTest.java;java/testing/org/apache/derbyTesting/functionTests/harness/testtypes.properties;java/testing/org/apache/derbyTesting/functionTests/master/DerbyNetClient/SURTest.out;java/testing/org/apache/derbyTesting/functionTests/master/SURTest.out;java/testing/org/apache/derbyTesting/functionTests/suites/DerbyNet.exclude;java/testing/org/apache/derbyTesting/functionTests/suites/derbynetclientmats.runall;java/testing/org/apache/derbyTesting/functionTests/suites/jdbcapi.runall;java/testing/org/apache/derbyTesting/functionTests/tests/jdbcapi/ConcurrencyTest.java;java/testing/org/apache/derbyTesting/functionTests/tests/jdbcapi/ConcurrencyTest_app.properties;java/testing/org/apache/derbyTesting/functionTests/tests/jdbcapi/SURBaseTest.java;java/testing/org/apache/derbyTesting/functionTests/tests/jdbcapi/SURDataModelSetup.java;java/testing/org/apache/derbyTesting/functionTests/tests/jdbcapi/SURQueryMixTest.java;java/testing/org/apache/derbyTesting/functionTests/tests/jdbcapi/SURQueryMixTest_app.properties;java/testing/org/apache/derbyTesting/functionTests/tests/jdbcapi/SURTest.java;java/testing/org/apache/derbyTesting/functionTests/tests/jdbcapi/SURTest_app.properties;java/testing/org/apache/derbyTesting/functionTests/util/TestUtil.java;
924,David Van Couvering,JDBC,0, new jdbc metadata api get function need implement, implement return empti result set least compliant abl implement one,0,java/client/org/apache/derby/client/am/DatabaseMetaData.java;java/engine/org/apache/derby/catalog/SystemProcedures.java;java/engine/org/apache/derby/impl/jdbc/EmbedDatabaseMetaData.java;java/engine/org/apache/derby/impl/jdbc/EmbedDatabaseMetaData40.java;java/engine/org/apache/derby/impl/sql/catalog/DataDictionaryImpl.java;java/testing/org/apache/derbyTesting/functionTests/master/DerbyNetClient/jdk14/metadata.out;java/testing/org/apache/derbyTesting/functionTests/master/DerbyNetClient/metadata.out;java/testing/org/apache/derbyTesting/functionTests/master/DerbyNetClient/odbc_metadata.out;java/testing/org/apache/derbyTesting/functionTests/master/Upgrade_10_1_10_2.out;java/testing/org/apache/derbyTesting/functionTests/master/metadata.out;java/testing/org/apache/derbyTesting/functionTests/master/odbc_metadata.out;java/testing/org/apache/derbyTesting/functionTests/tests/jdbc4/TestDbMetaData.java;java/testing/org/apache/derbyTesting/functionTests/tests/jdbcapi/metadata_test.java;java/build/org/apache/derbyBuild/splitmessages.java;java/client/org/apache/derby/client/am/DatabaseMetaData.java;java/engine/org/apache/derby/loc/messages_en.properties;java/shared/org/apache/derby/shared/common/reference/SQLState.java;java/engine/org/apache/derby/impl/jdbc/EmbedDatabaseMetaData40.java;java/engine/org/apache/derby/impl/jdbc/metadata.properties;java/testing/org/apache/derbyTesting/functionTests/master/TestDbMetaData.out;java/testing/org/apache/derbyTesting/functionTests/tests/jdbc4/TestDbMetaData.java;
939,A B,SQL,0, null pointer except result set close time simpl queri use union intersect, set derbi languag log queri plan true attempt execut follow simpl queri use union intersect derbi return correct result return result throw null pointer except error also occur reproduc gt java dderbi languag log queri plan true org apach derbi tool ijand creat tabl int creat tabl int creat tabl int ij gt select union select intersect select row select error xj java except java lang null pointer except add data queri return correct result throw npe insert valu insert valu insert valu ij gt select union select intersect select row select error xj java except java lang null pointer except embed client stack trace shown suggest problem occur close result set embed java lang null pointer except org apach derbi impl sql execut rt real union result set statist get statement execut plan text real union result set statist java org apach derbi impl sql execut rt real sort statist get statement execut plan text real sort statist java org apach derbi impl sql execut rt run time statist impl get statement execut plan text run time statist impl java org apach derbi impl sql execut basic put result set impl finish rt basic put result set impl java org apach derbi impl sql execut sort result set finish sort result set java org apach derbi impl jdbc emb result set close emb result set java org apach derbi tool jdbc display util indent display result jdbc display util java org apach derbi tool jdbc display util display result jdbc display util java org apach derbi impl tool ij util main display result util main java org apach derbi impl tool ij util main catch util main java org apach derbi impl tool ij util main go util main java org apach derbi impl tool ij main go main java org apach derbi impl tool ij main main core main java org apach derbi impl tool ij main main main java org apach derbi tool ij main ij java client error sql state actual code point match expect code point java sql sql except actual code point match expect code point org apach derbi client sql except get sql except sql except java org apach derbi client result set close result set java org apach derbi tool jdbc display util indent display result jdbc display util java org apach derbi tool jdbc display util display result jdbc display util java org apach derbi impl tool ij util main display result util main java org apach derbi impl tool ij util main catch util main java org apach derbi impl tool ij util main go util main java org apach derbi impl tool ij main go main java org apach derbi impl tool ij main main core main java org apach derbi impl tool ij main main main java org apach derbi tool ij main ij java caus org apach derbi client disconnect except actual code point match expect code point org apach derbi client net repli throw syntax error repli java org apach derbi client net repli pars length match code point repli java org apach derbi client net net connect repli pars sqlcard net connect repli java org apach derbi client net net connect repli pars rdbcm mrepli net connect repli java org apach derbi client net net connect repli read local commit net connect repli java org apach derbi client net connect repli read local commit connect repli java org apach derbi client net net connect read local commit net connect java org apach derbi client connect read commit connect java org apach derbi client connect read auto commit connect java org apach derbi client result set read auto commit auto commit result set java org apach derbi client result set read close auto commit result set java org apach derbi client result set flow close auto commit auto commit result set java org apach derbi client result set close result set java org apach derbi client result set close result set java error xj derbi sql error sqlcode sqlstate xj sqlerrmc java lang null pointer except xx xj ujava sql sql except derbi sql error sqlcode sqlstate xj sqlerrmc java lang null pointer except xx xj org apach derbi client sql except get sql except sql except java org apach derbi client sql except get sql except sql except java org apach derbi client result set close result set java org apach derbi tool jdbc display util indent display result jdbc display util java org apach derbi tool jdbc display util display result jdbc display util java org apach derbi impl tool ij util main display result util main java org apach derbi impl tool ij util main catch util main java org apach derbi impl tool ij util main go util main java org apach derbi impl tool ij main go main java org apach derbi impl tool ij main main core main java org apach derbi impl tool ij main main main java org apach derbi tool ij main ij java,0,java/engine/org/apache/derby/impl/sql/execute/RealResultSetStatisticsFactory.java;java/engine/org/apache/derby/impl/sql/execute/SetOpResultSet.java;java/engine/org/apache/derby/loc/messages_en.properties;java/shared/org/apache/derby/shared/common/reference/SQLState.java;java/testing/org/apache/derbyTesting/functionTests/harness/Sed.java;java/testing/org/apache/derbyTesting/functionTests/suites/derbylang.runall;java/engine/org/apache/derby/impl/sql/execute/rts/RealSetOpResultSetStatistics.java;java/testing/org/apache/derbyTesting/functionTests/master/setOpPlan.out;java/testing/org/apache/derbyTesting/functionTests/tests/lang/setOpPlan.sql;java/testing/org/apache/derbyTesting/functionTests/harness/Sed.java;
961,Myrna van Lunteren,SQL,0, error includ xx resolv xx remov, case error come follow truncat error encount tri shrink char bit data xx resolv xx length messag make appear column call xx resolv xx howev string come sql binari java remov messag refer string master updat result set test lang concat test java refer derbi run updat result set gener messag stack trace saw org apach derbi iapi error standard except new except standard except java org apach derbi iapi type sql binari check host variabl sql binari java org apach derbi exe ac xbdfcxffff fb unknown sourc org apach derbi impl servic reflect direct call invok reflect gener class java org apach derbi impl sql execut row result set get next row core row result set java org apach derbi impl sql execut normal result set get next row core normal result set java org apach derbi impl sql execut dml write result set get next row core dml write result set java org apach derbi impl sql execut insert result set open insert result set java org apach derbi impl sql gener prepar statement execut gener prepar statement java org apach derbi impl jdbc emb statement execut statement emb statement java org apach derbi impl jdbc emb prepar statement execut statement emb prepar statement java org apach derbi impl jdbc emb prepar statement execut updat emb prepar statement java,0,java/engine/org/apache/derby/iapi/types/SQLBinary.java;java/engine/org/apache/derby/loc/messages.xml;java/shared/org/apache/derby/shared/common/reference/MessageId.java;java/engine/org/apache/derby/iapi/types/SQLBinary.java;java/testing/org/apache/derbyTesting/functionTests/tests/memory/BlobMemTest.java;java/testing/org/apache/derbyTesting/functionTests/tests/lang/concateTests.java;
965,Dag H. Wanvik,Network Client; Network Server,0, databas metadata method support result set concurr return wrong result network client, databas meta data method support result set concurr erroneouslyreturn fals network client argument combin cfthe attach repro program embed client return correctresult viz output org apach derbi jdbc client driver support result set concurr type forward concur read fals support result set concurr type forward concur updat fals support result set concurr type scroll insensit concur read fals support result set concurr type scroll insensit concur updat fals support result set concurr type scroll sensit concur read fals support result set concurr type scroll sensit concur updat falseorg apach derbi jdbc embed driver support result set concurr type forward concur read true support result set concurr type forward concur updat true support result set concurr type scroll insensit concur read true support result set concurr type scroll insensit concur updat fals support result set concurr type scroll sensit concur read fals support result set concurr type scroll sensit concur updat fals presum wrong releas version well,0,java/client/org/apache/derby/client/am/DatabaseMetaData.java;java/engine/org/apache/derby/impl/sql/catalog/metadata_net.properties;java/testing/org/apache/derbyTesting/functionTests/master/DerbyNetClient/jdk14/metadata.out;java/testing/org/apache/derbyTesting/functionTests/master/DerbyNetClient/metadata.out;java/testing/org/apache/derbyTesting/functionTests/master/DerbyNetClient/odbc_metadata.out;java/testing/org/apache/derbyTesting/functionTests/master/metadata.out;java/testing/org/apache/derbyTesting/functionTests/master/odbc_metadata.out;java/testing/org/apache/derbyTesting/functionTests/tests/jdbcapi/metadata_test.java;java/testing/org/apache/derbyTesting/functionTests/master/phaseTester.out;
966,Kathey Marsden,Network Client,0, creat prepar statement outsid global tran use client xa datasourc result sql except cannot set holdabl statement use global transact, creat prepar statement outsid global tran use xa datasourc result except statement use global xa transact derbi derbi may relev issu user note set holdabl connect close cursor commit seem taken affect sinc problem observ happen even set holdabl close cursor commit creat statement mayb anoth bug set holdabl close cursor commit ps creat seem affect outcom sure even honor mayb anoth bug test case import java sql connect import java sql prepar statement import java sql result set import java sql sql except import java sql statement import javax sql xa connect import javax transact xa xa except import javax transact xa xa resourc import javax transact xa xid import com ibm db jcc db xid class cursor hold problem public static prepar statement pstmt null public static void main string arg throw except org apach derbi jdbc client xa data sourc ds new org apach derbi jdbc client xa data sourc system println get connect ds set databas name sampl ds set trace file trace ds set connect attribut creat true conn ds get connect system println conn get meta data get databas product version prepar statement ps null tri system println creat tabl ps conn prepar statement creat tabl tab col int null ps execut updat system println done creat tabl conn commit catch sql except system println tabl alreadi exist conn commit xa connect pc ds get xa connect xa resourc xar pc get xa resourc xid xid creat xid connect conn pc get connect system println get holid return conn get holdabl conn set holdabl result set close cursor commit gt set affect select conn xar start xid xa resourc tmnoflag work conn select conn xar end xid xa resourc tmsuccess int prp xar prepar xid system println prp prp prp xa resourc xa ok xar commit xid fals privat static void work connect conn int deptno throw sql except statement stmt conn creat statement int cnt stmt execut updat insert tab valu deptno system println row affect cnt stmt close stmt null privat static void select connect conn int deptno throw sql except pstmt null pstmt conn prepar statement select tab result set rset pstmt execut queri rset next system println gt rset get string break static xid creat xid int bid throw xa except byte gid new byte gid byte byte bid new byte bid byte bid byte gtrid new byte byte bqual new byte system arraycopi gid gtrid system arraycopi bid bqual xid xid new db xid gtrid bqual return xid,0,java/client/org/apache/derby/client/am/Connection.java;java/client/org/apache/derby/client/am/DatabaseMetaData.java;java/client/org/apache/derby/client/am/SectionManager.java;java/client/org/apache/derby/client/am/Statement.java;java/client/org/apache/derby/client/net/NetConnection.java;java/client/org/apache/derby/client/net/NetDatabaseMetaData.java;java/drda/org/apache/derby/impl/drda/DRDAStatement.java;
972,Myrna van Lunteren,Test,0, test derbynet cs prep stmt prep stmt use mechan portabl encod, os classic bit jvm test derbynet cs prep stmt prep stmt java fail insert set ascii stream byte array obtain new string get byte retriev insert valu ok error return select show valu section test cs prep stmt ps set string column string byte ba new string column vcstring get byte int len ba length ps set ascii stream new byte array input stream ba len valu retriev use result set get string del lt got row column string column vcstring column lvcstring abcdef abcdef abcdef xxxxxx filter timestam pxxxxx gt got row column string column lvcstring abcdef abcdef abcdef xxxxxx filter timestam pxxxxx string column vcstring databas need replac encod neutral eg fix encod mechan test derbynet prep stmt java cs prep stmt java need check non portabl code,0,java/testing/org/apache/derbyTesting/functionTests/tests/derbynet/csPrepStmt.java;java/testing/org/apache/derbyTesting/functionTests/tests/derbynet/prepStmt.java;
989,Ole Solberg,Test,0, unit daemon servic unit fail intermitt ran time, signatur diff file unit unit daemon servic diff start daemon servic jdk unit unit del lt unit test daemon servic finish add gt ran time gt shut due unit test failur gt exit due time bomb test fail end daemon servic jdk unit unit http www multinet solberg public apach derbi limit test summari html sun os pc,0,java/engine/org/apache/derby/iapi/services/daemon/DaemonService.java;java/engine/org/apache/derby/impl/services/daemon/BasicDaemon.java;java/testing/org/apache/derbyTesting/unitTests/services/T_DaemonService.java;
990,Ole Solberg,Store; Test,0, store access sql fail incorrect index, ij gt distinct row tabl sinc space use index select count distinct spaceus signatur diff file derbyal encrypt storemat storemat access diff start access jdk storemat storemat del lt gt test fail end access jdk storemat storemat http www multinet solberg public apach derbi limit test summari html sun os sun sparc,0,java/testing/org/apache/derbyTesting/functionTests/master/access.out;java/testing/org/apache/derbyTesting/functionTests/tests/store/access.sql;
998,Myrna van Lunteren,Test,0, test jdbcapi sur test junit jdbcapi sur queri mix test junit run twice derbynetclientmat, test sur test junit sur queri mix test junit appear derbynetclientmat runal well jdbcapi runal unnecessarili run twice jdbcapi alreadi includ suit derbynetclientmat properti remov derbynetclientmat runal,0,java/testing/org/apache/derbyTesting/functionTests/suites/derbynetclientmats.runall;
