issue_id,reporter,component,keywords,summary_proc,description_proc,Performance,files
2817,Knut Anders Hatlen,Services,0, error messag deadlock contain less inform, error messag deadlock would look like error lock could obtain due deadlock cycl lock waiter lock row wait xid app select id grant xid lock row wait xid app select id grant xid select victim xid trunk deadlock would report asjava sql sql except lock could obtain due deadlock cycl lock waiter lock row wait xid org apach derbi impl servic lock lock space grant xid org apach derbi impl servic lock lock space da bf lock row wait xid org apach derbi impl servic lock lock space da bf grant xid org apach derbi impl servic lock lock space select victim xid org apach derbi impl servic lock lock space transact id fail statement shown,0,java/engine/org/apache/derby/impl/services/locks/Timeout.java;java/engine/org/apache/derby/impl/services/locks/Deadlock.java;
2818,Kristian Waagan,JDBC,0, rewrit clob updat reader constructor, fix derbi place current implement clob updat reader fail patch prepar mention issu also remov intern packag privat method emb clob replac singl one instead write method forward call underli intern clob method get intern clob return intern clob seem place sinc method get byte length belong emb clob also come warn use refer intern clob object requir caller take care second writabl belong emb clob either clob alway writabl unless databas connect read howev intern clob represent may read case emb clob must clone content creat writabl represent fix leav handl implement detail intern clob,0,java/engine/org/apache/derby/impl/jdbc/ClobUpdateableReader.java;java/engine/org/apache/derby/impl/jdbc/EmbedClob.java;
2824,Kristian Waagan,JDBC,0, improv error report fix whitespac format issu replac tab utf reader, plan follow chang utf reader improv error report hit utf decod error current utf data format except messag might also lead delet one helper method gener except one messag improv error report tri use reader close current io except messag remov trail space add newlin replac tab file space last point discuss argument file mix tab space still tab space prefer requir method indent want get fix branch cut make easier port fix trunk next make see like back port major fix class branch volunt sinc much els clob infrastructur chang recent seem like good time clean pleas rais concern soon possibl want veto chang plan commit tomorrow,0,java/engine/org/apache/derby/impl/jdbc/UTF8Reader.java;java/engine/org/apache/derby/impl/jdbc/UTF8Reader.java;java/engine/org/apache/derby/impl/jdbc/UTF8Reader.java;java/engine/org/apache/derby/impl/jdbc/UTF8Reader.java;
2827,Kristian Waagan,JDBC,0, renam clob stream control temporari clob, sinc origin submiss situat chang quit lot origin name longer fit well class chang temporari clob signal clob object live temporarili outsid databas true scenario except small clob store non stream object databas gener contract soon chang made clob becom temporari clob unless user reinsert clob updat row updat clob execut chang lost also true clob creat connect creat clob explicitli insert databas lost,0,java/engine/org/apache/derby/impl/jdbc/ClobStreamControl.java;java/engine/org/apache/derby/impl/jdbc/ClobUtf8Writer.java;java/engine/org/apache/derby/impl/jdbc/EmbedClob.java;java/engine/org/apache/derby/impl/jdbc/TemporaryClob.java;java/testing/org/apache/derby/impl/jdbc/BiggerTemporaryClobTest.java;java/testing/org/apache/derby/impl/jdbc/SmallTemporaryClobTest.java;
2862,A B,Test,0, paramet meta data jdbc fail weme prevent rest suit complet, addtion paramet meta data jdbc unit test derbi suit fail weme turn new paramet meta data jdbc test fail follow error fail invok suit java lang class def found error java sql paramet meta data prevent suit continu thu result gather might good disabl test weme least short term rest suit run cleanli sure complet solut temporari one test fix,0,java/testing/org/apache/derbyTesting/functionTests/tests/jdbcapi/ParameterMetaDataJdbc30Test.java;java/testing/org/apache/derbyTesting/functionTests/tests/jdbcapi/_Suite.java;
2868,Knut Anders Hatlen,Documentation,0, build txt mention junit jar list jar instal tool java, build txt contain paragraph note follow step section thisdocu follow derbi sourc tool java empti jar derbi sourc tool java geronimo spec servlet rc jar derbi sourc tool java jakarta oro jar derbi sourc tool java javacc jar derbi sourc tool java osgi jar sinc section mention instal junit jar derbi sourc tool java list also includ junit jar also sinc paragraph refer section locat section current,0,BUILDING.txt;java/engine/org/apache/derby/impl/jdbc/EmbedClob.java;java/engine/org/apache/derby/impl/jdbc/UTF8Reader.java;
2870,Ole Solberg,Test,0, iepnegativetest es sql fail new canon need, see http dbtg thresher com derbi test daili jvm test limit test summari html lt method gt iepnegativetest es sql lt method gt lt signatur gt lt error xj excepci en gt lt de java extout nodir dat file directori java io file found except gt error xj excepci en gt lt de java extout nodir dat system cannot find path specifi java io file found except lt signatur gt,0,java/testing/org/apache/derbyTesting/functionTests/master/iepnegativetests_ES.out;java/testing/org/apache/derbyTesting/functionTests/master/j9_foundation/iepnegativetests_ES.out;java/testing/org/apache/derbyTesting/functionTests/tests/i18n/copyfiles.ant;java/testing/org/apache/derbyTesting/functionTests/tests/i18n/iepnegativetests_ES_sed.properties;
2874,Manjula Kutty,Network Server,0, network server accept connect default secur manag ipv machin, run test ipv machin use jar default secur manag follow find question start server like java org apach derbi drda network server control start server start follow command secur manag instal use basic server secur polici apach derbi network server beta start readi accept connect port gmt think server use default secur manag tri get conenct though ijgot follow error messag access deni java net socket permiss accept resolv java secur access control except access deni java net socket permiss accept resolv java secur access control check permiss access control java java lang secur manag check permiss secur manag java java lang secur manag check accept secur manag java java net server socket impl accept server socket java java net server socket accept server socket java org apach derbi impl drda client thread run unknown sourc java secur access control privileg access control java org apach derbi impl drda client thread run unknown sourc derbi properti file like thisderbi databas sql author truederbi connect requir authent truederbi infolog append truederbi authent provid builti nderbi stream error log sever level derbi languag log statement text true user definitionsderbi user user pass,0,java/drda/org/apache/derby/drda/NetworkServerControl.java;java/drda/org/apache/derby/drda/server.policy;java/drda/org/apache/derby/drda/template.policy;
2879,Daniel John Debrunner,SQL,0, creat tabl maintain collat charact type, creat tabl select tablenam sy systabl data creat column tablenam collat base upon user schema type sy systabl tablenam collat uc basic requir behaviour verifi sql standard sr sinc collat attribut type seem logic collat maintain creat fix keep collat system column caus problem though would way recreat tabl regular creat tabl say schema dump recreat use ddlutil think critic fix releas would lead chang behaviour applic,0,java/engine/org/apache/derby/catalog/types/TypeDescriptorImpl.java;java/engine/org/apache/derby/iapi/types/StringDataValue.java;java/engine/org/apache/derby/impl/sql/compile/CreateTableNode.java;java/engine/org/apache/derby/loc/messages.xml;java/shared/org/apache/derby/shared/common/reference/SQLState.java;java/testing/org/apache/derbyTesting/functionTests/tests/lang/CollationTest.java;
2885,Knut Anders Hatlen,JDBC,0, wrong connect object use emb connect clear lob map, think two bug emb connect clear lob map check lob hash map non null check root connect lob hash map call getlob hm obj clear regardless whether hash map creat hash map object even though need subsequ transact connect perform cleanup object,1,java/engine/org/apache/derby/impl/jdbc/EmbedConnection.java;java/engine/org/apache/derby/impl/jdbc/EmbedConnection.java;
2892,Thomas Niessen,SQL,0, close resultset retriev larg byte valu network server releas lock, issu derbi http issu apach org jira brows derbi test attach derbi show lock releas everyth fine use derbi would think regress bug output sysinfo java informationen java version java anbiet sun microsystem inc java home work applic develop java jdk se jre java klassenpfad work applic develop derbi lib derbi jar work applic develop derbi lib derbynet jar work applic develop derbi lib derbycli jar work applic develp derbi lib derbytool jar name de betriebssystem window xp architektur de betriebssystem betriebssystemvers java benutzernam thoma niessen java benutzerausgangsverzeichni dokument und einstellungen thoma niessen java benutzerverzeichni work applic develop derbi java specif name java platform api specificationjava specif version derbi informationen jre jdbc java se jdbc work applic develop derbi lib derbi jar work applic develop derbi lib derbytool jar work applic develop derbi lib derbynet jar work applic develop derbi lib derbycli jar informationen zur ndereinstellung aktuel ndereinstellung deutsch deutschland de de es wurd unterst tzung die folgend ndereinstellung gefunden cs version es wurd unterst tzung die folgend ndereinstellung gefunden de de version es wurd unterst tzung die folgend ndereinstellung gefunden es version es wurd unterst tzung die folgend ndereinstellung gefunden fr version es wurd unterst tzung die folgend ndereinstellung gefunden hu version es wurd unterst tzung die folgend ndereinstellung gefunden version es wurd unterst tzung die folgend ndereinstellung gefunden ja jp version es wurd unterst tzung die folgend ndereinstellung gefunden ko kr version es wurd unterst tzung die folgend ndereinstellung gefunden pl version es wurd unterst tzung die folgend ndereinstellung gefunden pt br version es wurd unterst tzung die folgend ndereinstellung gefunden ru version es wurd unterst tzung die folgend ndereinstellung gefunden zh cn version es wurd unterst tzung die folgend ndereinstellung gefunden zh tw version,0,java/client/org/apache/derby/client/am/Cursor.java;java/client/org/apache/derby/client/net/NetCursor.java;java/client/org/apache/derby/client/am/BlobLocatorInputStream.java;java/client/org/apache/derby/client/am/ClobLocatorInputStream.java;java/client/org/apache/derby/client/am/ClobLocatorReader.java;java/testing/org/apache/derbyTesting/functionTests/tests/jdbcapi/LargeDataLocksTest.java;java/client/org/apache/derby/client/am/Blob.java;java/client/org/apache/derby/client/am/BlobLocatorInputStream.java;java/client/org/apache/derby/client/am/Clob.java;java/client/org/apache/derby/client/am/ClobLocatorInputStream.java;java/client/org/apache/derby/client/am/ClobLocatorReader.java;java/client/org/apache/derby/client/am/Cursor.java;java/client/org/apache/derby/client/am/ResultSet.java;java/client/org/apache/derby/client/am/UpdateSensitiveLOBLocatorInputStream.java;java/testing/org/apache/derbyTesting/functionTests/tests/jdbcapi/LargeDataLocksTest.java;
2893,Daniel John Debrunner,Test,0, insert updat succeed permiss grant, grant revok test assert method assert insert privileg etc formtri execut command catch sql except sqle privileg assert sql state els fail note fail assert tri portion sql execut statement work privileg fals test incorrectli pass statement succe ad fail assert revis like privileg fail expect insert permiss tabl two insert updat caus test fail fixtur fail indic statement succe even permiss grant could test problem need investig assert assert insert privileg asser updat privileg comment stop test fail,0,java/testing/org/apache/derbyTesting/functionTests/tests/lang/GrantRevokeTest.java;java/testing/org/apache/derbyTesting/functionTests/tests/lang/GrantRevokeTest.java;java/testing/org/apache/derbyTesting/functionTests/tests/lang/GrantRevokeTest.java;
2902,James Alan Shepherd,SQL,0, ident start fail, creat tabl ident start fail ident start succe guess pars sql problem absolut valu appear held long quit long enough posit end,0,java/engine/org/apache/derby/impl/sql/compile/sqlgrammar.jj;java/testing/org/apache/derbyTesting/functionTests/master/autoincrement.out;java/testing/org/apache/derbyTesting/functionTests/tests/lang/autoincrement.sql;
2910,Mamta A. Satoor,SQL,0, simpl string oper node bind express method gener charact string cast requir set correct collat, follow queri run error run territori base databas select tablenam sy systabl upper current date tablenam cast node gener top current date creat charact string type set collat charact string type henc alway end get default collat deriv implicit collat type uc basic sound right might place gener cast node creat charact string type check collat set correctli,0,java/engine/org/apache/derby/impl/sql/compile/ConcatenationOperatorNode.java;java/engine/org/apache/derby/impl/sql/compile/LikeEscapeOperatorNode.java;java/engine/org/apache/derby/impl/sql/compile/SimpleStringOperatorNode.java;java/engine/org/apache/derby/impl/sql/compile/TernaryOperatorNode.java;java/testing/org/apache/derbyTesting/functionTests/tests/lang/CollationTest.java;
2911,Knut Anders Hatlen,Services,0, implement buffer manag use java util concurr class, indic buffer manag bottleneck type multi user load instanc ander morken wrote comment derbi separ tabl index thread remov latch content lock wait equat found org apach derbi impl servic cach clock find releas caus time content synchron lock set lock object lock set unlock might indic appli next push would interest see scalabl perform buffer manag exploit concurr util ad java se,1,java/engine/org/apache/derby/impl/services/cache/CacheEntry.java;java/engine/org/apache/derby/impl/services/cache/ClockPolicy.java;java/engine/org/apache/derby/impl/services/cache/ConcurrentCache.java;java/engine/org/apache/derby/impl/services/cache/ClockPolicy.java;java/engine/org/apache/derby/impl/services/cache/ReplacementPolicy.java;java/engine/org/apache/derby/impl/services/cache/BackgroundCleaner.java;java/engine/org/apache/derby/impl/services/cache/ClockPolicy.java;java/engine/org/apache/derby/impl/services/cache/ClockPolicy.java;java/engine/org/apache/derby/impl/services/cache/ConcurrentCache.java;java/engine/org/apache/derby/impl/services/cache/ReplacementPolicy.java;java/engine/org/apache/derby/impl/services/cache/ConcurrentCache.java;java/engine/org/apache/derby/impl/services/cache/CacheEntry.java;java/engine/org/apache/derby/impl/services/cache/ClockPolicy.java;java/engine/org/apache/derby/impl/services/cache/ConcurrentCache.java;java/engine/org/apache/derby/impl/services/cache/ClockPolicy.java;java/engine/org/apache/derby/iapi/services/cache/CacheManager.java;java/engine/org/apache/derby/impl/services/build.xml;java/engine/org/apache/derby/impl/services/cache/BackgroundCleaner.java;java/engine/org/apache/derby/impl/services/cache/CacheEntry.java;java/engine/org/apache/derby/impl/services/cache/ClockPolicy.java;java/engine/org/apache/derby/impl/services/cache/ConcurrentCache.java;java/engine/org/apache/derby/impl/services/cache/ClockPolicy.java;java/engine/org/apache/derby/iapi/services/cache/CacheFactory.java;java/engine/org/apache/derby/iapi/services/cache/CacheManager.java;java/engine/org/apache/derby/iapi/store/access/TransactionController.java;java/engine/org/apache/derby/iapi/store/raw/Transaction.java;java/engine/org/apache/derby/iapi/store/raw/data/DataFactory.java;java/engine/org/apache/derby/iapi/store/raw/xact/RawTransaction.java;java/engine/org/apache/derby/impl/store/access/RAMTransaction.java;java/engine/org/apache/derby/impl/store/raw/data/BaseDataFileFactory.java;java/engine/org/apache/derby/impl/store/raw/xact/Xact.java;java/engine/org/apache/derby/impl/services/build.xml;java/engine/org/apache/derby/impl/services/cache/CacheEntry.java;java/engine/org/apache/derby/impl/services/cache/ConcurrentCache.java;java/engine/org/apache/derby/impl/services/cache/ConcurrentCacheFactory.java;java/engine/org/apache/derby/impl/services/build.xml;java/engine/org/apache/derby/impl/services/cache/CacheEntry.java;java/engine/org/apache/derby/impl/services/cache/ClockPolicy.java;java/engine/org/apache/derby/impl/services/cache/ConcurrentCache.java;java/engine/org/apache/derby/impl/services/cache/ConcurrentCacheFactory.java;java/engine/org/apache/derby/impl/services/cache/ReplacementPolicy.java;java/engine/org/apache/derby/impl/services/cache/CacheEntry.java;java/engine/org/apache/derby/impl/services/cache/ConcurrentCache.java;java/engine/org/apache/derby/modules.properties;java/engine/org/apache/derby/iapi/services/cache/CacheManager.java;java/engine/org/apache/derby/impl/services/cache/ClockPolicy.java;java/engine/org/apache/derby/impl/services/cache/ClockPolicy.java;java/engine/org/apache/derby/impl/services/cache/ConcurrentCache.java;java/engine/org/apache/derby/impl/services/cache/ConcurrentCacheFactory.java;java/engine/org/apache/derby/impl/services/cache/BackgroundCleaner.java;java/engine/org/apache/derby/impl/services/cache/ClockPolicy.java;java/engine/org/apache/derby/impl/services/cache/ConcurrentCache.java;java/engine/org/apache/derby/impl/services/cache/ReplacementPolicy.java;java/engine/org/apache/derby/impl/services/cache/ConcurrentCache.java;java/engine/org/apache/derby/impl/services/cache/ConcurrentCache.java;java/engine/org/apache/derby/impl/services/cache/ConcurrentCache.java;java/engine/org/apache/derby/impl/services/cache/ConcurrentCache.java;
2935,Knut Anders Hatlen,Network Server,0, ddm reader read length code point decod long integ incorrectli, ddm reader read length code point contain code decod long integ byte array code broken sinc use int oper long oper decod long might encod use four six eight byte sinc derbi current alway use four byte encod bug expos current code,0,java/drda/org/apache/derby/impl/drda/DDMReader.java;
2937,Daniel John Debrunner,SQL,0, error second third argument substr function rang data concaten group queri, creat tabl char null date null dc decim insert valu aaa date select substr max cast char cast dc char bug group result error select ij gt bug error second third argument substr function rang note result set meta data seem indic ij column width bug four instead,0,java/engine/org/apache/derby/impl/sql/compile/AggregateNode.java;java/testing/org/apache/derbyTesting/functionTests/tests/lang/GroupByTest.java;java/engine/org/apache/derby/impl/sql/compile/AggregateNode.java;java/engine/org/apache/derby/impl/sql/compile/QueryTreeNode.java;java/engine/org/apache/derby/impl/sql/compile/ResultColumn.java;java/engine/org/apache/derby/impl/sql/compile/ResultSetNode.java;
2946,Mamta A. Satoor,SQL,0, soft upgrad mode metadata queri get compil sy schema caus problem futur releas derbi, emb databas meta data implement metadata queri implement metadata queri emb databas meta data check soft upgrad mode get prepar queri follow code soft upgrad mode get prepar queri use system tabl queri name net els tri use store prepar statement soft upgrad mode henc need get metadata sql metadata properti file metadata net properti string queri text get queri descript queri name net get emb connect prepar meta data statement queri text catch throwabl throw handl except run soft upgrad mode go sysstat caus metadata queri run whatev current schema may rather sy schema problem derbi releas soft upgard collat alway uc basic henc collat mismatch happen derbi user creat databas territori base collat databas soft upgrad mode say derbi metadata queri run problem run user schema soft upgrad mode go sysstat instead compil metadata queri current schema current schema user schema charact string liter metadata queri get collat type territori base compar charact string colunm sy tabl collat type uc basic end get compil error metadata queri next releas fix problem one solut may somehow make current compil schema sy run metadata queri soft upgrad mode,0,java/engine/org/apache/derby/impl/sql/conn/GenericLanguageConnectionContext.java;java/testing/org/apache/derbyTesting/functionTests/tests/upgradeTests/Changes10_4.java;java/testing/org/apache/derbyTesting/functionTests/tests/upgradeTests/UpgradeRun.java;java/testing/org/apache/derbyTesting/functionTests/tests/upgradeTests/_Suite.java;
