issue_id,reporter,component,keywords,summary_proc,description_proc,Performance,files
1885,Jean T. Anderson,Miscellaneous,0, sourc distribut rc includ derbi log file, db derbi src releas candid built includ derbi log file db derbi src derbi log db derbi src java demo toursdb derbi log file size ls derbi log rw rw jta jta sep derbi log ls java demo toursdb derbi log rw rr jta jta sep java demo toursdb derbi log releas candid need rebuilt would good remov derbi log file harm anyth consum littl space db derbi lib db derbi bin distribut file,0,tools/release/build.xml;
1891,Myrna van Lunteren,Network Client,0, error refer non exist codepoint secktn need correct, error network protocol except secktn return connect termin net sectkn return org apach derbi drda client net net connect java search drda spec could find secktn find sectkn think error messag get chang sectkn non exist codepoint seem refer xn secktn return affect follow english messag properti file brazilian messag properti file document sql state find master probabl go although import enough hold releas target myrna,0,java/engine/org/apache/derby/loc/messages_en.properties;java/engine/org/apache/derby/loc/messages_pt_BR.properties;
1894,Yip Ng,SQL,0, sqlstate occur qualifi column synonym order claus, sqlstate occur qualifi column synonym order claus synonym declar differ schema ij version ij gt connect jdbc derbi wombat creat true ij gt creat schema test row insert updat deletedij gt creat schema test row insert updat deletedij gt creat tabl test testtabl id bigint null row insert updat deletedij gt creat synonym test testtabl test testtabl row insert updat deletedij gt set schema test row insert updat deletedij gt select testtabl id testtabl id row selectedij gt set schema test row insert updat deletedij gt select testtabl id testtabl id row selectedij gt select testtabl id testtabl order testtabl id error testtabl expos tabl name scope appear ij gt,0,java/engine/org/apache/derby/impl/sql/compile/FromBaseTable.java;java/testing/org/apache/derbyTesting/functionTests/master/synonym.out;java/testing/org/apache/derbyTesting/functionTests/tests/lang/synonym.sql;
1899,Andrew McIntyre,Build tools,0, sourc distribut miss mani file includ file, sourc distribut miss top level bin maven directori well build txt readm index html publish api overview html also tool directori miss releas build xml addit tool test derbi contain complet set derbi jar remov src distribut,0,tools/release/build.xml;
1900,Rajesh Kartha,Demos/Scripts,0, script bin distribut execut permiss, script bin directori distribut execut permiss dir list rw rr rajeshk rd dblookrw rr rajeshk rd dblook batrw rr rajeshk rd derbi common batrw rr rajeshk rd derbi common shrw rr rajeshk rd ijrw rr rajeshk rd ij bat issu rais list earlierhttp www nabbl com question script bin directori derbi instal htmlbut look fulli resolv,0,tools/release/build.xml;tools/release/build.xml;
1909,Bryan Pendleton,SQL,0, alter tabl drop column need updat gran ted column privileg, alter tabl drop column use drop column tabl need updat gran ted column privileg tabl follow behavior need provid drop column need automat revok privileg grant column privileg grant column tabl need adjust due chang column posit number problem fix follow addit cleanup step occur check disabl drop column sql author mode need remov comment alter tabl constant action need revis test lang altert drop column sql move altert sql altert drop column sql altert drop column delet search jira issu number code find relev place chang,0,java/engine/org/apache/derby/iapi/sql/dictionary/DataDictionary.java;java/engine/org/apache/derby/impl/sql/catalog/DataDictionaryImpl.java;java/engine/org/apache/derby/impl/sql/compile/sqlgrammar.jj;java/engine/org/apache/derby/impl/sql/execute/AlterTableConstantAction.java;java/storeless/org/apache/derby/impl/storeless/EmptyDictionary.java;java/testing/org/apache/derbyTesting/functionTests/master/altertable.out;java/testing/org/apache/derbyTesting/functionTests/master/altertableDropColumn.out;java/testing/org/apache/derbyTesting/functionTests/tests/lang/altertable.sql;java/testing/org/apache/derbyTesting/functionTests/tests/lang/altertableDropColumn.sql;
1921,Rick Hillegas,Documentation,0, bring statu file date, statu file stale vote taken sinc februari mention develop trunk label committ list stale,0,STATUS;STATUS;
1922,Rajesh Kartha,Documentation,0, readm html framework mention derbi client minor typo exampl html, readm html file framework mention jcc driver noth derbycli also demo program simpl exampl html minor issu typo section next run simpl app demo derbi client mode step classpath mention found class path derbi client librari db jcc jar com ibm db jcc db driver found show jcc info instead derbi client,0,frameworks/readme.html;
1925,Suresh Thalamati,Test,0, add encryt databas test case upgrad test, add encrypt un encrypt databas encrypt encrypt databas test case upgrad test pleas see derbi detail encrypt featur encrytpion test case ad run test execut use jar file upgrad test mix old version derbi class jar file new class run code line use class caus boot time error databas encrypt kind mix differ version class support see derbi,0,java/testing/org/apache/derbyTesting/functionTests/tests/upgradeTests/UpgradeTester.java;
1953,Yip Ng,Documentation; SQL,0, make claus mode db sql creat trigger statement option, accord sql standard section lt trigger definit gt syntax rule item neither row statement specifi statement implicit row statement,0,java/demo/toursdb/ToursDB_schema.sql;java/demo/toursdb/toursdb_readme.html;java/testing/org/apache/derbyTesting/functionTests/master/DerbyNet/ieptests.out;java/testing/org/apache/derbyTesting/functionTests/master/DerbyNet/jdk16/ieptests.out;java/testing/org/apache/derbyTesting/functionTests/master/DerbyNet/synonym.out;java/testing/org/apache/derbyTesting/functionTests/master/DerbyNet/syscat.out;java/testing/org/apache/derbyTesting/functionTests/master/DerbyNet/xml_general.out;java/testing/org/apache/derbyTesting/functionTests/master/DerbyNetClient/ieptests.out;java/testing/org/apache/derbyTesting/functionTests/master/DerbyNetClient/jdk14/syscat.out;java/testing/org/apache/derbyTesting/functionTests/master/DerbyNetClient/jdk16/ieptests.out;java/testing/org/apache/derbyTesting/functionTests/master/DerbyNetClient/synonym.out;java/testing/org/apache/derbyTesting/functionTests/master/DerbyNetClient/syscat.out;java/testing/org/apache/derbyTesting/functionTests/master/DerbyNetClient/xml_general.out;java/testing/org/apache/derbyTesting/functionTests/master/altertable.out;java/testing/org/apache/derbyTesting/functionTests/master/altertableDropColumn.out;java/testing/org/apache/derbyTesting/functionTests/master/autoincrement.out;java/testing/org/apache/derbyTesting/functionTests/master/checkToursDB.out;java/testing/org/apache/derbyTesting/functionTests/master/dblook_test.out;java/testing/org/apache/derbyTesting/functionTests/master/dropTable.out;java/testing/org/apache/derbyTesting/functionTests/master/grantRevoke.out;java/testing/org/apache/derbyTesting/functionTests/master/grantRevokeDDL.out;java/testing/org/apache/derbyTesting/functionTests/master/grantRevokeDDL2.out;java/testing/org/apache/derbyTesting/functionTests/master/identifier.out;java/testing/org/apache/derbyTesting/functionTests/master/ieptests.out;java/testing/org/apache/derbyTesting/functionTests/master/j9_22/procedureInTrigger.out;java/testing/org/apache/derbyTesting/functionTests/master/j9_foundation/grantRevokeDDL.out;java/testing/org/apache/derbyTesting/functionTests/master/jdk16/grantRevokeDDL2.out;java/testing/org/apache/derbyTesting/functionTests/master/jdk16/procedureInTrigger.out;java/testing/org/apache/derbyTesting/functionTests/master/jdk16/releaseCompileLocks.out;java/testing/org/apache/derbyTesting/functionTests/master/predicatesIntoViews.out;java/testing/org/apache/derbyTesting/functionTests/master/procedureInTrigger.out;java/testing/org/apache/derbyTesting/functionTests/master/refActions.out;java/testing/org/apache/derbyTesting/functionTests/master/releaseCompileLocks.out;java/testing/org/apache/derbyTesting/functionTests/master/renameTable.out;java/testing/org/apache/derbyTesting/functionTests/master/schemas.out;java/testing/org/apache/derbyTesting/functionTests/master/synonym.out;java/testing/org/apache/derbyTesting/functionTests/master/syscat.out;java/testing/org/apache/derbyTesting/functionTests/master/triggerBeforeTrig.out;java/testing/org/apache/derbyTesting/functionTests/master/triggerGeneral.out;java/testing/org/apache/derbyTesting/functionTests/master/triggerRecursion.out;java/testing/org/apache/derbyTesting/functionTests/master/triggerRefClause.out;java/testing/org/apache/derbyTesting/functionTests/master/xml_general.out;java/testing/org/apache/derbyTesting/functionTests/tests/jdbcapi/prepStmtMetaData.java;java/testing/org/apache/derbyTesting/functionTests/tests/lang/altertable.sql;java/testing/org/apache/derbyTesting/functionTests/tests/lang/altertableDropColumn.sql;java/testing/org/apache/derbyTesting/functionTests/tests/lang/autoincrement.sql;java/testing/org/apache/derbyTesting/functionTests/tests/lang/dropTable.sql;java/testing/org/apache/derbyTesting/functionTests/tests/lang/grantRevoke.java;java/testing/org/apache/derbyTesting/functionTests/tests/lang/grantRevokeDDL.sql;java/testing/org/apache/derbyTesting/functionTests/tests/lang/grantRevokeDDL2.sql;java/testing/org/apache/derbyTesting/functionTests/tests/lang/identifier.sql;java/testing/org/apache/derbyTesting/functionTests/tests/lang/predicatesIntoViews.sql;java/testing/org/apache/derbyTesting/functionTests/tests/lang/procedureInTrigger.sql;java/testing/org/apache/derbyTesting/functionTests/tests/lang/refActions.sql;java/testing/org/apache/derbyTesting/functionTests/tests/lang/releaseCompileLocks.sql;java/testing/org/apache/derbyTesting/functionTests/tests/lang/renameTable.sql;java/testing/org/apache/derbyTesting/functionTests/tests/lang/schemas.sql;java/testing/org/apache/derbyTesting/functionTests/tests/lang/streams.java;java/testing/org/apache/derbyTesting/functionTests/tests/lang/synonym.sql;java/testing/org/apache/derbyTesting/functionTests/tests/lang/syscat.sql;java/testing/org/apache/derbyTesting/functionTests/tests/lang/triggerBeforeTrig.sql;java/testing/org/apache/derbyTesting/functionTests/tests/lang/triggerGeneral.sql;java/testing/org/apache/derbyTesting/functionTests/tests/lang/triggerRecursion.sql;java/testing/org/apache/derbyTesting/functionTests/tests/lang/triggerRefClause.sql;java/testing/org/apache/derbyTesting/functionTests/tests/lang/triggerStream.java;java/testing/org/apache/derbyTesting/functionTests/tests/lang/updatableResultSet.java;java/testing/org/apache/derbyTesting/functionTests/tests/lang/userDefMethods.java;java/testing/org/apache/derbyTesting/functionTests/tests/lang/xml_general.sql;java/testing/org/apache/derbyTesting/functionTests/tests/tools/dblook_makeDB.sql;java/testing/org/apache/derbyTesting/functionTests/tests/tools/dblook_makeDB_2.sql;java/testing/org/apache/derbyTesting/functionTests/tests/tools/ieptests.sql;java/testing/org/apache/derbyTesting/functionTests/tests/upgradeTests/UpgradeTester.java;java/testing/org/apache/derbyTesting/functionTests/util/ProcedureTest.java;java/tools/org/apache/derby/impl/tools/dblook/DB_Trigger.java;java/engine/org/apache/derby/impl/sql/compile/sqlgrammar.jj;java/testing/org/apache/derbyTesting/functionTests/master/db2Compatibility.out;java/testing/org/apache/derbyTesting/functionTests/master/triggerGeneral.out;java/testing/org/apache/derbyTesting/functionTests/tests/lang/db2Compatibility.sql;java/testing/org/apache/derbyTesting/functionTests/tests/lang/triggerGeneral.sql;
1956,Knut Anders Hatlen,Network Client,0, remov stale code statement class client driver, statement paramet meta data contain flag call escap procedur call result flag might function alway fals use mani statement make code harder read remov flag code execut flag true would simplifi code make maintain,0,java/build/org/apache/derbyBuild/splitmessages.java;java/client/org/apache/derby/client/am/CallableStatement.java;java/client/org/apache/derby/client/am/ParameterMetaData.java;java/client/org/apache/derby/client/am/PreparedStatement.java;java/client/org/apache/derby/client/am/Statement.java;java/engine/org/apache/derby/loc/messages_en.properties;java/engine/org/apache/derby/loc/messages_pt_BR.properties;java/shared/org/apache/derby/shared/common/reference/SQLState.java;
1958,Mike Matrigali,Store,0, improv xsdg error print contain actual oper file name, current error give enough inform know contain problem error xsdg meta data containerorg apach derbi impl store raw data raf contain cd could beaccess,0,java/engine/org/apache/derby/impl/store/raw/data/InputStreamContainer.java;java/engine/org/apache/derby/impl/store/raw/data/RAFContainer.java;java/engine/org/apache/derby/loc/messages.xml;java/testing/org/apache/derbyTesting/functionTests/tests/lang/ErrorCodeTest.java;
1963,Daniel John Debrunner,Tools,0, routin paramet name display dblook escap, use sql creat function delimit paramet name creat function fred param one integ return integerlanguag java paramet style java extern name fred foo dblook output creat function statement paramet name without quot creat function app fred param one integ return integerlanguag java paramet style javaread sql data call null inputextern name fred foo use output dblook creat function result function differ paramet name,0,java/engine/org/apache/derby/catalog/types/RoutineAliasInfo.java;java/testing/org/apache/derbyTesting/functionTests/master/DerbyNet/dblook_test_net.out;java/testing/org/apache/derbyTesting/functionTests/master/DerbyNet/dblook_test_net_territory.out;java/testing/org/apache/derbyTesting/functionTests/master/DerbyNetClient/dblook_test_net.out;java/testing/org/apache/derbyTesting/functionTests/master/DerbyNetClient/dblook_test_net_territory.out;java/testing/org/apache/derbyTesting/functionTests/master/cast.out;java/testing/org/apache/derbyTesting/functionTests/master/dblook_test.out;java/testing/org/apache/derbyTesting/functionTests/master/dblook_test_territory.out;java/testing/org/apache/derbyTesting/functionTests/tests/tools/dblook_makeDB.sql;
1974,Daniel John Debrunner,Test,0, junit test requir sql author mode use differ databas default one, sinc databas use unit world singl databas two mode work sure test need yet sql author prop test actual test set properti realli need databas think,0,java/testing/org/apache/derbyTesting/functionTests/tests/lang/PrepareExecuteDDL.java;java/testing/org/apache/derbyTesting/functionTests/tests/lang/_Suite.java;java/testing/org/apache/derbyTesting/junit/JDBC.java;java/testing/org/apache/derbyTesting/junit/TestConfiguration.java;
1987,Daniel John Debrunner,Test,0, add order entri applic system perform test toolkit, order entri oe oltp applic toolkit base upon tpc specif claim valid implement tpc specif use mainli forth databas schema amp popul rule logic busi transact http www tpc org tpcc oe set drive amp display busi transact separ actual implement allow differ implement compar perform derbi featur case implementationswould perform logic function requir tpc need strict implement exampleth new order number obtain defin way tpc derbi could use gener key perform thesam logic function test two way would lead see perform problem gener key exampl possibl implement busi transact direct client execut sql statement directli hold onto prepar statement lifetim client procedur client execut procedur per busi transact eod implement use jdbc eod updat result set posit updat etc option includ use trigger use gener key etc possibl valu display result transact noth text html servlet js ps etc also load data could support differ option load without contraint place load use insert statement load use import load use import result set class oe allow amount data load initi vari easili set warehousescal factor warehous creat databas size warehous databas size roughli allow databas rang gb easili creat gener setup would oe could use function test perform test stress test seen toolkit hope also oe could expand beyond tpc spec exampl ad imag blo bs descript clo bs product item tabl ad trigger send email variou action addit would intend test derbi function real world oltp applic top level packag java test would org apach derbi test system test oe,1,java/testing/build.xml;java/testing/org/apache/derbyTesting/system/oe/build.xml;tools/ant/properties/dirs.properties;
1988,Knut Anders Hatlen,Test,0, convert jdbc test jdbc except java unit, test jdbc except written unit like style could easili convert unit,0,java/testing/org/apache/derbyTesting/functionTests/suites/DerbyNetClient.exclude;java/testing/org/apache/derbyTesting/functionTests/suites/jdbc40.runall;java/testing/org/apache/derbyTesting/functionTests/tests/jdbc4/README.html;java/testing/org/apache/derbyTesting/functionTests/tests/jdbc4/TestJDBC40Exception.java;java/testing/org/apache/derbyTesting/functionTests/tests/jdbc4/_Suite.java;
1989,Knut Anders Hatlen,Test,0, convert jdbc test db meta data java unit, rewrit test unit use util method ad derbi,0,java/testing/org/apache/derbyTesting/functionTests/master/TestDbMetaData.out;java/testing/org/apache/derbyTesting/functionTests/suites/DerbyNetClient.exclude;java/testing/org/apache/derbyTesting/functionTests/suites/jdbc40.runall;java/testing/org/apache/derbyTesting/functionTests/tests/jdbc4/JDBC40TranslationTest.java;java/testing/org/apache/derbyTesting/functionTests/tests/jdbc4/README.html;java/testing/org/apache/derbyTesting/functionTests/tests/jdbc4/TestDbMetaData.java;java/testing/org/apache/derbyTesting/functionTests/tests/jdbc4/_Suite.java;java/testing/org/apache/derbyTesting/junit/JDBC.java;
1991,Knut Anders Hatlen,JDBC,0, mislead stack trace except rais jdbc embed driver, embed driver rais sql except stack trace alwayssay creat sql except factori wrap arg transport across drda correct point sql except factori get sql except set stack traceof sql except stack trace non sql except causedit one probabl done mimic behaviour emb sql except overrid print stack trace achiev thesam later code ad ferri argument drda code createda dummi except old code interpret non sql exceptionwhos stack trace use main except therefor allexcept stack trace dummi except creat inwrap arg transport across drda think best solut set stack trace explicitli noteven sql except caus non sql except emb sql except overrid print stack trace throwabl java init caus get caus way preserveth origin stack trace sinc sql except jdbc haveinit caus get caus reason jdbc driver shouldmim emb sql except workaround method,0,java/engine/org/apache/derby/impl/jdbc/SQLExceptionFactory40.java;java/testing/org/apache/derbyTesting/functionTests/master/jdk16/closed.out;java/testing/org/apache/derbyTesting/functionTests/master/jdk16/releaseCompileLocks.out;
2003,Knut Anders Hatlen,Test,0, use lower wait timeout blob clob blob test, test case wait second timeout test lock clob test lock long row clob test lock blob test lock long row blob sinc run embed network client mode blob clob blob test spend eight minut wait timeout therefor would good set method lower timeout tear reset test jdbc except show could achiev,0,java/testing/org/apache/derbyTesting/functionTests/tests/jdbcapi/BlobClob4BlobTest.java;java/testing/org/apache/derbyTesting/junit/DatabasePropertyTestSetup.java;
2008,A B,SQL,0, null pointer except ltrim rtrim argument substr call group claus, follow queri fail syntax error function allow group express fail null pointer except codelin creat tabl dt vc varchar insert dt valu select substr vc dt group substr vc result trunk java lang null pointer except org apach derbi impl sql compil ternari oper node equival ternari oper node java org apach derbi impl sql compil group list find group column group list java org apach derbi impl sql compil verifi aggreg express visitor skip children verifi aggreg express visitor java org apach derbi impl sql compil ternari oper node accept ternari oper node java org apach derbi impl sql compil result column accept result column java org apach derbi impl sql compil queri tree node vector accept queri tree node vector java org apach derbi impl sql compil select node bind express select node java org apach derbi impl sql compil subqueri bind express subqueri java org apach derbi impl sql compil list bind express list java org apach derbi impl sql compil select node bind express select node java org apach derbi impl sql compil dml statement node bind express dml statement node java org apach derbi impl sql compil dml statement node bind dml statement node java org apach derbi impl sql compil cursor node bind cursor node java org apach derbi impl sql gener statement prep minion gener statement java org apach derbi impl sql gener statement prepar gener statement java org apach derbi impl sql conn gener languag connect context prepar intern statement gener languag connect context java org apach derbi impl jdbc emb statement execut emb statement java org apach derbi impl jdbc emb statement execut emb statement java,0,java/engine/org/apache/derby/impl/sql/compile/TernaryOperatorNode.java;java/testing/org/apache/derbyTesting/functionTests/master/groupBy.out;java/testing/org/apache/derbyTesting/functionTests/tests/lang/groupBy.sql;
2016,Christian d&#39;Heureuse,SQL,0, array index bound except coalesc aggreg function, follow statement produc array index bound except creat tabl integ select coalesc max workaround valu coalesc select max stack trace gmt boot derbi version apach softwar foundat apach derbi instanc faa databas directori temp sy temp derbi test err db databas class loader start derbi databas classpath gmt thread main main xid sessionid databas temp sy temp derbi test err db drdaid null cleanup action start gmt thread main main xid sessionid databas temp sy temp derbi test err db drdaid null fail statement select coalesc max java lang array index bound except org apach derbi impl servic bytecod bc method pop stack unknown sourc org apach derbi impl servic bytecod bc method call method unknown sourc org apach derbi impl sql compil result column list gener core unknown sourc org apach derbi impl sql compil project restrict node gener minion unknown sourc org apach derbi impl sql compil project restrict node gener unknown sourc org apach derbi impl sql compil scroll insensit result set node gener unknown sourc org apach derbi impl sql compil cursor node gener unknown sourc org apach derbi impl sql compil statement node gener unknown sourc org apach derbi impl sql gener statement prep minion unknown sourc org apach derbi impl sql gener statement prepar unknown sourc org apach derbi impl sql conn gener languag connect context prepar intern statement unknown sourc org apach derbi impl jdbc emb statement execut unknown sourc org apach derbi impl jdbc emb statement execut unknown sourc org apach derbi impl tool ij ij execut immedi unknown sourc org apach derbi impl tool ij util main catch unknown sourc org apach derbi impl tool ij util main go unknown sourc org apach derbi impl tool ij main go unknown sourc org apach derbi impl tool ij main main core unknown sourc org apach derbi impl tool ij main main unknown sourc org apach derbi tool ij main unknown sourc,0,java/engine/org/apache/derby/impl/sql/compile/CoalesceFunctionNode.java;java/testing/org/apache/derbyTesting/functionTests/tests/lang/CoalesceTest.java;
2018,Christian d&#39;Heureuse,SQL,0, null pointer except creat view valu null, follow statement produc null pointer except creat view valu null stack trace gmt boot derbi version apach softwar foundat apach derbi instanc databas directori temp sy temp derbi test err db databas class loader start derbi databas classpath gmt thread main main xid sessionid databas temp sy temp derbi test err db drdaid null cleanup action start gmt thread main main xid sessionid databas temp sy temp derbi test err db drdaid null fail statement creat view valu nul ljava lang null pointer except org apach derbi impl sql catalog syscolumn row factori make row unknown sourc org apach derbi impl sql catalog data dictionari impl add descriptor array unknown sourc org apach derbi impl sql execut creat view constant action execut constant action unknown sourc org apach derbi impl sql execut misc result set open unknown sourc org apach derbi impl sql gener prepar statement execut unknown sourc org apach derbi impl jdbc emb statement execut statement unknown sourc org apach derbi impl jdbc emb statement execut unknown sourc org apach derbi impl jdbc emb statement execut unknown sourc org apach derbi impl tool ij ij execut immedi unknown sourc org apach derbi impl tool ij util main catch unknown sourc org apach derbi impl tool ij util main go unknown sourc org apach derbi impl tool ij main go unknown sourc org apach derbi impl tool ij main main core unknown sourc org apach derbi impl tool ij main main unknown sourc org apach derbi tool ij main unknown sourc,0,java/engine/org/apache/derby/impl/sql/compile/CreateViewNode.java;java/testing/org/apache/derbyTesting/functionTests/master/views.out;java/testing/org/apache/derbyTesting/functionTests/tests/lang/views.sql;
2022,Daniel John Debrunner,Test,0, jdbcapi lob stream test run client embed suit method give reason, essenti document decis made make life easier subsequ deveop tri understand code use test embed,0,java/testing/org/apache/derbyTesting/functionTests/tests/jdbcapi/LobStreamsTest.java;
