issue_id,reporter,component,keywords,pre_sum,summary,pre_des,description,des-1,des-2,des-3,des-4,des-5,files,Surprising
2490,Siddharth Wagle,ambari-server,0,Issues with setup ldap, issu setup ldap,I got this blow-up (when bind anon was either false or I just pressed returnBind anonymously true/false (false):====================Review Settings====================authentication.ldap.primaryUrl: my.ldap:389authentication.ldap.secondaryUrl: asdauthentication.ldap.useSSL: falseauthentication.ldap.usernameAttribute: uidauthentication.ldap.baseDn: basednauthorization.userRoleName: userauthorization.adminRoleName: adminauthentication.ldap.bindAnonymously: falseTraceback (most recent call last):File '/usr/sbin/ambari-server.py'  line 3047  in &lt;module&gt;main()File '/usr/sbin/ambari-server.py'  line 2891  in mainsetup_ldap()File '/usr/sbin/ambari-server.py'  line 2353  in setup_ldapprint('%s: %s' % (property  ldap_property_value_mapproperty))KeyError: 'authentication.ldap.managerDn', got blow blow bind anon either fals press returnBind return bind anonym true fals true fals fals review fals review set authent ldap primaryUrl set authent ldap primari url ldap authent ldap secondaryUrl ldap authent ldap secondari url asdauthent ldap useSSL asdauthent ldap use SSL falseauthent ldap usernameAttribute falseauthent ldap usernam attribut uidauthent ldap baseDn uidauthent ldap base Dn basednauthor userRoleName basednauthor user role name userauthor adminRoleName userauthor admin role name adminauthent ldap bindAnonymously adminauthent ldap bind anonym falseTraceback fals traceback recent call last file last file usr sbin ambari server py usr sbin ambari server py line lt modul gt main file lt modul gt main file usr sbin ambari server py usr sbin ambari server py line mainsetup_ldap file mainsetup_ldap file usr sbin ambari server py usr sbin ambari server py line setup_ldapprint setup_ldapprint properti ldap_property_value_mapproperty KeyError ldap_property_value_mapproperty key error authent ldap managerDn authent ldap manag Dn,0,0,0,0,0,0,1 
2498,Oleksandr Diachenko,ambari-server,0,Cleanup setup https flow, cleanup setup http flow,Expected flow:[root@localhost ~]# ambari-server setup-httpsUsing python /usr/bin/python2.6Setting up HTTPS properties...Do you want to configure HTTPS [y/n] (y)?SSL port (8443) ? Please enter path to Certificate: /some/path/on/my/host/server.crtPlease enter path to Private Key: /some/path/on/my/host/server.keyPlease enter password for Private Key:Importing and saving certificate...done.NOTE: Reset Ambari Server to apply changes ('ambari-server restart|stop|start')Ambari Server 'HTTPS setup' completed successfully. Exiting., expect flow root localhost flow root localhost ambari server ambari server setup httpsUsing setup http use python usr bin python set usr bin python set HTTPS properti properti want configur HTTPS SSL SSL port pleas enter path certif certif path host server crtPlease path host server crt pleas enter path privat key key path host server keyPlease path host server key pleas enter password privat key import key import save certif done NOTE certif done NOTE reset ambari server appli chang ambari server ambari server restart stop start ambari restart stop start ambari server HTTPS HTTPS setup setup complet success success exit exit,0,0,0,0,0,0,1 
2515,Jaimin D Jetly,ambari-web,0,Cannot add property mapred.task.tracker.task-controller, cannot add properti mapr task tracker task control mapr task tracker task control,,,0,0,0,0,0,0,0 
2517,Siddharth Wagle,ambari-agent,0,Decommission data node not working in secure mode, decommiss data node not work secur mode,Decommission datanode does not do kinit before refresh., decommiss datanod not kinit refresh refresh,0,0,0,0,0,0,1 
2522,Siddharth Wagle,ambari-agent,0,Zookeeper smoke test failing in secure cluster, zookeep smoke test fail secur cluster,Zookeeper smoke test failing in secure cluster, zookeep smoke test fail secur cluster,0,0,0,0,0,0,1 
2525,Dmitry Lysnichenko,ambari-server,0,Add helpful message when not able to download jdk with setup options for the user to be able to specify the jdk., add help messag not abl download jdk setup option user abl specifi jdk jdk,Add helpful message when not able to download jdk with setup options for the user to be able to specify the jdk., add help messag not abl download jdk setup option user abl specifi jdk jdk,0,0,0,0,0,0,0 
2532,Siddharth Wagle,ambari-agent,0,Incorrect permission on taskcontroller.cfg, incorrect permiss taskcontrol cfg taskcontrol cfg,/etc/conf/hadoop/taskcontroller.cfgIn secure mode permissions are set to '400'., etc conf hadoop taskcontrol cfgIn etc conf hadoop taskcontrol cfg secur mode permiss set,0,0,0,0,0,0,0 
2534,Sumit Mohanty,ambari-server,0,Some memory configs are set to -1 in Ambari, memori config set ambari,Some memory configs are set to -1 in ambari-mapred.cluster.reduce.memory.mb-mapred.jobtracker.maxtasks.per.job-mapred.cluster.max.reduce.memory.mb-mapred.cluster.map.memory.mb-mapred.job.map.memory.mb-mapred.job.reduce.memory.mb-mapred.cluster.max.map.memory.mbModify the stack definition to put default values as appropriate., memori config set ambari mapr cluster reduc memori mb mapr jobtrack maxtask per job mapr cluster max reduc memori mb mapr cluster map memori mb mapr job map memori mb mapr job reduc memori mb mapr cluster max map memori mbModify ambari mapr cluster reduc memori mb mapr jobtrack maxtask per job mapr cluster max reduc memori mb mapr cluster map memori mb mapr job map memori mb mapr job reduc memori mb mapr cluster max map memori mb modifi stack definit put default valu appropri appropri,0,0,0,0,0,0,0 
2542,Nate Cole,ambari-server,0,Custom Repo URL cannot be set when non-root, custom repo URL cannot set non root non root,The first iteration for creating custom repo URL persisted the new URL to disk. This poses a problem when running Ambari as non-root because the file system is owned by root. Change the implementation to save the override in the metainfo table., first iter creat custom repo URL persist new URL disk disk pose problem run ambari non root non root file system own root root chang implement save overrid metainfo tabl tabl,0,0,0,0,0,0,0 
2545,Dmitry Lysnichenko,ambari-agent,0,Regression: Agent external hostname is not verified during bootstrap with no warnings, regress regress agent extern hostnam not verifi bootstrap no warn,When confirming hosts using external addresses bootstrapping should be failed immediately and a warning should be logged. Right now this functionality is broken  neither warning in log nor failing immediately present, confirm host use extern address bootstrap fail immedi warn log log right function broken neither warn log nor fail immedi present,0,0,0,0,0,0,0 
2556,Dmitry Lysnichenko,ambari-server,0,Ctrl+C during ambari-server setup prints out a python stack trace, ctrl ctrl ambari server ambari server setup print python stack trace,We should be able to catch KeyBoardInterrupt in ambari-server main and print a useful message like:'Aborting ... Keyboard Interrupt.' and avoid the stack trace for the user., abl catch KeyBoardInterrupt key board interrupt ambari server ambari server main print use messag like abort like abort keyboard interrupt interrupt avoid stack trace user user,0,0,0,0,0,0,0 
2568,Dmitry Lysnichenko,ambari-agent,0,Setup LDAP does not validate true/false response, setup LDAP not valid true fals true fals respons,Garbage responses to true/false questions just pass thru. Notice below  just put in garbage for Use SSL and that's what it would have written.Need validation to confirm they enter either 1) return to accept default or 2) the word true or 3) the word false. Else  inform the user'Property must be 'true' or 'false'.' and ask again.Secondary URL :Use SS &#91;true/false&#93; (false): asdUser name attribute* (uid):Base DN* :Property cannot be blank.Base DN* : asdBind anonymously* true/false (false):Manager DN* :asdEnter Manager Password*:Re-enter password:Passwords do not matchEnter Manager Password*:Re-enter password:====================Review Settings====================authentication.ldap.primaryUrl: my.url:849authentication.ldap.useSSL: asdauthentication.ldap.usernameAttribute: uid, garbag respons true fals true fals question pass thru thru notic put garbag use SSL would written need written need valid confirm enter either return accept default word true word fals fals els inform user properti user properti must true true fals fals ask secondari secondari URL use use SS true fals true fals fals fals asdUser asd user name attribut attribut uid base uid base DN DN properti properti cannot blank base blank base DN DN asdBind asd bind anonym anonym true fals true fals fals manag fals manag DN DN asdEnter asd enter manag password enter password enter password password password password not matchEnter match enter manag password enter password enter password review password review set authent ldap primaryUrl set authent ldap primari url url authent ldap useSSL url authent ldap use SSL asdauthent ldap usernameAttribute asdauthent ldap usernam attribut uid,0,0,0,0,0,0,0 
2578,Dmitry Lysnichenko,ambari-server,0,Using another user for ambari server user create a local group for the ambari server user with same name., use anoth user ambari server user creat local group ambari server user name name,Using an ambari-qa user (that is a ldap user and he has hadoop set up as a primary ldap group) [root@va21 ldap]# id ambari-qauid=524(ambari-qa) gid=522(hadoop) groups=522(hadoop)causes ambari-server setup to create an ambari-qa local group (at /etc/group). ambari-qa:x:601:ambari-qa[root@va21 ldap]# id ambari-qauid=524(ambari-qa) gid=522(hadoop) groups=522(hadoop) 601(ambari-qa)Ldap users and groups are transparent for ambari-server  it starts well.The problem is that additional group is created., use ambari qa ambari qa user ldap user hadoop set primari ldap group group root va root va ldap ldap id ambari qauid ambari qa ambari qauid ambari qa gid hadoop gid hadoop group hadoop caus group hadoop caus ambari server ambari server setup creat ambari qa ambari qa local group etc group etc group ambari qa ambari qa root va ambari qa ambari qa root va ldap ldap id ambari qauid ambari qa ambari qauid ambari qa gid hadoop gid hadoop group hadoop group hadoop ambari qa ldap ambari qa ldap user group transpar ambari server ambari server start well well problem addit group creat creat,0,0,0,0,0,0,0 
2585,Aleksandr Kovalenko,ambari-web,0,Host Check report show hosts without issues, host check report show host without issu,Report contains hosts  which don't have issues  but should show 'A space delimited list of hosts which have issues'., report contain host issu show space delimit list host issu issu,0,0,0,0,0,0,0 
2590,Xi Wang,null,0,JS Error when deleting a widget after sorting it on remove/edit sign, JS error delet widget sort remov edit remov edit sign,,,0,0,0,0,0,0,0 
2594,Siddharth Wagle,ambari-agent,0,HDP installation fails due to puppet syntax error, HDP instal fail due puppet syntax error,namenode_host is not an hash or array when accessing it with 0 at /var/lib/ambari-agent/puppet/modules/hdp/manifests/params.pp:70 on node host1., namenode_host not hash array access var lib ambari agent puppet modul hdp manifest param pp var lib ambari agent puppet modul hdp manifest param pp node host host,0,0,0,0,0,0,0 
2595,Andrii Tkach,ambari-web,0,Properties of the same name cannot be added to different custom site.xml's, properti name cannot ad differ custom site xml site xml,Steps (Installer Wizard):Go to 'Customize Services' page.Select 'HDFS' tab.Add custom property 'xxx' to 'Custom core-site.xml' panel.Try add custom property 'xxx' to 'Custom hdfs-site.xml' panel.Result:Custom property can not be added to 'Custom hdfs-site.xml' panel (see attachment).Steps (Ambari monitoring UI):Go to 'Customize Services' page.Select 'HDFS' tab.Add custom property to 'Custom core-site.xml' panel (for example  'install-test-core-site').Continue and end hadoop installation.Go to 'Services' page.Select 'MapReduce' tab.Try add custom property 'install-test-core-site' to 'Custom mapred-site.xml' panel.Result:Custom property can not be added to 'Custom mapred-site.xml' panel (see attachment)., step instal instal wizard Go wizard Go custom custom servic servic page select page select HDFS HDFS tab add tab add custom properti xxx xxx custom custom core site xml core site xml panel tri panel tri add custom properti xxx xxx custom custom hdf site xml hdf site xml panel result custom panel result custom properti not ad custom custom hdf site xml hdf site xml panel see attach step attach step ambari ambari monitor UI Go UI Go custom custom servic servic page select page select HDFS HDFS tab add tab add custom properti custom custom core site xml core site xml panel exampl instal test core site continu instal test core site continu end hadoop instal Go instal Go servic servic page select page select MapReduce map reduc tab tri tab tri add custom properti instal test core site instal test core site custom custom mapr site xml mapr site xml panel result custom panel result custom properti not ad custom custom mapr site xml mapr site xml panel see attach attach,0,0,0,0,0,ambari-web/app/views/common/configs/services_config.js;,0 
2600,Antonenko Alexander,ambari-web,0,Add Quick Links (Web UI) for Oozie  Hue  Nagios  Ganglia, add quick link web web UI UI oozi hue nagio ganglia,There are no quick links for Oozie. Similarly  some other services also are missing the quick links., no quick link oozi oozi similarli servic also miss quick link link,0,0,0,0,0,0,0 
2605,Siddharth Wagle,ambari-agent,0,'kdestroy' not required for zookeeper smoke test, kdestroy kdestroy not requir zookeep smoke test,zookeeper smoke test passes without having to 'kdestroy' on the user running the smoke test., zookeep smoke test pass without kdestroy kdestroy user run smoke test test,0,0,0,0,0,0,0 
2608,Sumit Mohanty,ambari-server,0,WebHCat and Oozie services does not start on RHEL5 with enabled security because of 'CRITICAL: Error doing kinit for nagios', WebHCat web cat oozi servic not start RHEL RHEL enabl secur CRITICAL CRITICAL error kinit nagio nagio,FE only has support to provide single path for kinit. As Ambari supports mixed OS deployment it cannot be guaranteed that kinit exists at the same path on all nodes. FE should allow providing a set of look-up paths for kinit as well as the BE should support a set of default lookup paths., FE support provid singl path kinit kinit ambari support mix OS deploy cannot guarante kinit exist path node node FE allow provid set look look path kinit well support set default lookup path path,0,0,0,0,0,0,1 
2612,Dmytro Shkvyra,ambari-agent; ambari-server,0,Rename agent.fqdn property in ambari.props to server.fqdn, renam agent fqdn agent fqdn properti ambari prop ambari prop server fqdn server fqdn,lets just rename agent -&gt; server, let renam agent gt gt server,0,0,0,0,0,0,0 
2613,Aleksandr Kovalenko,ambari-web,0,Host Checks: truncation on checked processes makes it difficult to know the actual processes in conflict, host check check truncat check process make difficult know actual process conflict,Processes are truncated too short and can't really tell what's in conflict. Since there is a lot of space on the right (in fact  the hostname column is too far to the left compared to other sections)  we should display more characters (with hover tooltip showing full text)., process truncat short realli tell conflict conflict sinc lot space right fact hostnam column far left compar section section display charact hover tooltip show full text text,0,0,0,0,0,0,0 
2614,Andrii Tkach,ambari-web,0,Popover with config name goes beyond the container, popov config name goe beyond contain,See attachecd screenshot., see attachecd screenshot screenshot,0,0,0,0,0,0,0 
2619,Antonenko Alexander,ambari-web,0,Wrong info on Services > Summary tab for DataNodes Live  TaskTrackers Live  RegionServers live, wrong info servic summari tab DataNodes data node live TaskTrackers task tracker live RegionServers region server live,1. Install cluster2. On the host with SNameNode  we also have a region server3. Stop snamenode component on that host4. Services &gt; hbase &gt; summary shows region server is not liveAlso after stopping DataNode or TaskTracker  component status changes are not reflected on Services &gt; summary tab, instal cluster cluster host SNameNode name node also region server server stop snamenod compon host host servic gt gt hbase gt gt summari show region server not liveAlso live also stop DataNode data node TaskTracker task tracker compon statu chang not reflect servic gt gt summari tab,0,0,0,0,0,0,1 
2631,Oleksandr Diachenko,ambari-server,0,Host cleanup left two packages(ambari-log4j  libconfuse), host cleanup left two packag ambari log packag ambari log libconfus libconfus,,,0,0,0,0,0,0,1 
2632,Xi Wang,null,0,Dashboard Widgets: 'hover to show details' experience is jarring, dashboard widget widget hover show detail detail experi jar,,,0,0,0,0,0,0,1 
2633,Sumit Mohanty,null,0,Reset the latest stack version for 1.2.5, reset latest stack version,Reset the latest stack version for 1.2.5, reset latest stack version,0,0,0,0,0,0,1 
2635,Srimanth Gunturi,ambari-web,0,Perf: Service summary view inefficiently binds to host components, perf perf servic summari view ineffici bind host compon,In ambari-web/app/views/main/service/info/summary.js#hostComponentsUpd()  is called per each hostComponent's host and master property change. On a 150 node cluster  we get like 300 calls just for this method.Due to this  service_mapper  which usually maps in 600ms  takes now 5.8s., ambari web app view main servic info summari js hostComponentsUpd ambari web app view main servic info summari js host compon upd call per hostComponent host compon host master properti chang chang node cluster get like call method due method due service_mapper usual map ms take,0,0,0,0,0,0,1 
2636,Xi Wang,null,0,Dashboard Metrics legend size increased unexpectedly on mouseover from line space, dashboard metric legend size increas unexpectedli mouseov line space,This happened in a very specific situation.1. Put mouse on the line space around a metric widget.2. hover on the widget with mouse down.Result:The legend show up as a strange bigger size., happen specif situat situat put mous line space around metric widget widget hover widget mous result result legend show strang bigger size size,0,0,0,0,0,0,0 
2640,Aleksandr Kovalenko,ambari-web,0,Going back to Customize Services page from the Install page resets certain directory values, go back custom servic page instal page reset certain directori valu,Steps to reproduce: Install using non-default directories Upon install failure  go back to Customize Services page from the left nav. Certain directories (NN dirs  SNN dir  DN dirs  Oozie Data Dir  ZK Dir  etc) are reverted back to the default. Other parameters are not reverted back., step reproduc reproduc instal use non default non default directori upon instal failur go back custom servic page left nav nav certain directori NN NN dir SNN dir DN dir oozi data dir ZK dir etc etc revert back default default paramet not revert back back,0,0,0,0,0,0,1 
