issue_id,reporter,component,keywords,pre_sum,summary,pre_des,description,des-1,des-2,des-3,des-4,des-5,files,Surprising
92,Eric Yang,ambari-agent,0,Agent should retry heartbeat message  if controller did not receive the heartbeat, agent retri heartbeat messag control not receiv heartbeat,If the heartbeat was not received correctly by the controller  then it should retry., heartbeat not receiv correctli control retri retri,0,0,0,0,0,0,0 
192,Ramya Sunil,null,0,Check for NN safemode during restarts, check NN safemod restart,There is no checks for safemode when we reconfigure the cluster., no check safemod reconfigur cluster cluster,0,0,0,0,0,CHANGES.txt;hmc/puppet/modules/hdp-hadoop/manifests/hdfs/service_check.pp;,1 
198,Jitendra Nath Pandey,ambari-server,0,Dependency of templeton on hcat client, depend templeton hcat client,hcat client should be installed at the templeton server node., hcat client instal templeton server node node,0,0,0,0,0,CHANGES.txt;hmc/php/puppet/genmanifest/PuppetClassDependencies.php;,1 
199,Jitendra Nath Pandey,ambari-server,0,Remove import of mysql puppet module from manifest., remov import mysql puppet modul manifest manifest,Remove import of mysql puppet module from manifest because this module is deprecated., remov import mysql puppet modul manifest modul deprec deprec,0,0,0,0,0,CHANGES.txt;hmc/php/puppet/genmanifest/generateManifest.php;,1 
202,Ramya Sunil,null,0,Add check to verify jdk path after install, add check verifi jdk path instal,After the jdk install  we do not validate the path. This causes problems during service start in later stages., jdk instal not valid path path caus problem servic start later stage stage,0,0,0,0,0,CHANGES.txt;hmc/puppet/modules/hdp/manifests/java/package.pp;,1 
207,Jitendra Nath Pandey,ambari-server,0,PHP Notice: Undefined variable: manifest in /usr/share/hmc/php/puppet/genmanifest/hostsConfig.php, PHP notic notic undefin variabl variabl manifest usr share hmc php puppet genmanifest hostsConfig php usr share hmc php puppet genmanifest host config php,Undefined variable used., undefin variabl use use,0,0,0,0,0,0,1 
208,Hitesh Shah,null,0,Support filtering hosts based on discovery status, support filter host base discoveri statu,Api to get hosts should allow filtering out bad hosts, api get host allow filter bad host,0,0,0,0,0,0,0 
217,vitthal (Suhas) Gogate,null,0,Alert table on the right needs to be tied visually/verbally to the context/content it is displaying, alert tabl right need tie visual verbal visual verbal context content context content display,Currently in Dashboard when service entry is clicked  right side alerts table caption does not indicate that it is showing alerts related to that service. So Cpation of the table should change indicating the corresponding service name., current dashboard servic entri click right side alert tabl caption not indic show alert relat servic servic cpation tabl chang indic correspond servic name name,0,0,0,0,0,0,1 
222,vitthal (Suhas) Gogate,null,0,Remove the word alert from all the Nagios alerts descriptions., remov word alert nagio alert descript descript,IT is sort of redundant.., sort redund redund,0,0,0,0,0,0,1 
226,Suresh Srinivas,null,0,Make the daemon names and other field names consistent, make daemon name field name consist,Following names need to be consistent: Hdfs -&gt; HDFS Mapreduce -&gt; MapReduce Zookeeper -&gt; ZooKeeper HADOOP -&gt; Hadoop, follow name need consist consist hdf gt gt HDFS mapreduc gt gt MapReduce map reduc zookeep gt gt ZooKeeper zoo keeper HADOOP gt gt hadoop,0,0,0,0,0,0,1 
232,Vikram Dixit K,null,0,Enable LZO should show checkbox instead of text, enabl LZO show checkbox instead text,Currently the enable lzo option shows a text box that needs to be filled with true/false. Changing the UI element to checkbox., current enabl lzo option show text box need fill true fals true fals chang UI element checkbox checkbox,0,0,0,0,0,0,1 
236,Jitendra Nath Pandey,ambari-server,0,Increase puppet agent timeout., increas puppet agent timeout timeout,Puppet agent timeout should be increases as sometimes (possibly due to a bug in ruby) puppet master takes long time to compile and send back the catalog., puppet agent timeout increas sometim possibl due bug rubi rubi puppet master take long time compil send back catalog catalog,0,0,0,0,0,0,0 
237,Jitendra Nath Pandey,ambari-server,0,Refactor puppet kick loop to easily change retries and timeouts., refactor puppet kick loop easili chang retri timeout timeout,Refactor puppet kick loop to easily change retries and timeouts., refactor puppet kick loop easili chang retri timeout timeout,0,0,0,0,0,0,0 
245,Jitendra Nath Pandey,ambari-server,0,Support data cleanup if installation fails., support data cleanup instal fail fail,We need to support data cleanup so that a cluster can be re-installed in case of failures., need support data cleanup cluster instal instal case failur failur,0,0,0,0,0,0,0 
247,Varun Kapoor,null,0,Replace index.php with clusters.php, replac index php index php cluster php cluster php,Like the title says: overwrite index.php with the contents of clusters.php  making sure to add a link to the AddNodesWizard as well., like titl say say overwrit index php index php content cluster php cluster php make sure add link AddNodesWizard add node wizard well well,0,0,0,0,0,0,0 
249,Vikram Dixit K,null,0,Uninstall support from UI, uninstal support UI,Uninstall/wipeout support from UI., uninstal wipeout uninstal wipeout support UI UI,0,0,0,0,0,0,0 
252,Varun Kapoor,null,0,Remove 'Playground' files from HMC, remov playground playground file HMC,There's a bunch of (temporary playground) files that got wrongly committed to the HMC codebase  so this is to remove all of them and get things into a cleaner state (at least on the face of things)., bunch temporari playground playground file got wrongli commit HMC codebas remov get thing cleaner state least face thing thing,0,0,0,0,0,0,0 
253,Ramya Sunil,null,0,Support uninstall state in mysql modules, support uninstal state mysql modul,Currently  there is no support for uninstall of mysql package., current no support uninstal mysql packag packag,0,0,0,0,0,0,0 
255,Varun Kapoor,null,0,Rename/Relocate files as appropriate, renam reloc renam reloc file appropri,There's some images in the html/ directory (that should be in images/)  there's .html files whose extension should be changed to .htmli  and such  that would be nice to clean up., imag html html directori imag imag html file whose extens chang htmli would nice clean,0,0,0,0,0,0,0 
256,Ramya Sunil,null,0,Update hive config to enable authorization, updat hive config enabl author,In /etc/hive/conf/hive-site.xml&lt;property&gt; &lt;name&gt;hive.security.authorization.enabled&lt;/name&gt; &lt;value&gt;true&lt;/value&gt; &lt;description&gt;enable or disable the hive client authorization&lt;/description&gt;&lt;/property&gt;&lt;property&gt; &lt;name&gt;hive.security.authorization.manager&lt;/name&gt; &lt;value&gt;org.apache.hcatalog.security.HdfsAuthorizationProvider&lt;/value&gt; &lt;description&gt;the hive client authorization manager class name. The user defined authorization class should implement interface org.apache.hadoop.hive.ql.security.authorization.HiveAuthorizationProvider. &lt;/description&gt;&lt;/property&gt;In /etc/hive/conf/hive-env.sh  add -export HIVE_AUX_JARS_PATH=/usr/lib/hcatalog/share/hcatalog/hcatalog-0.4.0.jar, etc hive conf hive site xml lt properti gt etc hive conf hive site xml lt properti gt lt name gt hive secur author enabl lt name gt lt name gt hive secur author enabl lt name gt lt valu gt true lt valu gt lt valu gt true lt valu gt lt descript gt enabl lt descript gt enabl disabl hive client author lt descript gt lt properti gt lt properti gt author lt descript gt lt properti gt lt properti gt lt name gt hive secur author manag lt name gt lt name gt hive secur author manag lt name gt lt valu gt org apach hcatalog secur HdfsAuthorizationProvider lt valu gt lt valu gt org apach hcatalog secur hdf author provid lt valu gt lt descript gt lt descript gt hive client author manag class name name user defin author class implement interfac org apach hadoop hive ql secur author HiveAuthorizationProvider org apach hadoop hive ql secur author hive author provid lt descript gt lt properti gt lt descript gt lt properti gt etc hive conf hive env sh etc hive conf hive env sh add export HIVE_AUX_JARS_PATH usr lib hcatalog share hcatalog hcatalog jar HIVE AUX JARS PATH usr lib hcatalog share hcatalog hcatalog jar,0,0,0,0,0,0,0 
257,Arpit Gupta,site,0,Manage services section will have any empty section when no client only components installed, manag servic section empti section no client compon instal,On the manage services page we have a section for client only services that have no long running processes.If the user has no such component there is a heading but no content. Maybe we can hide the heading when no such service is present., manag servic page section client servic no long run process process user no compon head no content content mayb hide head no servic present present,0,0,0,0,0,0,0 
262,Arpit Gupta,site,0,Init Wizard: Advanced Config validation errors can be bypassed, init wizard wizard advanc config valid error bypass,Make the Naigos password (and re-type password) different so as you cause a validation error.This will let the user move on to the next screen by ignoring all other validation errors on this page., make naigo password type type password password differ caus valid error error let user move next screen ignor valid error page page,0,0,0,0,0,0,0 
264,Arpit Gupta,site,0,Nagios Admin Contact should be checked to ensure it is always an email address, nagio admin contact check ensur alway email address,,,0,0,0,0,0,0,0 
274,Ramya Sunil,null,0,Templeton data on hdfs needs to be readable by all users, templeton data hdf need readabl user,Content of /user/templeton dir-bash-3.2$ hadoop dfs -ls /user/templetonFound 4 items-rw-r--r-- 3 templeton hdfs 107373 2012-05-14 19:53 /user/templeton/hadoop-streaming.jar-rw------- 3 templeton hdfs 35352096 2012-05-14 19:53 /user/templeton/hive.tar.gz-rw------- 3 templeton hdfs 47909478 2012-05-14 19:53 /user/templeton/pig.tar.gz-rw------- 3 templeton hdfs 127652 2012-05-14 19:53 /user/templeton/ugi.jarOnly templeton user can use the jars, content user templeton user templeton dir bash dir bash hadoop df ls user templetonFound user templeton found item rw item rw templeton hdf user templeton hadoop stream jar rw user templeton hadoop stream jar rw templeton hdf user templeton hive tar gz rw user templeton hive tar gz rw templeton hdf user templeton pig tar gz rw user templeton pig tar gz rw templeton hdf user templeton ugi jarOnly user templeton ugi jar templeton user use jar,0,0,0,0,0,0,0 
276,Suresh Srinivas,site,0,Update HDFS parameter configuration description, updat HDFS paramet configur descript,Updating the short description and tooltip long description as follows:Changing the text that affects WebUI as follows: filesystem -&gt; file system HDFS Append Enabled -&gt; Append enabled HDFS WebHDFS Enabled -&gt; WebHDFS enabled Hadoop maximum Java heap size -&gt; Hadoop maximum Java heap size (MB)  Java Heap Size for slave daemons -&gt; Maximum Java heap size for daemons such as Balancer in MB (-Xmx)   NameNode maximum Java heap size -&gt; NameNode initial Java heap size (MB)  Java Heap Size for NameNode -&gt; Initial and minimum Java heap size for NameNode in MB (-Xms)   Hadoop Young Generation heap size -&gt; NameNode new generation size (MB)  Maximum size for New Generation for java heap size -&gt; Default size of Java new generation in MB for NameNode (-XX:NewSize)   DataNode Java heap size -&gt; DataNode maximum Java heap size (MB)  Java Heap Size for DataNode -&gt; Maximum Java heap size for DataNode in MB (-Xmx), updat short descript tooltip long descript follow chang follow chang text affect WebUI web UI follow follow filesystem gt gt file system HDFS append enabl gt gt append enabl HDFS WebHDFS web HDFS enabl gt gt WebHDFS web HDFS enabl hadoop maximum java heap size gt gt hadoop maximum java heap size MB MB java heap size slave daemon gt gt maximum java heap size daemon balanc MB xmx xmx NameNode name node maximum java heap size gt gt NameNode name node initi java heap size MB MB java heap size NameNode name node gt gt initi minimum java heap size NameNode name node MB xm xm hadoop young gener heap size gt gt NameNode name node new gener size MB MB maximum size new gener java heap size gt gt default size java new gener MB NameNode name node XX NewSize XX new size DataNode data node java heap size gt gt DataNode data node maximum java heap size MB MB java heap size DataNode data node gt gt maximum java heap size DataNode data node MB xmx xmx,0,0,0,0,0,0,0 
280,Vikram Dixit K,null,0,Cleanup of utilities, cleanup util,We need an api for the UI to figure out the status of the cluster., need api UI figur statu cluster cluster,0,0,0,0,0,0,0 
283,Vikram Dixit K,null,0,Fixup review and deploy rendering, fixup review deploy render,Currently render of the review and deploy page is messy., current render review deploy page messi messi,0,0,0,0,0,0,0 
287,Vikram Dixit K,ambari-server; ambari-web,0,Add link to uninstall on index page, add link uninstal index page,Uninstall link is now hooked into the index page., uninstal link hook index page page,0,0,0,0,0,0,0 
290,Jitendra Nath Pandey,ambari-server,0,Comment in addNodesWizardInit.js., comment addNodesWizardInit js add node wizard init js,Comment in addNodesWizardInit.js., comment addNodesWizardInit js add node wizard init js,0,0,0,0,0,0,0 
292,Jitendra Nath Pandey,ambari-web,0,HTML being spewed in the Review+Deploy page., HTML spew review deploy review deploy page page,HTML being spewed in the Review+Deploy page., HTML spew review deploy review deploy page page,0,0,0,0,0,0,0 
300,Yusaku Sako,null,0,Change the status message (success/error) location so that it shows below the page summary box  rather than above  more better visibility, chang statu messag success error success error locat show page summari box rather better visibl,,,0,0,0,0,0,0,0 
302,Ramya Sunil,null,0,regionservers config in the hbase only has localhost in it, regionserv config hbase localhost,/etc/hbase/conf/regionserver should correctly populate the slaves list, etc hbase conf regionserv etc hbase conf regionserv correctli popul slave list,0,0,0,0,0,0,0 
304,Vinod Kumar Vavilapalli,null,0,Upgrade to yui-3.5.1, upgrad yui yui,,,0,0,0,0,0,0,0 
310,Yusaku Sako,null,0,Externalize message resources for the welcome page.  Update styles on various pages., extern messag resourc welcom page page updat style variou page page,,,0,0,0,0,0,0,0 
312,Hitesh Shah,null,0,Uninstall's wipe flag should be correctly passed to puppet, uninstal uninstal wipe flag correctli pass puppet,,,0,0,0,0,0,0,0 
316,Vinod Kumar Vavilapalli,null,0,Grid mount points page doesn't let one pass with only a custom mount point, grid mount point page let one pass custom mount point,,,0,0,0,0,0,0,0 
319,Jitendra Nath Pandey,ambari-server,0,Scale puppet master to large number of nodes., scale puppet master larg number node node,Scale puppet master to large number of nodes., scale puppet master larg number node node,0,0,0,0,0,0,0 
323,Vikram Dixit K,ambari-server,0,During any process in the cluster initialization wizard  if the user goes back to the '1 Create Cluster' tab  the user is stuck., process cluster initi wizard user goe back creat cluster cluster tab user stuck stuck,,,0,0,0,0,0,0,0 
326,Jitendra Nath Pandey,ambari-server,0,Dependencies should be added only during install phase, depend ad instal phase,Host level dependencies are being set in running stage as well  which is redundant. It can be assumed that dependencies were installed at install stage., host level depend set run stage well redund redund assum depend instal instal stage stage,0,0,0,0,0,0,0 
330,Vinod Kumar Vavilapalli,null,0,Provide a way to resume if browser crashes/is closed during the deploy-in-progress, provid way resum browser crash crash close deploy progress deploy progress,Currently when the browser is closed one cannot view the install in progress. They will have to look at the logs on the hmc machine to figure out whats going on. It would be nice if we can provide a way to get back to the install progress., current browser close one cannot view instal progress progress look log hmc machin figur what go would nice provid way get back instal progress progress,0,0,0,0,0,0,0 
335,Ramya Sunil,null,0,Redundant downloads even though the artifacts are already installed, redund download even though artifact alreadi instal,Artifacts (such as mysql-connector.zip  hive.tar.gz  pig.tar.gz  ext.zip) are being downloaded even though they are previously installed leading to additional execution time., artifact mysql connector zip mysql connector zip hive tar gz hive tar gz pig tar gz pig tar gz ext zip ext zip download even though previous instal lead addit execut time time,0,0,0,0,0,0,0 
338,Vikram Dixit K,ambari-server,0,Cluster status update needs to happen for all stages of installation wizard., cluster statu updat need happen stage instal wizard wizard,Cluster status should be updated in db for each stage of the installation wizard. This is used to enable restart of browser and also showing status of the cluster on the index page., cluster statu updat db stage instal wizard wizard use enabl restart browser also show statu cluster index page page,0,0,0,0,0,0,0 
339,Vikram Dixit K,ambari-web,0,Making transitionToNextStage more robust, make transitionToNextStage transit next stage robust,If the currentStage is null  we should not proceed with a transition., currentStage current stage null not proceed transit transit,0,0,0,0,0,0,0 
349,Vikram Dixit K,ambari-server; ambari-web,0,Logging in case of error during uninstall needs to be fixed., log case error uninstal need fix fix,Logs disappear post uninstall because the transaction is also cleaned from the db., log disappear post uninstal transact also clean db db,0,0,0,0,0,0,0 
352,Yusaku Sako,null,0,Add flow control - force redirects to appropriate pages based on cluster configuration status for better usability, add flow control forc redirect appropri page base cluster configur statu better usabl,If no cluster has been set up yet  redirect to the welcome page.If a cluster is being configured (but has not gone thru deployment)  redirect to Step 1 of the cluster init wizard.If a cluster is being deployed  redirect to the deployment progress page.If a cluster has gone thru deployment but failed  redirect to the re-install page.If a cluster has gone thru deployment and succeed  do not perform any forced redirect., no cluster set yet redirect welcom page page cluster configur not gone thru deploy deploy redirect step cluster init wizard wizard cluster deploy redirect deploy progress page page cluster gone thru deploy fail redirect instal instal page page cluster gone thru deploy succeed not perform forc redirect redirect,0,0,0,0,0,0,0 
357,Yusaku Sako,null,0,Redesign master service assignment page so that it takes up less vertical space, redesign master servic assign page take less vertic space,,,0,0,0,0,0,0,0 
362,Vikram Dixit K,ambari-server,0,Create lock file as part of rpm install, creat lock file part rpm instal,Lock file is being created as part of create cluster. This is brittle and needs to be done as part of the rpm install., lock file creat part creat cluster cluster brittl need done part rpm instal instal,0,0,0,0,0,0,0 
366,Varun Kapoor,null,0,Package up the fonts/ subdirectory in the HMC RPM, packag font font subdirectori HMC RPM,The new fonts/ subdirectory used for the buttons on the ManageServices page isn't packaged up., new font font subdirectori use button ManageServices manag servic page packag,0,0,0,0,0,0,0 
369,Yusaku Sako,null,0,Improve Service Management page and general popup styling, improv servic manag page gener popup style,,,0,0,0,0,0,0,0 
371,Jitendra Nath Pandey,ambari-server,0,Mysql packages not being sent during install and uninstall, mysql packag not sent instal uninstal,Mysql packages not being sent during install and uninstall., mysql packag not sent instal uninstal uninstal,0,0,0,0,0,0,0 
377,Jitendra Nath Pandey,ambari-server,0,Uninstall does not handle component dependencies., uninstal not handl compon depend depend,Uninstall does not handle component dependencies., uninstal not handl compon depend depend,0,0,0,0,0,0,0 
386,Hitesh Shah,null,0,On Single Node install when install all the components the recommended num for Map/Reduce Tasks is too high, singl node instal instal compon recommend num map reduc map reduc task high,Use lower count of maps/reduce slots for a single node install., use lower count map reduc map reduc slot singl node instal instal,0,0,0,0,0,0,0 
393,Mahadev konar,null,0,ZooKeeper myid files not existent on ZK install., ZooKeeper zoo keeper myid file not exist ZK instal instal,ZooKeeper myid files not existent on ZK install., ZooKeeper zoo keeper myid file not exist ZK instal instal,0,0,0,0,0,0,0 
394,Vikram Dixit K,ambari-server,0,Add nodes fails to find node in db, add node fail find node db,Host not found in db error on assign nodes page, host not found db error assign node page,0,0,0,0,0,0,0 
399,Yusaku Sako,null,0,Cannot uninstall - the page hangs with the spinning icon, cannot uninstal page hang spin icon,,,0,0,0,0,0,0,0 
401,Jitendra Nath Pandey,ambari-server,0,Manual config changes for nn get reset on stop/start from hmc, manual config chang nn get reset stop start stop start hmc,Manual config changes for nn get reset on stop/start from hmc, manual config chang nn get reset stop start stop start hmc,0,0,0,0,0,0,0 
402,Vikram Dixit K,ambari-server,0,Completing successful add node takes one to initialize cluster page starting from scratch, complet success add node take one initi cluster page start scratch,,,0,0,0,0,0,0,0 
404,Yusaku Sako,null,0,Unify the top nav for both Monitoring and Cluster Management, unifi top nav monitor cluster manag,,,0,0,0,0,0,0,0 
414,Mahadev konar,null,0,Add rpm spec for hmc agent., add rpm spec hmc agent agent,Add rpm spec for hmc agent., add rpm spec hmc agent agent,0,0,0,0,0,0,0 
415,Hitesh Shah,null,0,Reset service back to original state after reconfiguration, reset servic back origin state reconfigur,,,0,0,0,0,0,0,0 
420,Yusaku Sako,null,0,Improve style on error log popups, improv style error log popup,,,0,0,0,0,0,0,0 
426,Ramya Sunil,null,0,Reinstall of cluster after failure to install results in failure, reinstal cluster failur instal result failur,According to Bikas:I tried to install a single node cluster. That failed for some random issue.I was presented an option to reinstall.I clicked on that option and it asked me to uninstall.I chose uninstall and wipe data option.Uninstall failed.This happened because the install did not complete in the first place.Thu May 24 17:45:28 -0400 2012 /Stage17/Hdp-oozie::Service/Hdp-oozie::Service::Createsymlinks/usr/lib/oozie/oozie-server/lib/mapred-site.xml/File/usr/lib/oozie/oozie-server/lib/mapred-site.xml/ensure (err): change from absent to present failed: Could not set 'present on ensure: No such file or directory - /usr/lib/oozie/oozie-server/lib/mapred-site.xml at /etc/puppet/agent/modules/hdp-oozie/manifests/service.pp:61, accord bika bika tri instal singl node cluster cluster fail random issu issu present option reinstal reinstal click option ask uninstal uninstal chose uninstal wipe data option uninstal option uninstal fail fail happen instal not complet first place thu place thu may stage hdp oozi servic hdp oozi servic createsymlink usr lib oozi oozi server lib mapr site xml file usr lib oozi oozi server lib mapr site xml ensur stage hdp oozi servic hdp oozi servic createsymlink usr lib oozi oozi server lib mapr site xml file usr lib oozi oozi server lib mapr site xml ensur err err chang absent present fail fail could not set present ensur ensur No file directori usr lib oozi oozi server lib mapr site xml usr lib oozi oozi server lib mapr site xml etc puppet agent modul hdp oozi manifest servic pp etc puppet agent modul hdp oozi manifest servic pp,0,0,0,0,0,0,0 
429,Mahadev konar,null,0,Fix bug with jmx parsing on HBase., fix bug jmx pars HBase base,Fix bug with jmx parsing on HBase., fix bug jmx pars HBase base,0,0,0,0,0,0,0 
433,Vikram Dixit K,ambari-server,0,Using service stop instead of killall for uninstall, use servic stop instead killal uninstal,,,0,0,0,0,0,0,0 
435,Vikram Dixit K,ambari-server,0,Uninstall needs to update status for failure., uninstal need updat statu failur failur,This is to enable the routing layer to redirect appropriately., enabl rout layer redirect appropri appropri,0,0,0,0,0,0,0 
442,Ramya Sunil,null,0,Duplicate definition: Class[Hdp-hbase::Regionserver::Enable-ganglia], duplic definit definit class hdp hbase regionserv enabl ganglia class hdp hbase regionserv enabl ganglia,Duplicate definition: Class&#91;Hdp-hbase::Regionserver::Enable-ganglia&#93; is already defined; cannot redefine at /etc/puppet/agent/modules/hdp-ganglia/manifests/monitor.pp:37 on node ip-10-64-19-248.ec2.internal, duplic definit definit class hdp hbase regionserv enabl ganglia class hdp hbase regionserv enabl ganglia alreadi defin defin cannot redefin etc puppet agent modul hdp ganglia manifest monitor pp etc puppet agent modul hdp ganglia manifest monitor pp node ip ec intern ip ec intern,0,0,0,0,0,0,0 
