issue_id,reporter,component,keywords,pre_sum,summary,pre_des,description,des-1,des-2,des-3,des-4,des-5,files,Surprising
3675,Jaimin D Jetly,ambari-web,0,Default value of 'Default virtual memory for a job's map-task' is not valid, default valu default default virtual memori job job map task map task not valid,The default value of 'Default virtual memory for a job's map-task' (in Customize Services page -&gt; MapReduce2 tab -&gt; General) was '619.5'.Warning hint says 'Must contain digits only'Value depends on quantity of installed components., default valu default default virtual memori job job map task map task custom servic page gt gt MapReduce map reduc tab gt gt gener gener warn warn hint say must must contain digit valu valu depend quantiti instal compon compon,0,0,0,0,0,ambari-web/app/controllers/wizard/step7_controller.js;ambari-web/app/utils/config.js;ambari-web/app/utils/defaults_providers/yarn_defaults_provider.js;ambari-web/app/utils/helper.js;ambari-web/app/utils/string_utils.js;,1 
3679,Dmytro Shkvyra,ambari-agent,0,Better error message needed when incompatible ambari-agents installed, better error messag need incompat ambari agent ambari agent instal,On a few days old cluster I attempted to add a host. The add host failed due to ambari-server trying to install ambari-agent-1.4.1.17 and the repo having ambari-agent-1.4.1.23-1.The message in /var/run/ambari-server/bootstrap/11/hostname.log was:STDERRscp /usr/lib/python2.6/site-packages/ambari_server/setupAgent.py done for host srimanth1-5.c.pramod-thangali.internal  exitcode=0Copying files finishedRunning setup agent...STDOUTError: Nothing to do{'exitstatus': 1  'log': ('Loaded plugins: downloadonly  fastestmirror  security/nDetermining fastest mirrors/n * base: www.gtlib.gatech.edu/n * extras: centos.mirror.netriplex.com/n * updates: mirror.cogentco.com/nSetting up Install Process/nNo package ambari-agent-1.4.1.17 available./n'  None)}, day old cluster attempt add host host add host fail due ambari server ambari server tri instal ambari agent ambari agent repo ambari agent ambari agent messag var run ambari server bootstrap hostnam log var run ambari server bootstrap hostnam log STDERRscp STDER rscp usr lib python site packag ambari_server setupAgent py usr lib python site packag ambari_server setup agent py done host srimanth pramod thangali intern srimanth pramod thangali intern exitcod copi exitcod copi file finishedRunning finish run setup agent STDOUTError agent STDOUT error noth exitstatu exitstatu log log load load plugin plugin downloadonli fastestmirror secur nDetermining secur determin fastest mirror mirror base base www gtlib gatech edu www gtlib gatech edu extra extra cento mirror netriplex com cento mirror netriplex com updat updat mirror cogentco com nSetting mirror cogentco com set instal process nNo process No packag ambari agent ambari agent avail avail none none,0,0,0,0,0,0,1 
3686,Antonenko Alexander,ambari-web,0,NameNode HA wizard (Configure Components step): Task 'Reconfigure HDFS' always fail  and user cannot proceed to next step, NameNode name node HA wizard configur configur compon step step task reconfigur reconfigur HDFS HDFS alway fail user cannot proceed next step,This task fails due to bad request:/api/v1/clusters/c1/hosts/HDFS_CLIENT/host_components/dev01.hortonworks.comShould be: api/v1/clusters/c1/hosts/dev01.hortonworks.com/host_components/HDFS_CLIENT, task fail due bad request api cluster host HDFS_CLIENT host_components dev hortonwork comShould request api cluster host HDFS CLIENT host_components dev hortonwork com api cluster host dev hortonwork com host_components HDFS_CLIENT api cluster host dev hortonwork com host_components HDFS CLIENT,0,0,0,0,0,0,0 
3690,Yusaku Sako,ambari-web,0,Typo in text label on Hosts page, typo text label host page,On the Hosts page  we have a typo in the label 'filterd'. Should be 'filtered'., host page typo label filterd filterd filter filter,0,0,0,0,0,0,1 
3695,Dmytro Shkvyra,ambari-agent,0,'Confirm hosts' shows 'ntpd not running' warning  but it's running on host, confirm confirm host host show ntpd not run run warn run host,STR: Install  setup and start Ambari server by default. Reach 'Choose services' phase of installer.Actual result:'Confirm hosts' shows warning that ntpd service isn't running on hosts  but it's running in console by command service ntpd status, STR STR instal setup start ambari server default default reach choos choos servic servic phase instal actual instal actual result confirm result confirm host host show warn ntpd servic run host run consol command servic ntpd statu,0,0,0,0,0,0,1 
3701,Dmytro Shkvyra,ambari-server,0,Reduce logs emitted to report heartbeats from agents, reduc log emit report heartbeat agent,For a 657 node cluster:~10 minute for 10 MB and 20 log files store about 200 minutes (~3 hours) of log. This is not ideal if an error overnight needs to be investigated. We should try for the log to last 24 hours - ideally 72 hours to account for weekends.-rw-r--r-- 1 root root 10485854 Oct 17 17:35 ambari-server.log.6-rw-r--r-- 1 root root 10485836 Oct 17 17:44 ambari-server.log.5-rw-r--r-- 1 root root 10485811 Oct 17 17:52 ambari-server.log.4-rw-r--r-- 1 root root 10485793 Oct 17 18:01 ambari-server.log.3-rw-r--r-- 1 root root 10485793 Oct 17 18:10 ambari-server.log.2-rw-r--r-- 1 root root 10485854 Oct 17 18:18 ambari-server.log.1, node cluster cluster minut MB log file store minut hour hour log log not ideal error overnight need investig investig tri log last hour ideal hour account weekend rw weekend rw root root oct ambari server log rw ambari server log rw root root oct ambari server log rw ambari server log rw root root oct ambari server log rw ambari server log rw root root oct ambari server log rw ambari server log rw root root oct ambari server log rw ambari server log rw root root oct ambari server log ambari server log,0,0,0,0,0,0,1 
3708,Srimanth Gunturi,ambari-web,0,Reconfigure of dynamic configs not showing modified values, reconfigur dynam config not show modifi valu,Modifications of dynamic properties are being persisted on server  but default values are being shown in UI. Also  we should not validate dynamic configs which are of type string. mapreduce.map.java.opts mapreduce.reduce.java.opts yarn.app.mapreduce.am.command-opts, modif dynam properti persist server default valu shown UI UI also not valid dynam config type string string mapreduc map java opt mapreduc map java opt mapreduc reduc java opt mapreduc reduc java opt yarn app mapreduc command opt yarn app mapreduc command opt,0,0,0,0,0,0,1 
3713,Oleg Nechiporenko,ambari-web,0,When filtering on hosts  the table column sizes shift  should stay fixed., filter host tabl column size shift stay fix fix,For the 'defaultsProvider' and 'serviceValidator' functionalities  we need unit tests, defaultsProvider default provid serviceValidator servic valid function need unit test,0,0,0,0,0,0,1 
3715,Antonenko Alexander,ambari-web,0,Reassign Master Wizard does not display folder and hosts on 'Manual commands' page after browser reopening, reassign master wizard not display folder host manual manual command command page browser reopen,Steps: Open 'Reassign Master Wizard' for NameNode or SNameNode. Go to 'Manual commands' page. Close browser and open it again.Result: Was opened 'Manual commands' page  but hostnames and foldername were replaced with '{1}'  '{2}' etc.Attached picture for other page  but behavior is similar., step step open reassign reassign master wizard wizard NameNode name node SNameNode name node Go manual manual command command page page close browser open result result open manual manual command command page hostnam foldernam replac etc attach etc attach pictur page behavior similar similar,0,0,0,0,0,0,1 
3720,Xi Wang,ambari-web,0,Provide read-only view of repo options in Ambari Web, provid read read view repo option ambari web,If a user is using local repos  and customizes Advanced Repository Options during install  the user might need this info to debug post install (since it is used in Add Hosts)  for example.Note: We should show this information regardless if the user customizes repos or not during install., user use local repo custom advanc repositori option instal user might need info debug post instal sinc use add host host exampl note exampl note show inform regardless user custom repo not instal instal,0,0,0,0,0,ambari-web/app/utils/ajax.js;,1 
3724,Andrii Tkach,ambari-web,0,Incorrect host status when slave down, incorrect host statu slave,When host has slave down status 'No Heartbeat' status is shown instead of 'Slave Down'., host slave statu No No heartbeat heartbeat statu shown instead slave slave,0,0,0,0,0,ambari-web/app/models/host.js;,1 
3726,Antonenko Alexander,ambari-web,0,Restart indicators for services and hosts disappear after some time., restart indic servic host disappear time time,Goto Service (that have stale configs) -&gt; configs   no restart indicators are shown. Refresh page  for 10-15 seconds you see indicators then they disappear. The same for host detail page, goto servic stale config config gt gt config no restart indic shown shown refresh page second see indic disappear disappear host detail page,0,0,0,0,0,0,1 
3729,Artem Baranchuk,null,0,Ganglia monitor started with second or third attempt on secure cluster, ganglia monitor start second third attempt secur cluster,,,0,0,0,0,0,0,1 
3738,Andrii Babiichuk,ambari-web,0,Background ops dialog checkbox UI cleanup, background op dialog checkbox UI cleanup,The OK and the text should be on the same centerline row., OK text centerlin row row,0,0,0,0,0,ambari-web/app/styles/application.less;ambari-web/app/templates/common/modal_popup.hbs;ambari-web/app/views/common/modal_popup.js;,1 
3739,Siddharth Wagle,ambari-server,0,Remove Exception message printed to log for successful starts, remov except messag print log success start,Following error messages are printed to log with default log level and are misleading.04:19:52 438 ERROR [main] MasterKeyServiceImpl:109 - Master key is not provided as a System property or an environment varialble.04:19:52 439 INFO [main] Configuration:415 - Credential provider creation failed.Master key initialization failed., follow error messag print log default log level mislead mislead ERROR main main MasterKeyServiceImpl master key servic impl master key not provid system properti environ varialbl varialbl INFO main main configur configur credenti provid creation fail master fail master key initi fail fail,0,0,0,0,0,0,1 
3742,Andrii Babiichuk,ambari-web,0,HBase Links widget has 'more' button out of bounds and looks broken when there are multiple masters, HBase base link widget button bound look broken multipl master,When there are multiple HBase Masters  the HBase Links widget looks broken. Let's get rid of the 'and X Standby Masters' static text as it is not a link and not very useful.So the widget would look like:'HBase Master''X RegionServers''Master Web UI', multipl HBase base master HBase base link widget look broken broken let let get rid standbi master master static text not link not use use widget would look like HBase like base master master RegionServers master region server master web UI UI,0,0,0,0,0,ambari-web/app/messages.js;ambari-web/app/templates/main/dashboard/widgets/hbase_links.hbs;ambari-web/app/views/main/dashboard/service/hbase.js;ambari-web/app/views/main/dashboard/widgets/hbase_links.js;,1 
3752,Srimanth Gunturi,ambari-web,0,MR jobs are hanging on a 2-node cluster with default configuration, MR job hang node cluster default configur,This is a 2-node cluster with 2GB of RAM each. Cluster deployment goes fine but MR jobs do not complete resulting in service check failures for MR  OOZIE  Pig  etc., node cluster GB GB RAM cluster deploy goe fine MR job not complet result servic check failur MR OOZIE pig etc etc,0,0,0,0,0,0,1 
3759,Antonenko Alexander,ambari-web,0,Add host wizard: After successfully bootstrapping host  'next' button is disabled, add host wizard wizard success bootstrap host next next button disabl,See screenshot, see screenshot,0,0,0,0,0,0,1 
3760,Antonenko Alexander,ambari-web,0,Provide config-group support in add-host wizard, provid config group config group support add host add host wizard,When adding hosts  a user should be able to select which config-groups this host belongs to. Configurations of that group (Default or config-group) will be applied on that host., ad host user abl select config group config group host belong configur group default default config group config group appli host host,0,0,0,0,0,0,1 
3761,Andrii Babiichuk,ambari-web,0,'Uncaught exception' in JS while navigating through services on Services page, uncaught uncaught except except JS navig servic servic page,This one was discovered while quick navigating through services on Services page.To reproduce just try to click on services links fast.After that service content is not displayed., one discov quick navig servic servic page page reproduc tri click servic link fast fast servic content not display display,0,0,0,0,0,ambari-web/app/views/common/quick_view_link_view.js;,1 
3770,Dmytro Shkvyra,null,0,Need better error log message when agent unable to reach server, need better error log messag agent unabl reach server,http://hortonworks.com/community/forums/topic/installing-hdp2-0-6-on-centos6-4/The current ERROR in the agent log can be cryptic., current ERROR agent log cryptic cryptic,0,0,0,0,0,0,1 
