issue_id,reporter,component,keywords,pre_sum,summary,pre_des,description,des-1,des-2,des-3,des-4,des-5,files,Surprising
5622,Myroslav Papirkovskyy,ambari-server,0,'Upgrading schema' failed during upgrading to 1.6.0, upgrad upgrad schema schema fail upgrad,Postgres issue:new restart_required relies on eclipselink default type converters  we avoided this in pastorg.postgresql.util.PSQLException: ERROR: column 'restart_required' is of type boolean but expression is of type integer Hint: You will need to rewrite or cast the expression. Position: 57 at org.postgresql.core.v3.QueryExecutorImpl.receiveErrorResponse(QueryExecutorImpl.java:2161) at org.postgresql.core.v3.QueryExecutorImpl.processResults(QueryExecutorImpl.java:1890) at org.postgresql.core.v3.QueryExecutorImpl.execute(QueryExecutorImpl.java:255) at org.postgresql.jdbc2.AbstractJdbc2Statement.execute(AbstractJdbc2Statement.java:559) at org.postgresql.jdbc2.AbstractJdbc2Statement.executeWithFlags(AbstractJdbc2Statement.java:403) at org.postgresql.jdbc2.AbstractJdbc2Statement.executeUpdate(AbstractJdbc2Statement.java:331) at org.apache.ambari.server.orm.DBAccessorImpl.updateTable(DBAccessorImpl.java:447) at org.apache.ambari.server.orm.DBAccessorImpl.addColumn(DBAccessorImpl.java:371) at org.apache.ambari.server.upgrade.UpgradeCatalog160.executeDDLUpdates(UpgradeCatalog160.java:72) at org.apache.ambari.server.upgrade.AbstractUpgradeCatalog.upgradeSchema(AbstractUpgradeCatalog.java:177) at org.apache.ambari.server.upgrade.SchemaUpgradeHelper.executeUpgrade(SchemaUpgradeHelper.java:176) at org.apache.ambari.server.upgrade.SchemaUpgradeHelper.main(SchemaUpgradeHelper.java:225)MySQL issue:Inreresting MySQL feature  there should be no space between function name and parenthesis18:57:00 629 WARN [main] DBAccessorImpl:469 - Error executing query: insert into request(request_id  cluster_id  request_context  start_time  end_time  create_time) select distinct s.request_id  s.cluster_id  s.request_context  coalesce (cmd.start_time  -1)  coalesce (cmd.end_time  -1)  -1 from (select distinct request_id  cluster_id  request_context from stage ) s left join (select request_id  min(start_time) as start_time  max(end_time) as end_time from host_role_command group by request_id) cmd on s.request_id=cmd.request_idcom.mysql.jdbc.exceptions.jdbc4.MySQLSyntaxErrorException: FUNCTION ambari.coalesce does not exist at sun.reflect.GeneratedConstructorAccessor14.newInstance(Unknown Source) at sun.reflect.DelegatingConstructorAccessorImpl.newInstance(DelegatingConstructorAccessorImpl.java:45) at java.lang.reflect.Constructor.newInstance(Constructor.java:526) at com.mysql.jdbc.Util.handleNewInstance(Util.java:411) at com.mysql.jdbc.Util.getInstance(Util.java:386) at com.mysql.jdbc.SQLError.createSQLException(SQLError.java:1054) at com.mysql.jdbc.MysqlIO.checkErrorPacket(MysqlIO.java:4237) at com.mysql.jdbc.MysqlIO.checkErrorPacket(MysqlIO.java:4169) at com.mysql.jdbc.MysqlIO.sendCommand(MysqlIO.java:2617) at com.mysql.jdbc.MysqlIO.sqlQueryDirect(MysqlIO.java:2778) at com.mysql.jdbc.ConnectionImpl.execSQL(ConnectionImpl.java:2828) at com.mysql.jdbc.ConnectionImpl.execSQL(ConnectionImpl.java:2777) at com.mysql.jdbc.StatementImpl.execute(StatementImpl.java:949) at com.mysql.jdbc.StatementImpl.execute(StatementImpl.java:795) at org.apache.ambari.server.orm.DBAccessorImpl.executeQuery(DBAccessorImpl.java:466) at org.apache.ambari.server.orm.DBAccessorImpl.executeQuery(DBAccessorImpl.java:452) at org.apache.ambari.server.upgrade.UpgradeCatalog150.executeDDLUpdates(UpgradeCatalog150.java:325) at org.apache.ambari.server.upgrade.AbstractUpgradeCatalog.upgradeSchema(AbstractUpgradeCatalog.java:177) at org.apache.ambari.server.upgrade.SchemaUpgradeHelper.executeUpgrade(SchemaUpgradeHelper.java:176) at org.apache.ambari.server.upgrade.SchemaUpgradeHelper.main(SchemaUpgradeHelper.java:225), postgr issu new issu new restart_required reli eclipselink default type convert avoid pastorg postgresql util PSQLException pastorg postgresql util PSQL except ERROR ERROR column restart_required restart_required type boolean express type integ hint hint need rewrit cast express express posit posit org postgresql core QueryExecutorImpl receiveErrorResponse QueryExecutorImpl java org postgresql core queri executor impl receiv error respons queri executor impl java org postgresql core QueryExecutorImpl processResults QueryExecutorImpl java org postgresql core queri executor impl process result queri executor impl java org postgresql core QueryExecutorImpl execut QueryExecutorImpl java org postgresql core queri executor impl execut queri executor impl java org postgresql jdbc AbstractJdbc statement execut AbstractJdbc statement java org postgresql jdbc abstract jdbc statement execut abstract jdbc statement java org postgresql jdbc AbstractJdbc statement executeWithFlags AbstractJdbc statement java org postgresql jdbc abstract jdbc statement execut flag abstract jdbc statement java org postgresql jdbc AbstractJdbc statement executeUpdate AbstractJdbc statement java org postgresql jdbc abstract jdbc statement execut updat abstract jdbc statement java org apach ambari server orm DBAccessorImpl updateTable DBAccessorImpl java org apach ambari server orm DB accessor impl updat tabl DB accessor impl java org apach ambari server orm DBAccessorImpl addColumn DBAccessorImpl java org apach ambari server orm DB accessor impl add column DB accessor impl java org apach ambari server upgrad UpgradeCatalog executeDDLUpdates UpgradeCatalog java org apach ambari server upgrad upgrad catalog execut DDL updat upgrad catalog java org apach ambari server upgrad AbstractUpgradeCatalog upgradeSchema AbstractUpgradeCatalog java org apach ambari server upgrad abstract upgrad catalog upgrad schema abstract upgrad catalog java org apach ambari server upgrad SchemaUpgradeHelper executeUpgrade SchemaUpgradeHelper java org apach ambari server upgrad schema upgrad helper execut upgrad schema upgrad helper java org apach ambari server upgrad SchemaUpgradeHelper main SchemaUpgradeHelper java MySQL org apach ambari server upgrad schema upgrad helper main schema upgrad helper java SQL issu inrerest issu inrerest MySQL SQL featur no space function name parenthesi parenthesi WARN main main DBAccessorImpl DB accessor impl error execut queri queri insert request request_id request request_id cluster_id request_context start_time end_time create_time create_time select distinct request_id request_id cluster_id cluster_id request_context request_context coalesc cmd start_time cmd start_time coalesc cmd end_time cmd end_time select distinct request_id cluster_id request_context stage left join select request_id min start_time min start_time start_time max end_time max end_time end_time host_role_command group request_id request_id cmd request_id cmd request_idcom mysql jdbc except jdbc MySQLSyntaxErrorException request_id cmd request_idcom mysql jdbc except jdbc SQL syntax error except FUNCTION ambari coalesc ambari coalesc not exist sun reflect GeneratedConstructorAccessor newInstance unknown sun reflect gener constructor accessor new instanc unknown sourc sourc sun reflect DelegatingConstructorAccessorImpl newInstance DelegatingConstructorAccessorImpl java sun reflect deleg constructor accessor impl new instanc deleg constructor accessor impl java java lang reflect constructor newInstance constructor java java lang reflect constructor new instanc constructor java com mysql jdbc util handleNewInstance util java com mysql jdbc util handl new instanc util java com mysql jdbc util getInstance util java com mysql jdbc util get instanc util java com mysql jdbc SQLError createSQLException SQLError java com mysql jdbc SQL error creat SQL except SQL error java com mysql jdbc MysqlIO checkErrorPacket MysqlIO java com mysql jdbc mysql IO check error packet mysql IO java com mysql jdbc MysqlIO checkErrorPacket MysqlIO java com mysql jdbc mysql IO check error packet mysql IO java com mysql jdbc MysqlIO sendCommand MysqlIO java com mysql jdbc mysql IO send command mysql IO java com mysql jdbc MysqlIO sqlQueryDirect MysqlIO java com mysql jdbc mysql IO sql queri direct mysql IO java com mysql jdbc ConnectionImpl execSQL ConnectionImpl java com mysql jdbc connect impl exec SQL connect impl java com mysql jdbc ConnectionImpl execSQL ConnectionImpl java com mysql jdbc connect impl exec SQL connect impl java com mysql jdbc StatementImpl execut StatementImpl java com mysql jdbc statement impl execut statement impl java com mysql jdbc StatementImpl execut StatementImpl java com mysql jdbc statement impl execut statement impl java org apach ambari server orm DBAccessorImpl executeQuery DBAccessorImpl java org apach ambari server orm DB accessor impl execut queri DB accessor impl java org apach ambari server orm DBAccessorImpl executeQuery DBAccessorImpl java org apach ambari server orm DB accessor impl execut queri DB accessor impl java org apach ambari server upgrad UpgradeCatalog executeDDLUpdates UpgradeCatalog java org apach ambari server upgrad upgrad catalog execut DDL updat upgrad catalog java org apach ambari server upgrad AbstractUpgradeCatalog upgradeSchema AbstractUpgradeCatalog java org apach ambari server upgrad abstract upgrad catalog upgrad schema abstract upgrad catalog java org apach ambari server upgrad SchemaUpgradeHelper executeUpgrade SchemaUpgradeHelper java org apach ambari server upgrad schema upgrad helper execut upgrad schema upgrad helper java org apach ambari server upgrad SchemaUpgradeHelper main SchemaUpgradeHelper java org apach ambari server upgrad schema upgrad helper main schema upgrad helper java,0,0,0,0,0,0,0 
5628,Srimanth Gunturi,ambari-web,0,Explicitly disabling datanucleus l2 cache for hive, explicitli disabl datanucleu cach hive,Ambari installations of hive currently do not set any datanucleus related properties. There is such a thing as a datanucleus l2 cache  that is pretty bad for hive in a distributed environment if it is set. (If there is a lone embedded hive instance  with no other codepaths to the db  then it's fine  but that never happens in a distributed environment.)By default  if no setting is present  datanucleus defaults the l2 cache to being on  so hive ups the ante by defaulting to turning it off by default if no other setting is configured.Now  in a war of 'defaults'  the hive default should win  but this is an area where we have had recurring support issues from clients that turn it on expecting improved performance. Thus  I'd like ambari installed hive-site.xml to explicitly have this config parameter turned off  with a comment asking users to not switch it on as it impacts hive negatively.The parameter in question is 'datanucleus.cache.level2.type'   and it's value should be 'none'. (Note that I've seen some older configs that seem to do things like turning datanucleus.cache.level2 = false and stuff like that  that is bogus config and does nothing and should not be assumed to be a catch-all enabler.)As a comment  I'd like the following comment 'Disables datanucleus l2 cache. This must be set to 'none' for hive to work properly' or something to that effect., ambari instal hive current not set datanucleu relat properti properti thing datanucleu cach pretti bad hive distribut environ set set lone embed hive instanc no codepath db fine never happen distribut environ environ default no set present datanucleu default cach hive up ant default turn default no set configur configur war default default hive default win area recur support issu client turn expect improv perform perform thu like ambari instal hive site xml hive site xml explicitli config paramet turn comment ask user not switch impact hive neg neg paramet question datanucleu cach level type datanucleu cach level type valu none none note note seen older config seem thing like turn datanucleu cach level datanucleu cach level fals stuff like bogu config noth not assum catch catch enabl enabl comment like follow comment disabl disabl datanucleu cach cach must set none none hive work properli properli someth effect effect,0,0,0,0,0,0,0 
5633,Dmitry Lysnichenko,ambari-agent,0,Start Services command gets stuck for about 30 mins, start servic command get stuck min,On Security wizard Start Services command ZOOKEEPER_SERVER Start task scheduled on ambari-server host remained in QUEUED status for about 30 mins and other non-completed commands were in PENDING status. For this time interval no command was in IN_PROGRESS status.Later executing stop all services command on the same cluster also made ZOOKEEPER_SERVER Stop task scheduled on ambari-server host to remain in QUEUED status for around 20 mins., secur wizard start servic command ZOOKEEPER_SERVER ZOOKEEPER SERVER start task schedul ambari server ambari server host remain QUEUED statu min non complet non complet command PENDING statu statu time interv no command IN_PROGRESS PROGRESS statu later statu later execut stop servic command cluster also made ZOOKEEPER_SERVER ZOOKEEPER SERVER stop task schedul ambari server ambari server host remain QUEUED statu around min min,0,0,0,0,0,0,0 
5643,Jaimin D Jetly,ambari-web,0,Add Services is disabled after upgrading the stack from HDP-2.0 to HDP-2.1, add servic disabl upgrad stack HDP HDP HDP HDP,Prior to upgrade  launch Add Services wizard using Ambari 1.5.0 (crucial step) Upgrade stack to a stack with new services and Ambari to 1.5.1 Add Services button is disabled  even though there are services that have not been added to the cluster, prior upgrad launch add servic wizard use ambari crucial step step upgrad stack stack new servic ambari add servic button disabl even though servic not ad cluster,0,0,0,0,0,0,0 
5646,Srimanth Gunturi,ambari-web,0,Jobs dont show up as links for a moment when page is visited, job dont show link moment page visit,I had a couple of finished jobs showing the jobs page. Then I clicked on one job and went back to the jobs page. For a moment both jobs were not shown as links - though they are clickable. This is basically an appearance issue where the job doesnt look like a link for a moment., coupl finish job show job page page click one job went back job page page moment job not shown link though clickabl clickabl basic appear issu job doesnt look like link moment moment,0,0,0,0,0,0,0 
5656,Xi Wang,ambari-web,0,Views: do not let the user click on the Views icon in the top nav, view view not let user click view icon top nav,When clicking on the Views icon in the top nav  the page content turns blank.We will show a view index page in a later release  but for now  let's just disable clicking on that icon., click view icon top nav page content turn blank blank show view index page later releas let let disabl click icon icon,0,0,0,0,0,0,0 
5668,Aleksandr Kovalenko,ambari-web,0,JobsDiagnostic|2.1.1: No job status and end time is shown for interrupted job, JobsDiagnostic job diagnost No job statu end time shown interrupt job,Enabled tez engine for hive;Executed select query;If while job is running I stop it by double pressign CTRL-C in hive shell then job will not have end time shown in jobs table and no failed icon (red X)  but in job details it will have status 'killed' and correct end time.If job is killed with yarn application -kill it will have correct end time and failed icon displayed in jobs table  but in job details it will not have neither status nor end time., enabl tez engin hive execut hive execut select queri queri job run stop doubl pressign CTRL CTRL hive shell job not end time shown job tabl no fail icon red job detail statu kill kill correct end time time job kill yarn applic kill correct end time fail icon display job tabl job detail not neither statu nor end time time,0,0,0,0,0,0,0 
5669,Xi Wang,ambari-web,0,Alternatives issues has error message (missing translation), altern issu error messag miss translat translat,Build 1.6.0-151Missing translation: installer.step3.hostWarningsPopup.alternatives.emptyinstaller.step3.hostWarningsPopup.alternatives.empty, build miss miss translat translat instal step hostWarningsPopup altern emptyinstal step hostWarningsPopup altern empti instal step host warn popup altern emptyinstal step host warn popup altern empti,0,0,0,0,0,0,0 
5688,Dmytro Sen,null,0,Zookeeper smoke test failed after being triggered after deleting a host  containing ZookeeperServer, zookeep smoke test fail trigger delet host contain ZookeeperServer zookeep server,1. Stopped all host components on a host ( to be deleted) with ZookeeperServer. 2. Deleted a host from cluster. 3. Ran Zookeeper Service Check.Actual result: failed. Expected: ok., stop host compon host delet delet ZookeeperServer zookeep server delet host cluster cluster ran zookeep servic check actual check actual result result fail fail expect expect ok ok,0,0,0,0,0,ambari-server/src/main/java/org/apache/ambari/server/api/services/AmbariMetaInfo.java;ambari-server/src/main/java/org/apache/ambari/server/api/util/StackExtensionHelper.java;ambari-server/src/main/java/org/apache/ambari/server/controller/AmbariManagementControllerImpl.java;ambari-server/src/main/java/org/apache/ambari/server/state/ServiceInfo.java;ambari-server/src/main/resources/stacks/HDP/1.3.2/services/ZOOKEEPER/metainfo.xml;ambari-server/src/main/resources/stacks/HDP/2.0.6/services/ZOOKEEPER/metainfo.xml;ambari-server/src/test/java/org/apache/ambari/server/api/services/AmbariMetaInfoTest.java;ambari-server/src/test/java/org/apache/ambari/server/api/util/StackExtensionHelperTest.java;ambari-server/src/test/java/org/apache/ambari/server/controller/AmbariManagementControllerTest.java;ambari-server/src/test/resources/stacks/HDP/2.0.7/services/ZOOKEEPER/metainfo.xml;,0 
5692,Oleg Nechiporenko,ambari-web,0,Unit tests for utils/config.js part 1, unit test util config js util config js part,Update unit tests for utils/config.js., updat unit test util config js util config js,0,0,0,0,0,0,0 
5714,Xi Wang,ambari-web,0,Views list not loading in Ambari Web, view list not load ambari web,In build 1.6.0-159  the views call is being made but it's not listing the views in the dropdown.This was due to the API change and Ambari Web hasn't adjusted yet to this introduction of /versions/., build view call made not list view dropdown dropdown due API chang ambari web adjust yet introduct version version,0,0,0,0,0,0,0 
5716,Jaimin D Jetly,ambari-web,0,Disable security fails occasionally, disabl secur fail occasion,There is a possibility that 'Start all Services' command will fail on Disable Security wizard if App.Service DS model was not populated on the load of 'Disable security page' (timing issue). We need to make sure that the Service model has populated before the 'Disable Security page' is rendered., possibl start start servic servic command fail disabl secur wizard app servic app servic DS model not popul load disabl disabl secur page page time issu issu need make sure servic model popul disabl disabl secur page page render render,0,0,0,0,0,0,0 
5720,Jonathan Hurley,null,0,pig.properties should set pig.location.check.strict to false, pig properti pig properti set pig locat check strict pig locat check strict fals,pig.properties should set pig.location.check.strict to false, pig properti pig properti set pig locat check strict pig locat check strict fals,0,0,0,0,0,0,0 
5722,Jonathan Hurley,null,0,All Services Fail To Deploy Due To Agent Parsing Exception, servic fail deploy due agent pars except,When deploying a brand new cluster  all services fail to install due to a parsing exception thrown from the Ambari Agents.File '/usr/lib/python2.6/site-packages/ambari_agent/CustomServiceOrchestrator.py'  line 113  in runCommandjson_path = self.dump_command_to_json(command)File '/usr/lib/python2.6/site-packages/ambari_agent/CustomServiceOrchestrator.py'  line 209  in dump_command_to_jsoncommand'clusterHostInfo' = manifestGenerator.decompressClusterHostInfo(command'clusterHostInfo')File '/usr/lib/python2.6/site-packages/ambari_agent/manifestGenerator.py'  line 116  in decompressClusterHostInfoindexes = convertRangeToList(v)File '/usr/lib/python2.6/site-packages/ambari_agent/manifestGenerator.py'  line 57  in convertRangeToListraise AgentException.AgentException('Broken data in given range  expected - ''m-n'' or ''m''  got : ' + str(r))AgentException: 'Broken data in given range  expected - m-n or m  got : -1he command being sent is{hs_host=[2]  namenode_host=[1]  snamenode_host=[2]  zookeeper_hosts=[0-2]  ganglia_server_host=[1]  nm_hosts=[0]  ganglia_monitor_hosts=[0-2]  all_hosts=[c6403.ambari.apache.org  c6401.ambari.apache.org  c6402.ambari.apache.org]  rm_host=[2]  app_timeline_server_hosts=[2]  slave_hosts=[0]  ambari_server_host=[-1]  nagios_server_host=[1]  all_ping_ports=[8670:0-2]}Notice the ambari-server-host which was added in that commit; it value is 1which would not parse correctly in manifestGenerator.pyI suspect Git e667dc7c9870864ff537374c819b7c1d1dd88e98 caused this problem.Steps to reproduce:1) Provision 3 c64 hosts2) Wipe your server database and re-create it with the embedded PSQL script3) Attempt to provision a cluster with various services.All services will fail to deploy b/c of the above exception. This was working without issues before the above suspect commit., deploy brand new cluster servic fail instal due pars except thrown ambari agent file agent file usr lib python site packag ambari_agent CustomServiceOrchestrator py usr lib python site packag ambari_agent custom servic orchestr py line runCommandjson_path run Commandjson_path self dump_command_to_json command file self dump_command_to_json command file usr lib python site packag ambari_agent CustomServiceOrchestrator py usr lib python site packag ambari_agent custom servic orchestr py line dump_command_to_jsoncommand clusterHostInfo dump_command_to_jsoncommand cluster host info manifestGenerator decompressClusterHostInfo command clusterHostInfo file manifest gener decompress cluster host info command cluster host info file usr lib python site packag ambari_agent manifestGenerator py usr lib python site packag ambari_agent manifest gener py line decompressClusterHostInfoindexes decompress cluster host infoindex convertRangeToList file convert rang list file usr lib python site packag ambari_agent manifestGenerator py usr lib python site packag ambari_agent manifest gener py line convertRangeToListraise convert rang listrais AgentException AgentException broken agent except agent except broken data given rang expect got str AgentException str agent except broken broken data given rang expect got command sent hs_host hs_host namenode_host namenode_host snamenode_host snamenode_host zookeeper_hosts zookeeper_hosts ganglia_server_host ganglia_server_host nm_hosts nm_hosts ganglia_monitor_hosts ganglia_monitor_hosts all_hosts ambari apach org all_hosts ambari apach org ambari apach org ambari apach org ambari apach org ambari apach org rm_host rm_host app_timeline_server_hosts app_timeline_server_hosts slave_hosts slave_hosts ambari_server_host ambari_server_host nagios_server_host nagios_server_host all_ping_ports notic all_ping_ports notic ambari server host ambari server host ad commit commit valu would not pars correctli manifestGenerator pyI manifest gener py suspect git dc ff dd dc ff dd caus problem step problem step reproduc reproduc provis host host wipe server databas creat creat embed PSQL script script attempt provis cluster variou servic servic servic fail deploy except except work without issu suspect commit commit,0,0,0,0,0,0,0 
5726,Jaimin D Jetly,ambari-web,0,Adding Oozie failed at service check, ad oozi fail servic check,This happens because HDFS and YARN/MapReduce requires to be restarted for Oozie smoke test to pass successfullyAs a fix to this issue: Don't run smoke test on 'Install  Start and Test' page of the add service wizard. Review page should ask user to restart all stale services., happen HDFS YARN MapReduce YARN map reduc requir restart oozi smoke test pass successfullyAs success fix issu issu run smoke test instal instal start test test page add servic wizard wizard review page ask user restart stale servic servic,0,0,0,0,0,0,0 
5730,Vitaly Brodetskyi,ambari-agent,0,Space Error in container-executor.cfg, space error contain executor cfg contain executor cfg,There is a space between 'banned.user' and '=' which make configuration here is ignored by container-executor  so some default banned users works to include hdfs. Space should be deleted between 'banned.user' and '='yarn.nodemanager.local-dirs=/grid/0/hadoop/yarn/local /grid/1/hadoop/yarn/localyarn.nodemanager.log-dirs=/grid/0/hadoop/yarn/log /grid/1/hadoop/yarn/logyarn.nodemanager.linux-container-executor.group=hadoopbanned.users = hdfs yarn mapred binmin.user.id=1000It should be banned.users=hdfs yarn mapred bin, space ban user ban user make configur ignor contain executor contain executor default ban user work includ hdf hdf space delet ban user ban user yarn nodemanag local dir grid hadoop yarn local yarn nodemanag local dir grid hadoop yarn local grid hadoop yarn localyarn nodemanag log dir grid hadoop yarn log grid hadoop yarn localyarn nodemanag log dir grid hadoop yarn log grid hadoop yarn logyarn nodemanag linux contain executor group hadoopban user grid hadoop yarn logyarn nodemanag linux contain executor group hadoopban user hdf yarn mapr binmin user id binmin user id ban user hdf ban user hdf yarn mapr bin,0,0,0,0,0,0,0 
