issue_id,component,reporter,summary,description,affected_version,fixed_version,description_words,Surprising,Dormant,Blocker,Security,Performance,Breakage,file_count,files
3488,ambari-web,Andrii Tkach,Status does not show up for newly added hosts,The problem is that host can have actual status only when service mapper recieve response(could be long latency  about 10 - 12 seconds) with new hostComponents and then status mapper compute them and set status to host.,1.4.1,1.4.2,38,1,0,0,0,0,0,1,ambari-web/app/mappers/status_mapper.js;
3490,ambari-agent,Dmitry Lysnichenko,Remove RCO management logic at ambari-agent,In 1.5.0 release  ambari-agent will not need to process RCO to re-order/parallelizing tasks. Let's remove the code/unit-test and keep them aside in a JIRA targeted for release after 1.5.0. If possible  let's remove upgrade related code as well as there is no plan for automatic stack upgrade for Baikal. We can keep the python executor as there is a requirement for python executor.,1.5.0,1.5.0,63,1,0,0,0,0,0,0,
3491,ambari-web,Jaimin D Jetly,HBase Master/RegionServer can no longer be started after reconfiguring HBase or HDFS with NameNode HA enabled,,1.4.1,1.4.1,1,1,0,0,0,0,0,3,ambari-web/app/controllers/wizard/step8_controller.js;ambari-web/app/data/HDP2/config_mapping.js;ambari-web/app/utils/config.js;
3498,ambari-web,Jaimin D Jetly,Hbase secure config properties in HDP-2.x stack revert back to non-secure values on reconfiguration,,1.4.1,1.4.1,1,1,0,0,0,0,0,1,ambari-web/app/data/HDP2/config_mapping.js;
3507,ambari-web,Oleg Nechiporenko,'Assign Slaves' step. Error with installed NodeManagers,Installed NodeManagers don't appears as selected checkboxes on the 'Assign Slaves' step.,1.5.0,1.5.0,12,0,0,0,0,0,0,0,
3512,,Sumit Mohanty,Nagios doesn't start after upgrade [SLES11  1.3.2->2.0.6],check_cpu needs to be disabled for Suse for JobHistory server and ResourceManager,1.4.1,1.4.1,12,0,0,0,0,0,0,0,
3521,ambari-web,Andrii Babiichuk,Incorrect status counters on cluster deploy,In host stauts filter label shows incorrect number of hosts after deploy failed.Wrong progress bar color  on fail color should be red or yellow  instead of blue.,1.4.2,1.4.2,27,0,0,0,0,0,0,2,ambari-web/app/controllers/wizard/step9_controller.js;ambari-web/app/messages.js;
3528,ambari-web,Oleg Nechiporenko,DB url isn't calculated automatically,Select Hive or Oozie and go to step 'Customize services'.'Open' Oozie tab.Database Url is 'jdbc'.Click 'Existing MySQL Database'.Click 'New Derby Database'.Database Url became jdbc:derby:${oozie.data.dir}/${oozie.db.schema.name}-db;create=true.Expect:proper value should be right after step is loaded.,1.5.0,1.5.0,38,0,0,0,0,0,0,0,
3534,ambari-server; test,Artem Baranchuk,Hadoop Core Health Check script needs to be included in Ambari HDP installations,,1.4.0,1.4.2,1,0,0,0,0,0,0,0,
3535,ambari-web,Oleg Nechiporenko,skip 'Customize Services' step for services that can't be customized,Services like PIG  Sqoop can't be customized.Wizard should check services-list (that user want to add) and if no one service can't be customized  should skip 'Customize' step ('Back' click on the next step should also be verified).,1.5.0,1.5.0,37,0,0,0,0,0,0,0,
3537,ambari-agent,Dmytro Sen,Allow log4j properties to be applied via the API in Ambari for hadoop/oozie/hbase/hive/zookeeper/pig,Allow log4j properties to be applied via the API in Ambari for hadoop/oozie/hbase/hive/zookeeper/pig.,1.4.2,1.5.0,13,0,0,0,0,0,0,65,ambari-agent/src/main/python/resource_management/libraries/providers/__init__.py;ambari-agent/src/main/python/resource_management/libraries/providers/properties_file.py;ambari-agent/src/main/python/resource_management/libraries/resources/__init__.py;ambari-agent/src/main/python/resource_management/libraries/resources/properties_file.py;ambari-server/src/main/resources/stacks/HDP/1.3.3/hooks/before-START/scripts/params.py;ambari-server/src/main/resources/stacks/HDP/1.3.3/hooks/before-START/scripts/shared_initialization.py;ambari-server/src/main/resources/stacks/HDP/1.3.3/hooks/before-START/templates/log4j.properties.j2;ambari-server/src/main/resources/stacks/HDP/1.3.3/services/HBASE/configuration/hbase-log4j.xml;ambari-server/src/main/resources/stacks/HDP/1.3.3/services/HBASE/metainfo.xml;ambari-server/src/main/resources/stacks/HDP/1.3.3/services/HBASE/package/scripts/hbase.py;ambari-server/src/main/resources/stacks/HDP/1.3.3/services/HBASE/package/scripts/params.py;ambari-server/src/main/resources/stacks/HDP/1.3.3/services/HDFS/configuration/hdfs-log4j.xml;ambari-server/src/main/resources/stacks/HDP/1.3.3/services/HDFS/metainfo.xml;ambari-server/src/main/resources/stacks/HDP/1.3.3/services/HIVE/configuration/hive-exec-log4j.xml;ambari-server/src/main/resources/stacks/HDP/1.3.3/services/HIVE/configuration/hive-log4j.xml;ambari-server/src/main/resources/stacks/HDP/1.3.3/services/HIVE/metainfo.xml;ambari-server/src/main/resources/stacks/HDP/1.3.3/services/HIVE/package/scripts/hive.py;ambari-server/src/main/resources/stacks/HDP/1.3.3/services/HIVE/package/scripts/params.py;ambari-server/src/main/resources/stacks/HDP/1.3.3/services/MAPREDUCE/configuration/mapreduce-log4j.xml;ambari-server/src/main/resources/stacks/HDP/1.3.3/services/MAPREDUCE/metainfo.xml;ambari-server/src/main/resources/stacks/HDP/1.3.3/services/OOZIE/configuration/oozie-log4j.xml;ambari-server/src/main/resources/stacks/HDP/1.3.3/services/OOZIE/metainfo.xml;ambari-server/src/main/resources/stacks/HDP/1.3.3/services/OOZIE/package/scripts/oozie.py;ambari-server/src/main/resources/stacks/HDP/1.3.3/services/OOZIE/package/scripts/params.py;ambari-server/src/main/resources/stacks/HDP/1.3.3/services/OOZIE/package/templates/oozie-log4j.properties.j2;ambari-server/src/main/resources/stacks/HDP/1.3.3/services/PIG/configuration/pig-log4j.xml;ambari-server/src/main/resources/stacks/HDP/1.3.3/services/PIG/metainfo.xml;ambari-server/src/main/resources/stacks/HDP/1.3.3/services/PIG/package/scripts/params.py;ambari-server/src/main/resources/stacks/HDP/1.3.3/services/PIG/package/scripts/pig.py;ambari-server/src/main/resources/stacks/HDP/1.3.3/services/PIG/package/templates/log4j.properties.j2;ambari-server/src/main/resources/stacks/HDP/1.3.3/services/ZOOKEEPER/configuration/zookeeper-log4j.xml;ambari-server/src/main/resources/stacks/HDP/1.3.3/services/ZOOKEEPER/metainfo.xml;ambari-server/src/main/resources/stacks/HDP/1.3.3/services/ZOOKEEPER/package/scripts/params.py;ambari-server/src/main/resources/stacks/HDP/1.3.3/services/ZOOKEEPER/package/scripts/zookeeper.py;ambari-server/src/main/resources/stacks/HDP/1.3.3/services/ZOOKEEPER/package/templates/log4j.properties.j2;ambari-server/src/main/resources/stacks/HDP/2.1.1/hooks/before-START/scripts/params.py;ambari-server/src/main/resources/stacks/HDP/2.1.1/hooks/before-START/scripts/shared_initialization.py;ambari-server/src/main/resources/stacks/HDP/2.1.1/hooks/before-START/templates/log4j.properties.j2;ambari-server/src/main/resources/stacks/HDP/2.1.1/services/HBASE/configuration/hbase-log4j.xml;ambari-server/src/main/resources/stacks/HDP/2.1.1/services/HBASE/metainfo.xml;ambari-server/src/main/resources/stacks/HDP/2.1.1/services/HBASE/package/scripts/hbase.py;ambari-server/src/main/resources/stacks/HDP/2.1.1/services/HBASE/package/scripts/params.py;ambari-server/src/main/resources/stacks/HDP/2.1.1/services/HDFS/configuration/hdfs-log4j.xml;ambari-server/src/main/resources/stacks/HDP/2.1.1/services/HDFS/metainfo.xml;ambari-server/src/main/resources/stacks/HDP/2.1.1/services/HIVE/configuration/hive-exec-log4j.xml;ambari-server/src/main/resources/stacks/HDP/2.1.1/services/HIVE/configuration/hive-log4j.xml;ambari-server/src/main/resources/stacks/HDP/2.1.1/services/HIVE/metainfo.xml;ambari-server/src/main/resources/stacks/HDP/2.1.1/services/HIVE/package/scripts/hive.py;ambari-server/src/main/resources/stacks/HDP/2.1.1/services/HIVE/package/scripts/params.py;ambari-server/src/main/resources/stacks/HDP/2.1.1/services/OOZIE/configuration/oozie-log4j.xml;ambari-server/src/main/resources/stacks/HDP/2.1.1/services/OOZIE/metainfo.xml;ambari-server/src/main/resources/stacks/HDP/2.1.1/services/OOZIE/package/scripts/oozie.py;ambari-server/src/main/resources/stacks/HDP/2.1.1/services/OOZIE/package/scripts/params.py;ambari-server/src/main/resources/stacks/HDP/2.1.1/services/PIG/configuration/pig-log4j.xml;ambari-server/src/main/resources/stacks/HDP/2.1.1/services/PIG/metainfo.xml;ambari-server/src/main/resources/stacks/HDP/2.1.1/services/PIG/package/scripts/params.py;ambari-server/src/main/resources/stacks/HDP/2.1.1/services/PIG/package/scripts/pig.py;ambari-server/src/main/resources/stacks/HDP/2.1.1/services/PIG/package/templates/log4j.properties.j2;ambari-server/src/main/resources/stacks/HDP/2.1.1/services/YARN/configuration/yarn-log4j.xml;ambari-server/src/main/resources/stacks/HDP/2.1.1/services/YARN/metainfo.xml;ambari-server/src/main/resources/stacks/HDP/2.1.1/services/ZOOKEEPER/configuration/zookeeper-log4j.xml;ambari-server/src/main/resources/stacks/HDP/2.1.1/services/ZOOKEEPER/metainfo.xml;ambari-server/src/main/resources/stacks/HDP/2.1.1/services/ZOOKEEPER/package/scripts/params.py;ambari-server/src/main/resources/stacks/HDP/2.1.1/services/ZOOKEEPER/package/scripts/zookeeper.py;ambari-server/src/main/resources/stacks/HDP/2.1.1/services/ZOOKEEPER/package/templates/log4j.properties.j2;
3553,ambari-web,Jaimin D Jetly,NameNode HA wizard: Refreshing the wizard displays incorrect manual commands.,Install HDFS with customized hostname hdfs1. Start NameNode HA wizard and Refresh on step-2 (select host). Proceed ahead. Create checkpoint step asks to run command with incorrect user name:sudo su -l hdfs -c 'hdfs dfsadmin -safemode enter' Above command returns safemode: Access denied for user hdfs. Superuser privilege is required Actual command should be:sudo su -l hdfs1 -c 'hdfs dfsadmin -safemode enter',1.4.2,1.4.2,64,1,0,0,0,0,0,0,
3569,ambari-web,Oleg Nechiporenko,'Config' step refresh,Go to Config Step on the addServiceWizard.Refresh page.Got JS error  because selected services where not saved.Expect: get page with config list for selected services.,1.5.0,1.5.0,24,0,0,0,0,0,0,0,
3582,ambari-web,Srimanth Gunturi,Cleanup UI restart calculations using actual_configs,As documented in AMBARI-3531  the restart flags will be provided in host_components itself and services will have an API to get restart host_components easily. Due to this  there is no need for actual_configs on the client  and the code to calculate diffs with global properties.,1.4.1,1.4.2,56,1,0,0,0,0,0,0,
3584,ambari-web,Jaimin D Jetly,Reassign Master: Misc UI display fixes,This ticket mainly covers UI label and message changes in reassign master wizard.,1.4.2,1.4.2,13,1,0,0,0,0,0,9,ambari-web/app/config.js;ambari-web/app/controllers/main/service/reassign/step4_controller.js;ambari-web/app/controllers/main/service/reassign/step6_controller.js;ambari-web/app/messages.js;ambari-web/app/templates/main/admin/highAvailability/progress.hbs;ambari-web/app/templates/main/service/reassign/step1.hbs;ambari-web/app/views/main/service/reassign/step1_view.js;ambari-web/app/views/main/service/reassign/step4_view.js;ambari-web/app/views/main/service/reassign/step6_view.js;
3589,ambari-web,Oleg Nechiporenko,Common storage for different wizards,Some wizards (installer  addHosts  addServices) use common local storage objects.But each should has separated object (for example  based on controllerName).,1.4.2,1.4.2,20,1,0,0,0,0,0,0,
3594,ambari-web,Jaimin D Jetly,Service reconfiguration fails for multiple services,Service reconfiguration fails for HDFS  MapReduce and Hive service with js error. For other services it fails silently without any error (no API call is triggered).,1.4.2,1.4.2,26,1,0,0,0,0,0,4,ambari-web/app/controllers/main/service/info/configs.js;ambari-web/app/controllers/main/service/reassign_controller.js;ambari-web/app/utils/config.js;ambari-web/app/views/wizard/controls_view.js;
3609,ambari-agent,Trevor McKay,os_type_check.sh for RHEL is too restrictive (Server vs Workstation),The /etc/redhat-release on my RHEL6.4 dev box containsRed Hat Enterprise Linux Workstation release 6.4 (Santiago)os_type_check.sh is checking for 'Server' on rhel boxes. It should simply check for Red Hat Enterprise Linux and ignore text up to the version number.,1.4.2,,39,1,0,0,0,0,0,0,
3611,ambari-web,Xi Wang,Hosts: clarify which filter is in effect,1. Use a shadow with high contrast to make the current filter more visible.2. Show how many hosts total / how many are in the current view  and a 'Clear all filters' link.,1.4.2,1.4.2,33,1,0,0,0,0,0,0,
3613,ambari-web,Antonenko Alexander,Enable HA wizard loads after sign in,Steps: Go to 'Admin' page -&gt; 'High Availability' tab and run 'Enable NameNode HA' wizard. Close wizard. Sign out (or reopen browser). Sign in.Result:After sign in was opened first page of 'Enable NameNode HA' wizard instead 'Dashboard' page.,1.4.2,1.4.2,38,0,0,0,0,0,0,0,
3615,ambari-agent,Dmytro Sen,Ambari agent creates empty folder /var/ambari-agent,Ambari agent creates an empty directory /var/ambari-agent during installation.This directory isn't needed  /var/run/ambari-agent is used instead.,1.4.1,1.4.2,16,1,0,0,0,0,0,0,
3618,ambari-web,Xi Wang,host actions UI changes based on new stop/start all and delete func,1. Do the right-float on the action menus on the Components section.2. Rename buttons: on SERVICE PAGES: Maintenance --&gt;Service Actions...on HOST PAGES: Maintenance --&gt; Host Actions...on HOST PAGES / COMPONENT SECTION: Actions --&gt; Actions...,1.4.2,1.4.2,34,1,0,0,0,0,0,0,
3621,ambari-web,Andrii Babiichuk,cleanup dialog for unable to delete host,make dialog according to left mockup,1.4.2,1.4.2,6,1,0,0,0,0,0,2,ambari-web/app/messages.js;ambari-web/app/templates/main/host/details/raiseDeleteComponentErrorPopup.hbs;
3623,ambari-agent; test,Artem Baranchuk,LiveStatus of the component is not updated when username is changed,Steps to reproduce: On installer wizard  make install phase fail by killing any install task of master component. Go back and change hdfs username to hdfs1. Proceed ahead and installer wizard completes successfully. HDFS service is red. Nagios shows no alerts  but API returns INSTALLED status for all hdfs host components. UI impact: On starting HDFS  all tasks completes successfully with 100% green progress bar but service status always remains red. Restarting agent resolves the issue.Looks like AmbariConfig.servicesToPidNames is not getting updated when username is changed.,1.4.2,1.4.2,87,1,0,0,0,0,0,0,
3631,ambari-agent,Dmytro Shkvyra,traceback when attempting to stop ambari-agent as non-root,I attempted to stop the ambari-agent without going to root first. Prints a pretty bad traceback.&#91;vagrant@c6403 ~&#93;$ ambari-agent stop/usr/sbin/ambari-agent: line 66: /var/lib/ambari-agent/ambari-env.sh: Permission deniedVerifying Python version compatibility...Using python /usr/bin/python2.6Found ambari-agent PID: 2996Stopping ambari-agentTraceback (most recent call last):File '/usr/lib/python2.6/site-packages/ambari_agent/main.py'  line 235  in &lt;module&gt;main()File '/usr/lib/python2.6/site-packages/ambari_agent/main.py'  line 190  in mainsetup_logging(options.verbose)File '/usr/lib/python2.6/site-packages/ambari_agent/main.py'  line 73  in setup_loggingrotateLog = logging.handlers.RotatingFileHandler(logfile  'a'  10000000  25)File '/usr/lib64/python2.6/logging/handlers.py'  line 112  in initBaseRotatingHandler.init(self  filename  mode  encoding  delay)File '/usr/lib64/python2.6/logging/handlers.py'  line 64  in initlogging.FileHandler.init(self  filename  mode  encoding  delay)File '/usr/lib64/python2.6/logging/init.py'  line 827  in __initStreamHandler.init(self  self._open())File '/usr/lib64/python2.6/logging/init.py'  line 846  in _openstream = open(self.baseFilename  self.mode)IOError: &#91;Errno 13&#93; Permission denied: '/var/log/ambari-agent/ambari-agent.log'Removing PID file at /var/run/ambari-agent/ambari-agent.pidrm: cannot remove '/var/run/ambari-agent/ambari-agent.pid': Permission deniedambari-agent successfully stopped,1.4.2,1.4.2,107,1,0,0,0,0,0,0,
3645,ambari-web,Xi Wang,HA cluster: some dashboard's widgets contain 'Null'  'NaN' values after services stop,Steps:Stop YARN service.Go to 'Dashboard'.Result:'NodeManagers Live' widget contains 'null' values.Similar problem is present for 'HBase Ave Load' widget - 'NaN' value.,1.4.2,1.4.2,21,1,0,0,0,0,0,0,
3648,ambari-agent,Vitaly Brodetskyi,Failed to start Hive Metastore (centos5.8  Stack 2.0),Occurred during install as warning (could not start the service). Clicked next to continue  when into Ambari  then tried to start Hive there as well  same issue.,1.4.2,1.4.2,27,0,0,0,0,0,0,0,
3650,ambari-web,Andrii Tkach,Poll for host_components which have stale_configs,UI needs to know which host_components need restart due to stale_configs (saved but not picked up). Server API provide stale_configs flag per host-component. We need this polled and maintained on client model.,1.4.1,1.4.2,32,1,0,0,0,0,0,8,ambari-web/app/assets/data/services/host_component_stale_configs.json;ambari-web/app/controllers/global/cluster_controller.js;ambari-web/app/controllers/global/update_controller.js;ambari-web/app/controllers/main/service/info/configs.js;ambari-web/app/initialize.js;ambari-web/app/mappers/component_config_mapper.js;ambari-web/app/models/service.js;ambari-web/app/views/main/host/summary.js;
3674,ambari-web,Srimanth Gunturi,UI does not update active hbase master in display,When we have 3 HBase masters we show in UI that one of them is active. When the master is stopped  the other HBase master is not marked as active in UI. In API it does become active.,1.4.2,1.4.2,38,1,0,0,0,0,0,0,
3675,ambari-web,Jaimin D Jetly,Default value of 'Default virtual memory for a job's map-task' is not valid,The default value of 'Default virtual memory for a job's map-task' (in Customize Services page -&gt; MapReduce2 tab -&gt; General) was '619.5'.Warning hint says 'Must contain digits only'Value depends on quantity of installed components.,1.4.2,1.4.2,34,1,0,0,0,0,0,5,ambari-web/app/controllers/wizard/step7_controller.js;ambari-web/app/utils/config.js;ambari-web/app/utils/defaults_providers/yarn_defaults_provider.js;ambari-web/app/utils/helper.js;ambari-web/app/utils/string_utils.js;
3679,ambari-agent,Dmytro Shkvyra,Better error message needed when incompatible ambari-agents installed,On a few days old cluster I attempted to add a host. The add host failed due to ambari-server trying to install ambari-agent-1.4.1.17 and the repo having ambari-agent-1.4.1.23-1.The message in /var/run/ambari-server/bootstrap/11/hostname.log was:STDERRscp /usr/lib/python2.6/site-packages/ambari_server/setupAgent.py done for host srimanth1-5.c.pramod-thangali.internal  exitcode=0Copying files finishedRunning setup agent...STDOUTError: Nothing to do{'exitstatus': 1  'log': ('Loaded plugins: downloadonly  fastestmirror  security/nDetermining fastest mirrors/n * base: www.gtlib.gatech.edu/n * extras: centos.mirror.netriplex.com/n * updates: mirror.cogentco.com/nSetting up Install Process/nNo package ambari-agent-1.4.1.17 available./n'  None)},1.4.1,1.4.2,70,1,0,0,0,0,0,0,
3686,ambari-web,Antonenko Alexander,NameNode HA wizard (Configure Components step): Task 'Reconfigure HDFS' always fail  and user cannot proceed to next step,This task fails due to bad request:/api/v1/clusters/c1/hosts/HDFS_CLIENT/host_components/dev01.hortonworks.comShould be: api/v1/clusters/c1/hosts/dev01.hortonworks.com/host_components/HDFS_CLIENT,1.4.2,1.4.2,9,0,0,0,0,0,1,0,
3690,ambari-web,Yusaku Sako,Typo in text label on Hosts page,On the Hosts page  we have a typo in the label 'filterd'. Should be 'filtered'.,1.4.2,1.4.2,15,1,0,0,0,0,0,0,
3695,ambari-agent,Dmytro Shkvyra,'Confirm hosts' shows 'ntpd not running' warning  but it's running on host,STR: Install  setup and start Ambari server by default. Reach 'Choose services' phase of installer.Actual result:'Confirm hosts' shows warning that ntpd service isn't running on hosts  but it's running in console by command service ntpd status,1.4.2,1.4.2,45,1,0,0,0,0,0,0,
3698,ambari-web,Jaimin D Jetly,Modify UI text for host cleanup,python /usr/lib/python2.6/site-packages/ambari_agent/HostCleanup.py -s -k 'users'To cleanup in interactive mode  remove *-s* option. To cleanup all resources  including _users_  remove *-k users* option. Use *--help* for a list of available options. The motivation is to provide the conservative option but minimal detail to allow for full clean up.,1.4.2,1.4.2,63,1,0,0,0,0,0,2,ambari-web/app/messages.js;ambari-web/app/styles/application.less;
3701,ambari-server,Dmytro Shkvyra,Reduce logs emitted to report heartbeats from agents,For a 657 node cluster:~10 minute for 10 MB and 20 log files store about 200 minutes (~3 hours) of log. This is not ideal if an error overnight needs to be investigated. We should try for the log to last 24 hours - ideally 72 hours to account for weekends.-rw-r--r-- 1 root root 10485854 Oct 17 17:35 ambari-server.log.6-rw-r--r-- 1 root root 10485836 Oct 17 17:44 ambari-server.log.5-rw-r--r-- 1 root root 10485811 Oct 17 17:52 ambari-server.log.4-rw-r--r-- 1 root root 10485793 Oct 17 18:01 ambari-server.log.3-rw-r--r-- 1 root root 10485793 Oct 17 18:10 ambari-server.log.2-rw-r--r-- 1 root root 10485854 Oct 17 18:18 ambari-server.log.1,1.4.2,1.4.2,106,1,0,0,0,0,0,0,
3708,ambari-web,Srimanth Gunturi,Reconfigure of dynamic configs not showing modified values,Modifications of dynamic properties are being persisted on server  but default values are being shown in UI. Also  we should not validate dynamic configs which are of type string. mapreduce.map.java.opts mapreduce.reduce.java.opts yarn.app.mapreduce.am.command-opts,1.4.0,1.4.0; 1.4.2,32,1,0,0,0,0,0,0,
3713,ambari-web,Oleg Nechiporenko,When filtering on hosts  the table column sizes shift  should stay fixed.,For the 'defaultsProvider' and 'serviceValidator' functionalities  we need unit tests,1.4.2,1.4.2,10,1,0,0,0,0,0,0,
3715,ambari-web,Antonenko Alexander,Reassign Master Wizard does not display folder and hosts on 'Manual commands' page after browser reopening,Steps: Open 'Reassign Master Wizard' for NameNode or SNameNode. Go to 'Manual commands' page. Close browser and open it again.Result: Was opened 'Manual commands' page  but hostnames and foldername were replaced with '{1}'  '{2}' etc.Attached picture for other page  but behavior is similar.,1.4.2,1.4.2,43,1,0,0,0,0,0,0,
3720,ambari-web,Xi Wang,Provide read-only view of repo options in Ambari Web,If a user is using local repos  and customizes Advanced Repository Options during install  the user might need this info to debug post install (since it is used in Add Hosts)  for example.Note: We should show this information regardless if the user customizes repos or not during install.,1.4.2,1.4.2,48,1,0,0,0,0,0,1,ambari-web/app/utils/ajax.js;
3724,ambari-web,Andrii Tkach,Incorrect host status when slave down,When host has slave down status 'No Heartbeat' status is shown instead of 'Slave Down'.,1.4.2,1.4.2,15,1,0,0,0,0,0,1,ambari-web/app/models/host.js;
3726,ambari-web,Antonenko Alexander,Restart indicators for services and hosts disappear after some time.,Goto Service (that have stale configs) -&gt; configs   no restart indicators are shown. Refresh page  for 10-15 seconds you see indicators then they disappear. The same for host detail page,1.4.2,1.4.2,31,1,0,1,0,0,0,0,
3729,,Artem Baranchuk,Ganglia monitor started with second or third attempt on secure cluster,,1.4.1,1.4.3,1,1,0,0,0,0,0,0,
3738,ambari-web,Andrii Babiichuk,Background ops dialog checkbox UI cleanup,The OK and the text should be on the same centerline row.,1.4.2,1.4.2,12,1,0,0,0,0,0,3,ambari-web/app/styles/application.less;ambari-web/app/templates/common/modal_popup.hbs;ambari-web/app/views/common/modal_popup.js;
3739,ambari-server,Siddharth Wagle,Remove Exception message printed to log for successful starts,Following error messages are printed to log with default log level and are misleading.04:19:52 438 ERROR [main] MasterKeyServiceImpl:109 - Master key is not provided as a System property or an environment varialble.04:19:52 439 INFO [main] Configuration:415 - Credential provider creation failed.Master key initialization failed.,1.4.2,1.4.2,50,1,0,0,0,0,0,0,
3742,ambari-web,Andrii Babiichuk,HBase Links widget has 'more' button out of bounds and looks broken when there are multiple masters,When there are multiple HBase Masters  the HBase Links widget looks broken. Let's get rid of the 'and X Standby Masters' static text as it is not a link and not very useful.So the widget would look like:'HBase Master''X RegionServers''Master Web UI',1.4.2,1.4.2,42,1,0,0,0,0,0,4,ambari-web/app/messages.js;ambari-web/app/templates/main/dashboard/widgets/hbase_links.hbs;ambari-web/app/views/main/dashboard/service/hbase.js;ambari-web/app/views/main/dashboard/widgets/hbase_links.js;
3752,ambari-web,Srimanth Gunturi,MR jobs are hanging on a 2-node cluster with default configuration,This is a 2-node cluster with 2GB of RAM each. Cluster deployment goes fine but MR jobs do not complete resulting in service check failures for MR  OOZIE  Pig  etc.,1.4.2,1.4.2,30,1,0,0,0,1,0,0,
3759,ambari-web,Antonenko Alexander,Add host wizard: After successfully bootstrapping host  'next' button is disabled,See screenshot,1.4.2,1.4.2,2,1,0,0,0,0,0,0,
3760,ambari-web,Antonenko Alexander,Provide config-group support in add-host wizard,When adding hosts  a user should be able to select which config-groups this host belongs to. Configurations of that group (Default or config-group) will be applied on that host.,1.4.2,1.4.2,29,1,0,0,0,0,0,0,
