issue_id,component,reporter,summary,description,affected_version,fixed_version,description_words,Surprising,Dormant,Blocker,Security,Performance,Breakage,file_count,files
2475,,Ximo Guanter,Ambari bootstrap actions report success even if a failure happened,Sometimes  bootstrap actions reports success even if it has failed host tasks:&lt;bootStrapRequest&gt; &lt;status&gt;SUCCESS&lt;/status&gt; &lt;hostsStatus&gt; &lt;hostName&gt;andromeda54.hi.inet&lt;/hostName&gt; &lt;status&gt;FAILED&lt;/status&gt; &lt;statusCode&gt;1&lt;/statusCode&gt; &lt;log&gt; [...] &lt;/log&gt; &lt;/hostsStatus&gt; &lt;hostsStatus&gt; &lt;hostName&gt;andromeda55.hi.inet&lt;/hostName&gt; &lt;status&gt;FAILED&lt;/status&gt; &lt;statusCode&gt;1&lt;/statusCode&gt; &lt;log&gt; [...] &lt;/log&gt; &lt;/hostsStatus&gt; &lt;log&gt; [...] &lt;/log&gt;&lt;/bootStrapRequest&gt;,1.3.0,1.5.0,65,1,0,0,0,0,0,0,
2480,ambari-web,Xi Wang,Dashboard page has a lot of footer padding,This ticket solved:1. Dashboard page has padding space under footer.2. When a widget got deleted  the page scroll to top.(page should stay in place),1.2.5,1.2.5,24,1,0,0,0,0,0,0,
2486,ambari-agent,Dmitry Lysnichenko,shell.killprocessgrp is not working in a reliable way,We have noticed an issue where shell.killprocessgrp is not working correctly. We have seen a scenario where namenode start takes a long time when on a secure cluster the jce policy is unavailable. After 10 minutes when the agent tries to kill the puppet process it invariably fails.We need to run some experiment (perhaps using long running puppet processes) to ensure that shell.killprocessgrp works as expected.Also  we need to verify that the behavior is as expected on both RHEL and Suse.,1.2.5,1.2.5,81,1,0,0,0,0,0,0,
2490,ambari-server,Siddharth Wagle,Issues with setup ldap,I got this blow-up (when bind anon was either false or I just pressed returnBind anonymously true/false (false):====================Review Settings====================authentication.ldap.primaryUrl: my.ldap:389authentication.ldap.secondaryUrl: asdauthentication.ldap.useSSL: falseauthentication.ldap.usernameAttribute: uidauthentication.ldap.baseDn: basednauthorization.userRoleName: userauthorization.adminRoleName: adminauthentication.ldap.bindAnonymously: falseTraceback (most recent call last):File '/usr/sbin/ambari-server.py'  line 3047  in &lt;module&gt;main()File '/usr/sbin/ambari-server.py'  line 2891  in mainsetup_ldap()File '/usr/sbin/ambari-server.py'  line 2353  in setup_ldapprint('%s: %s' % (property  ldap_property_value_mapproperty))KeyError: 'authentication.ldap.managerDn',1.2.5,1.2.5,51,1,0,0,0,0,0,0,
2491,ambari-web,Andrii Tkach,Security Wizard: show which principals and keytabs need to be created on which hosts,Currently it is very difficult to know what principals and keytabs need to be created on which hosts.We should present this information to the end user in a format that is easy to consume.The user running the wizard may not be the one who will be creating keytabs and principals. We can expose the capability to download a csv file and send it to the appropriate person who may parse the data to create a script to generate principals/keytabs (or do so manually).Display the attached as a popup after Configure Services step is done.Let's show it as a popup so that we don't affect any existing navigation/flow.For generating the content:Keytab paths are based on the user inputPrincipal names are based on the user inputNameNode host: show the nn and HTTP principals and keytab pathsJobTracker host: show the jt principal and keytab pathOozie Server host: show the oozie and HTTP principals and keytab pathsNagios Server host: show the nagios principal and keytab pathHBase Master host: show the hbase principal and keytab pathHive Server host: show the hive principal and keytab pathWebHCat Server host: show the HTTP principal and keytab pathZooKeeper Server host: show the zookeeper principal and keytab pathDataNode host: show the dn principal and keytab pathTaskTracker host: show the tt principal and keytab pathRegionServer host: show the hbase principal and keytab pathIf there are duplicated principals on the same host  display it only once.Clickng on 'Download CSV' downloads the CSV file ('host-principal-keytab-list.csv'). The same content  except each row is a comma-delimited list with a /n at the end.,1.2.5,1.2.5,258,1,0,0,0,0,0,0,
2497,ambari-agent,Vitaly Brodetskyi,Remove dependence on dfs_datanode_http_address global for Nagios checks,ambari-agent/src/main/puppet/modules/hdp-nagios/templates/hadoop-services.cfg.erb shows the following:# HDFS::DATANODE Checksdefine service { hostgroup_name slaves use hadoop-service service_description DATANODE::DataNode process down servicegroups HDFS check_command check_tcp!&lt;%=scope.function_hdp_template_var('dfs_datanode_http_address')%&gt;!-w 1 -c 1 normal_check_interval 1 retry_check_interval 0.5 max_check_attempts 3}define service { hostgroup_name slaves use hadoop-service service_description DATANODE::DataNode storage full servicegroups HDFS check_command check_datanode_storage!&lt;%=scope.function_hdp_template_var('dfs_datanode_http_address')%&gt;!90%!90% normal_check_interval 5 retry_check_interval 1 max_check_attempts 2}We need to remove dependence on dfs_datanode_http_address and use the actual config property like:hdp_get_port_from_url($hdfs-site['dfs.datanode.http.address']),1.2.5,1.2.5,79,0,0,0,0,0,0,0,
2498,ambari-server,Oleksandr Diachenko,Cleanup setup https flow,Expected flow:[root@localhost ~]# ambari-server setup-httpsUsing python /usr/bin/python2.6Setting up HTTPS properties...Do you want to configure HTTPS [y/n] (y)?SSL port (8443) ? Please enter path to Certificate: /some/path/on/my/host/server.crtPlease enter path to Private Key: /some/path/on/my/host/server.keyPlease enter password for Private Key:Importing and saving certificate...done.NOTE: Reset Ambari Server to apply changes ('ambari-server restart|stop|start')Ambari Server 'HTTPS setup' completed successfully. Exiting.,1.2.5,1.2.5,63,1,0,0,0,0,0,0,
2515,ambari-web,Jaimin D Jetly,Cannot add property mapred.task.tracker.task-controller,,1.2.5,1.2.5,1,0,0,0,1,0,0,0,
2517,ambari-agent,Siddharth Wagle,Decommission data node not working in secure mode,Decommission datanode does not do kinit before refresh.,1.2.5,1.2.5,8,1,0,0,0,0,0,0,
2519,ambari-web,Srimanth Gunturi,Add download CSV action for security wizard,We need CSV content which shows which principals  keytabs etc. end up on the various hosts. This will be useful in scripts or other tools which can create appropriate environment.,1.2.5,1.2.5,30,1,0,0,0,0,0,0,
2522,ambari-agent,Siddharth Wagle,Zookeeper smoke test failing in secure cluster,Zookeeper smoke test failing in secure cluster,1.2.5,1.2.5,7,1,0,0,0,0,0,0,
2525,ambari-server,Dmitry Lysnichenko,Add helpful message when not able to download jdk with setup options for the user to be able to specify the jdk.,Add helpful message when not able to download jdk with setup options for the user to be able to specify the jdk.,1.2.5,1.2.5,22,0,0,0,0,0,0,0,
2532,ambari-agent,Siddharth Wagle,Incorrect permission on taskcontroller.cfg,/etc/conf/hadoop/taskcontroller.cfgIn secure mode permissions are set to '400'.,1.2.5,1.2.5,8,0,0,0,1,0,0,0,
2534,ambari-server,Sumit Mohanty,Some memory configs are set to -1 in Ambari,Some memory configs are set to -1 in ambari-mapred.cluster.reduce.memory.mb-mapred.jobtracker.maxtasks.per.job-mapred.cluster.max.reduce.memory.mb-mapred.cluster.map.memory.mb-mapred.job.map.memory.mb-mapred.job.reduce.memory.mb-mapred.cluster.max.map.memory.mbModify the stack definition to put default values as appropriate.,1.2.4,1.2.5,18,0,0,0,0,0,0,0,
2542,ambari-server,Nate Cole,Custom Repo URL cannot be set when non-root,The first iteration for creating custom repo URL persisted the new URL to disk. This poses a problem when running Ambari as non-root because the file system is owned by root. Change the implementation to save the override in the metainfo table.,1.2.5,1.2.5,42,0,0,0,0,0,0,0,
2545,ambari-agent,Dmitry Lysnichenko,Regression: Agent external hostname is not verified during bootstrap with no warnings,When confirming hosts using external addresses bootstrapping should be failed immediately and a warning should be logged. Right now this functionality is broken  neither warning in log nor failing immediately present,1.2.5,1.2.5,31,0,0,0,0,0,0,0,
2546,ambari-web,Srimanth Gunturi,Simplify Local Repo setup in installer UI,Enhance the UI to use stacks API to give user a choice of stacks and be able to customize repository locations.,1.2.5,1.4.0,21,0,0,0,0,0,0,0,
2555,ambari-web,Andrii Tkach,Security Wizard: Create separate page for principal/keytab,Add step 'Create Principals and Keytabs' to Security wizard.,1.2.5,1.2.5,9,0,0,0,0,0,0,7,ambari-web/app/controllers/main/admin/security/add/step4.js;ambari-web/app/messages.js;ambari-web/app/routes/add_security.js;ambari-web/app/routes/main.js;ambari-web/app/templates/main/admin/security/add/step1.hbs;ambari-web/app/templates/main/admin/security/add/step2.hbs;ambari-web/app/templates/main/admin/security/add/step3.hbs;
2556,ambari-server,Dmitry Lysnichenko,Ctrl+C during ambari-server setup prints out a python stack trace,We should be able to catch KeyBoardInterrupt in ambari-server main and print a useful message like:'Aborting ... Keyboard Interrupt.' and avoid the stack trace for the user.,1.2.5,1.2.5,27,0,0,0,0,0,0,0,
2568,ambari-agent,Dmitry Lysnichenko,Setup LDAP does not validate true/false response,Garbage responses to true/false questions just pass thru. Notice below  just put in garbage for Use SSL and that's what it would have written.Need validation to confirm they enter either 1) return to accept default or 2) the word true or 3) the word false. Else  inform the user'Property must be 'true' or 'false'.' and ask again.Secondary URL :Use SS &#91;true/false&#93; (false): asdUser name attribute* (uid):Base DN* :Property cannot be blank.Base DN* : asdBind anonymously* true/false (false):Manager DN* :asdEnter Manager Password*:Re-enter password:Passwords do not matchEnter Manager Password*:Re-enter password:====================Review Settings====================authentication.ldap.primaryUrl: my.url:849authentication.ldap.useSSL: asdauthentication.ldap.usernameAttribute: uid,1.2.5,1.2.5,93,0,0,0,1,0,0,0,
2578,ambari-server,Dmitry Lysnichenko,Using another user for ambari server user create a local group for the ambari server user with same name.,Using an ambari-qa user (that is a ldap user and he has hadoop set up as a primary ldap group) [root@va21 ldap]# id ambari-qauid=524(ambari-qa) gid=522(hadoop) groups=522(hadoop)causes ambari-server setup to create an ambari-qa local group (at /etc/group). ambari-qa:x:601:ambari-qa[root@va21 ldap]# id ambari-qauid=524(ambari-qa) gid=522(hadoop) groups=522(hadoop) 601(ambari-qa)Ldap users and groups are transparent for ambari-server  it starts well.The problem is that additional group is created.,1.2.5,1.2.5,73,0,0,0,0,0,0,0,
2585,ambari-web,Aleksandr Kovalenko,Host Check report show hosts without issues,Report contains hosts  which don't have issues  but should show 'A space delimited list of hosts which have issues'.,1.2.5,1.2.5,19,0,0,0,0,0,0,0,
2590,,Xi Wang,JS Error when deleting a widget after sorting it on remove/edit sign,,1.2.5,1.2.5,1,0,0,0,0,0,0,0,
2594,ambari-agent,Siddharth Wagle,HDP installation fails due to puppet syntax error,namenode_host is not an hash or array when accessing it with 0 at /var/lib/ambari-agent/puppet/modules/hdp/manifests/params.pp:70 on node host1.,1.2.5,1.2.5,17,0,0,0,0,0,0,0,
2595,ambari-web,Andrii Tkach,Properties of the same name cannot be added to different custom site.xml's,Steps (Installer Wizard):Go to 'Customize Services' page.Select 'HDFS' tab.Add custom property 'xxx' to 'Custom core-site.xml' panel.Try add custom property 'xxx' to 'Custom hdfs-site.xml' panel.Result:Custom property can not be added to 'Custom hdfs-site.xml' panel (see attachment).Steps (Ambari monitoring UI):Go to 'Customize Services' page.Select 'HDFS' tab.Add custom property to 'Custom core-site.xml' panel (for example  'install-test-core-site').Continue and end hadoop installation.Go to 'Services' page.Select 'MapReduce' tab.Try add custom property 'install-test-core-site' to 'Custom mapred-site.xml' panel.Result:Custom property can not be added to 'Custom mapred-site.xml' panel (see attachment).,1.2.5,1.2.5,81,0,0,0,0,0,0,1,ambari-web/app/views/common/configs/services_config.js;
2600,ambari-web,Antonenko Alexander,Add Quick Links (Web UI) for Oozie  Hue  Nagios  Ganglia,There are no quick links for Oozie. Similarly  some other services also are missing the quick links.,1.2.5,1.2.5,17,0,0,0,0,0,0,0,
2605,ambari-agent,Siddharth Wagle,'kdestroy' not required for zookeeper smoke test,zookeeper smoke test passes without having to 'kdestroy' on the user running the smoke test.,1.2.5,1.2.5,15,0,0,0,0,0,0,0,
2608,ambari-server,Sumit Mohanty,WebHCat and Oozie services does not start on RHEL5 with enabled security because of 'CRITICAL: Error doing kinit for nagios',FE only has support to provide single path for kinit. As Ambari supports mixed OS deployment it cannot be guaranteed that kinit exists at the same path on all nodes. FE should allow providing a set of look-up paths for kinit as well as the BE should support a set of default lookup paths.,1.2.5,1.2.5,54,1,0,0,0,0,0,0,
2612,ambari-agent; ambari-server,Dmytro Shkvyra,Rename agent.fqdn property in ambari.props to server.fqdn,lets just rename agent -&gt; server,1.2.5,1.2.5,6,0,0,0,0,0,0,0,
2613,ambari-web,Aleksandr Kovalenko,Host Checks: truncation on checked processes makes it difficult to know the actual processes in conflict,Processes are truncated too short and can't really tell what's in conflict. Since there is a lot of space on the right (in fact  the hostname column is too far to the left compared to other sections)  we should display more characters (with hover tooltip showing full text).,1.2.5,1.2.5,48,0,0,0,0,0,0,0,
2614,ambari-web,Andrii Tkach,Popover with config name goes beyond the container,See attachecd screenshot.,1.2.5,1.2.5,3,0,0,0,0,0,0,0,
2619,ambari-web,Antonenko Alexander,Wrong info on Services > Summary tab for DataNodes Live  TaskTrackers Live  RegionServers live,1. Install cluster2. On the host with SNameNode  we also have a region server3. Stop snamenode component on that host4. Services &gt; hbase &gt; summary shows region server is not liveAlso after stopping DataNode or TaskTracker  component status changes are not reflected on Services &gt; summary tab,1.2.5,1.2.5,47,1,0,0,0,0,0,0,
2631,ambari-server,Oleksandr Diachenko,Host cleanup left two packages(ambari-log4j  libconfuse),,1.2.5,1.2.5,1,1,0,0,0,0,0,0,
2632,,Xi Wang,Dashboard Widgets: 'hover to show details' experience is jarring,,1.2.5,1.2.5,1,1,0,0,0,0,0,0,
2633,,Sumit Mohanty,Reset the latest stack version for 1.2.5,Reset the latest stack version for 1.2.5,1.2.5,1.2.5,7,1,0,0,0,0,0,0,
2635,ambari-web,Srimanth Gunturi,Perf: Service summary view inefficiently binds to host components,In ambari-web/app/views/main/service/info/summary.js#hostComponentsUpd()  is called per each hostComponent's host and master property change. On a 150 node cluster  we get like 300 calls just for this method.Due to this  service_mapper  which usually maps in 600ms  takes now 5.8s.,1.2.5,1.2.5,38,1,0,0,0,1,0,0,
2636,,Xi Wang,Dashboard Metrics legend size increased unexpectedly on mouseover from line space,This happened in a very specific situation.1. Put mouse on the line space around a metric widget.2. hover on the widget with mouse down.Result:The legend show up as a strange bigger size.,1.2.5,1.2.5,32,0,0,0,0,0,0,0,
2637,ambari-web,Jaimin D Jetly,Security CSV cleanup,Should say 'Hive Metastore and HiveServer2'  not just HiveServer2. Even though they are co-located master components  let's make it clear this principal is for both include keytab file column. In addition to the keytab full path column (/etc/security/keytabs/jt.service.keytab)  include a column with just the filename (jt.service.keytab). Easier to copy/paste/parse if you want to use the CSV file.,1.2.5,1.2.5,58,1,0,0,0,0,0,2,ambari-web/app/controllers/main/admin/security/add/step3.js;ambari-web/app/utils/string_utils.js;
2640,ambari-web,Aleksandr Kovalenko,Going back to Customize Services page from the Install page resets certain directory values,Steps to reproduce: Install using non-default directories Upon install failure  go back to Customize Services page from the left nav. Certain directories (NN dirs  SNN dir  DN dirs  Oozie Data Dir  ZK Dir  etc) are reverted back to the default. Other parameters are not reverted back.,1.2.4,1.2.5,46,1,0,0,0,0,0,0,
2642,ambari-web,Oleg Nechiporenko,Update Ember-I18n,,1.4.0,1.4.0,1,1,0,0,0,0,0,0,
2643,,Nate Cole,Read timeout issues in Oracle JDBC connections where read has a long timeout,Read timeout issues in Oracle JDBC connections where read has a long timeout. This happens when the read timeout is too long. In order to set appropriate timeout  add specially prefixed values in ambari.properties,1.2.5,1.2.5,34,1,0,0,0,1,0,0,
