issue_id,component,reporter,summary,description,affected_version,fixed_version,description_words,Surprising,Dormant,Blocker,Security,Performance,Breakage,file_count,files
5156,ambari-agent,Siddharth Wagle,Hive CLI using Tez runtime does not start by throwing HDFS exception,In a cluster node we had set the below in /etc/hive/conf/hive-site.xml&lt;property&gt; &lt;name&gt;hive.jar.directory&lt;/name&gt; &lt;value&gt;hdfs:///apps/hive/install&lt;/value&gt;&lt;/property&gt;The HDFS folder has the following contents# hadoop fs -ls -R /apps/hive/drwxr-xr-x - hive hdfs 0 2014-03-19 17:10 /apps/hive/install-rwxr-xr-x 3 hive hdfs 14719276 2014-03-19 17:10 /apps/hive/install/hive-exec.jardrwxrwxrwx - hive hdfs 0 2014-03-19 17:08 /apps/hive/warehouseAs user ambari-qa I run the hive command to hit this exception$ hiveLogging initialized using configuration in file:/etc/hive/conf.dist/hive-log4j.propertiesException in thread 'main' java.lang.RuntimeException: org.apache.hadoop.security.AccessControlException: Permission denied: user=ambari-qa  access=WRITE  inode='/apps/hive/install':hive:hdfs:drwxr-xr-x at org.apache.hadoop.hdfs.server.namenode.FSPermissionChecker.checkFsPermission(FSPermissionChecker.java:265) at org.apache.hadoop.hdfs.server.namenode.FSPermissionChecker.check(FSPermissionChecker.java:251) at org.apache.hadoop.hdfs.server.namenode.FSPermissionChecker.check(FSPermissionChecker.java:232) at org.apache.hadoop.hdfs.server.namenode.FSPermissionChecker.checkPermission(FSPermissionChecker.java:176) at org.apache.hadoop.hdfs.server.namenode.FSNamesystem.checkPermission(FSNamesystem.java:5481) at org.apache.hadoop.hdfs.server.namenode.FSNamesystem.checkPermission(FSNamesystem.java:5463) at org.apache.hadoop.hdfs.server.namenode.FSNamesystem.checkAncestorAccess(FSNamesystem.java:5437) at org.apache.hadoop.hdfs.server.namenode.FSNamesystem.startFileInternal(FSNamesystem.java:2265) at org.apache.hadoop.hdfs.server.namenode.FSNamesystem.startFileInt(FSNamesystem.java:2218) at org.apache.hadoop.hdfs.server.namenode.FSNamesystem.startFile(FSNamesystem.java:2171) at org.apache.hadoop.hdfs.server.namenode.NameNodeRpcServer.create(NameNodeRpcServer.java:517) at org.apache.hadoop.hdfs.protocolPB.ClientNamenodeProtocolServerSideTranslatorPB.create(ClientNamenodeProtocolServerSideTranslatorPB.java:354) at org.apache.hadoop.hdfs.protocol.proto.ClientNamenodeProtocolProtos$ClientNamenodeProtocol$2.callBlockingMethod(ClientNamenodeProtocolProtos.java) at org.apache.hadoop.ipc.ProtobufRpcEngine$Server$ProtoBufRpcInvoker.call(ProtobufRpcEngine.java:585) at org.apache.hadoop.ipc.RPC$Server.call(RPC.java:928) at org.apache.hadoop.ipc.Server$Handler$1.run(Server.java:2003) at org.apache.hadoop.ipc.Server$Handler$1.run(Server.java:1999) at java.security.AccessController.doPrivileged(Native Method) at javax.security.auth.Subject.doAs(Subject.java:415) at org.apache.hadoop.security.UserGroupInformation.doAs(UserGroupInformation.java:1548) at org.apache.hadoop.ipc.Server$Handler.run(Server.java:1997) at org.apache.hadoop.hive.ql.session.SessionState.start(SessionState.java:345) at org.apache.hadoop.hive.cli.CliDriver.run(CliDriver.java:682) at org.apache.hadoop.hive.cli.CliDriver.main(CliDriver.java:626) at sun.reflect.NativeMethodAccessorImpl.invoke0(Native Method) at sun.reflect.NativeMethodAccessorImpl.invoke(NativeMethodAccessorImpl.java:57) at sun.reflect.DelegatingMethodAccessorImpl.invoke(DelegatingMethodAccessorImpl.java:43) at java.lang.reflect.Method.invoke(Method.java:606) at org.apache.hadoop.util.RunJar.main(RunJar.java:212)Caused by: org.apache.hadoop.security.AccessControlException: Permission denied: user=ambari-qa  access=WRITE  inode='/apps/hive/install':hive:hdfs:drwxr-xr-x at org.apache.hadoop.hdfs.server.namenode.FSPermissionChecker.checkFsPermission(FSPermissionChecker.java:265) at org.apache.hadoop.hdfs.server.namenode.FSPermissionChecker.check(FSPermissionChecker.java:251) at org.apache.hadoop.hdfs.server.namenode.FSPermissionChecker.check(FSPermissionChecker.java:232) at org.apache.hadoop.hdfs.server.namenode.FSPermissionChecker.checkPermission(FSPermissionChecker.java:176) at org.apache.hadoop.hdfs.server.namenode.FSNamesystem.checkPermission(FSNamesystem.java:5481) at org.apache.hadoop.hdfs.server.namenode.FSNamesystem.checkPermission(FSNamesystem.java:5463) at org.apache.hadoop.hdfs.server.namenode.FSNamesystem.checkAncestorAccess(FSNamesystem.java:5437) at org.apache.hadoop.hdfs.server.namenode.FSNamesystem.startFileInternal(FSNamesystem.java:2265) at org.apache.hadoop.hdfs.server.namenode.FSNamesystem.startFileInt(FSNamesystem.java:2218) at org.apache.hadoop.hdfs.server.namenode.FSNamesystem.startFile(FSNamesystem.java:2171) at org.apache.hadoop.hdfs.server.namenode.NameNodeRpcServer.create(NameNodeRpcServer.java:517) at org.apache.hadoop.hdfs.protocolPB.ClientNamenodeProtocolServerSideTranslatorPB.create(ClientNamenodeProtocolServerSideTranslatorPB.java:354) at org.apache.hadoop.hdfs.protocol.proto.ClientNamenodeProtocolProtos$ClientNamenodeProtocol$2.callBlockingMethod(ClientNamenodeProtocolProtos.java) at org.apache.hadoop.ipc.ProtobufRpcEngine$Server$ProtoBufRpcInvoker.call(ProtobufRpcEngine.java:585) at org.apache.hadoop.ipc.RPC$Server.call(RPC.java:928) at org.apache.hadoop.ipc.Server$Handler$1.run(Server.java:2003) at org.apache.hadoop.ipc.Server$Handler$1.run(Server.java:1999) at java.security.AccessController.doPrivileged(Native Method) at javax.security.auth.Subject.doAs(Subject.java:415) at org.apache.hadoop.security.UserGroupInformation.doAs(UserGroupInformation.java:1548) at org.apache.hadoop.ipc.Server$Handler.run(Server.java:1997) at sun.reflect.NativeConstructorAccessorImpl.newInstance0(Native Method) at sun.reflect.NativeConstructorAccessorImpl.newInstance(NativeConstructorAccessorImpl.java:57) at sun.reflect.DelegatingConstructorAccessorImpl.newInstance(DelegatingConstructorAccessorImpl.java:45) at java.lang.reflect.Constructor.newInstance(Constructor.java:526) at org.apache.hadoop.ipc.RemoteException.instantiateException(RemoteException.java:106) at org.apache.hadoop.ipc.RemoteException.unwrapRemoteException(RemoteException.java:73) at org.apache.hadoop.hdfs.DFSOutputStream.newStreamForCreate(DFSOutputStream.java:1602) at org.apache.hadoop.hdfs.DFSClient.create(DFSClient.java:1461) at org.apache.hadoop.hdfs.DFSClient.create(DFSClient.java:1386) at org.apache.hadoop.hdfs.DistributedFileSystem$6.doCall(DistributedFileSystem.java:394) at org.apache.hadoop.hdfs.DistributedFileSystem$6.doCall(DistributedFileSystem.java:390) at org.apache.had,1.5.0,1.5.0,232,0,0,0,0,1,0,0,
5173,ambari-server,Dmytro Sen,The status of App Timeline Server affect the health status of YARN service.,When stopping ATS  YARN service indicator blinks red giving the idea that YARN is going down and become solid red after that. YARN service should not be indicated as STOPPED if ATS is down.,1.5.0,1.5.1,34,0,0,0,0,0,0,1,ambari-server/src/main/resources/stacks/HDP/2.1/services/YARN/metainfo.xml;
5223,ambari-agent,Vitaly Brodetskyi,hive-env.sh overwrites user value of HIVE_AUX_JARS_PATH,This line at the bottom of hive-env.sh disregards any user-provided values  masking them from the launch script.# Folder containing extra ibraries required for hive compilation/execution can be controlled by:export HIVE_AUX_JARS_PATH=/usr/lib/hcatalog/share/hcatalog/hcatalog-core.jarThis breaks this feature for users of both the environment export HIVE_AUX_JARS_PATH='my custom value' and the command line hive --auxpath 'my custom value' .,1.2.5,1.5.1,59,0,0,0,0,0,0,0,
5235,ambari-web,Jaimin D Jetly,Add component of clients in Ambari doesn't work in a secured cluster,The reason of bug is wrong query formation while triggering API to create clients on host.The data sent with the POST call to create client components on the host is:{'RequestInfo':{'context':'Install Clients'} 'Body':{'host_components':[{'HostRoles':{'component_name':'CLIENTS'}}]}}This is incorrect. There is no component with name 'CLIENTS'.,1.4.4,1.5.1,46,0,0,0,0,0,0,0,
5244,ambari-web,Oleg Nechiporenko,Wizard Step7 JS error on load page (add service wizard),Add Nagios  Ganglia via Add Service WizardProceed to step 'Customize Services'JS-error appears about null-object:/app/controllers/wizard/step7_controller.js : loadServiceTagsSuccess()if (serviceConfigsDef.sites.indexOf(site) &gt; -1)Also  HDFS by default is selected as active tab  but one of the 'new' services (Nagios for example) should be selected.,1.5.1,1.5.1,39,0,0,0,0,0,0,0,
5246,ambari-web,Andrii Babiichuk,Mistake in title of operation 'Restart APP_TIMELINE_SERVER on ...,We should show displayName  not componentName,1.5.0,1.5.1,6,0,0,0,0,0,0,1,ambari-web/app/controllers/main/host/details.js;
5258,ambari-web,Oleg Nechiporenko,Installer: 'Undo' button for repo BaseURL does not work,STR: during installer phase go to &lt;cluster&gt;:8080 /#/installer/step1 ; Change/delete any of BaseURL of repos ; Click 'Undo' buttonActual Results:Undo button does not work. Moreover  if we click Undo after any update of text in BaseURL  it leads to cleanup of it value atall.,1.5.0; 1.5.1,1.5.0; 1.5.1,46,0,0,0,0,0,0,0,
5264,ambari-agent,Vitaly Brodetskyi,Ganglia Server goes to 'installed' state after double 'Ganglia rrdcached base directory' config changing,STR:1) Deploy cluster by default2) Go to Ganglia service page -&gt; Config tab 3) Change value 'Ganglia rrdcached base directory' (e.g. /var/lib/ganglia/rrd8)4) Restart Ganglia5) Change 'Ganglia rrdcached base directory' back to old value (by default - /var/lib/ganglia/rrds)6) Restart GangliaExpected result: Ganglia should be restarted successfullyCurrent result: Ganglia Server goes to 'installed' state and stuck thereError message from gmetad file:=============================Starting hdp-gmetad...=============================Base directory (-b) resolved via file system links!Please consult rrdcached '-b' documentation!Consider specifying the real directory (/var/lib/ganglia/rrd8)chgrp: cannot access '/var/run/ganglia/hdp/rrdcached.sock': No such file or directorychgrp: cannot access '/var/run/ganglia/hdp/rrdcached.limited.sock': No such file or directoryFailed to start /usr/bin/rrdcachedNot starting /usr/sbin/gmetad because starting /usr/bin/rrdcached failed.root 16990 0.0 0.0 108164 1560 ? S 03:19 0:00 /bin/bash --login -c service hdp-gmetad start &gt;&gt; /tmp/gmetad.log 2&gt;&amp;1 ; /bin/ps auwx | /bin/grep [g]metad &gt;&gt; /tmp/gmetad.log 2&gt;&amp;1,1.5.0,1.5.0,134,0,0,0,0,0,0,0,
5274,ambari-web,Aleksandr Kovalenko,Supervisor under supervision fails w/o ganglia server,JMXetricAgent instrumented JVM  see https://github.com/ganglia/jmxetricMar 28  2014 6:40:13 PM info.ganglia.jmxetric.JMXetricAgent premainSEVERE: Exception starting JMXetricAgentjava.net.UnknownHostException: {0}: Name or service not known at java.net.Inet6AddressImpl.lookupAllHostAddr(Native Method) at java.net.InetAddress$1.lookupAllHostAddr(InetAddress.java:901) at java.net.InetAddress.getAddressesFromNameService(InetAddress.java:1293) at java.net.InetAddress.getAllByName0(InetAddress.java:1246) at java.net.InetAddress.getAllByName(InetAddress.java:1162) at java.net.InetAddress.getAllByName(InetAddress.java:1098) at java.net.InetAddress.getByName(InetAddress.java:1048) at info.ganglia.gmetric4j.gmetric.AbstractProtocol.&lt;init&gt;(AbstractProtocol.java:29) at info.ganglia.gmetric4j.gmetric.Protocolv31x.&lt;init&gt;(Protocolv31x.java:34) at info.ganglia.gmetric4j.gmetric.GMetric.&lt;init&gt;(GMetric.java:108) at info.ganglia.jmxetric.XMLConfigurationService.configureGangliaFromXML(XMLConfigurationService.java:165) at info.ganglia.jmxetric.XMLConfigurationService.configure(XMLConfigurationService.java:67) at info.ganglia.jmxetric.JMXetricAgent.premain(JMXetricAgent.java:51) at sun.reflect.NativeMethodAccessorImpl.invoke0(Native Method) at sun.reflect.NativeMethodAccessorImpl.invoke(NativeMethodAccessorImpl.java:57) at sun.reflect.DelegatingMethodAccessorImpl.invoke(DelegatingMethodAccessorImpl.java:43) at java.lang.reflect.Method.invoke(Method.java:606) at sun.instrument.InstrumentationImpl.loadClassAndStartAgent(InstrumentationImpl.java:382) at sun.instrument.InstrumentationImpl.loadClassAndCallPremain(InstrumentationImpl.java:397)The reason here is this config send from ui:...childopts: '-javaagent:/usr/lib/storm/contrib/storm-jmxetric/lib/jmxetric-1.0.4.jar=host={0} ...'it can't find hostname {0}  however this works fine:...childopts: '-javaagent:/usr/lib/storm/contrib/storm-jmxetric/lib/jmxetric-1.0.4.jar=host= port...'So let's leave it as empty if no ganglia server is present,1.5.1,1.5.1,111,0,0,0,0,0,0,2,ambari-server/src/main/resources/stacks/HDP/2.1/services/STORM/configuration/storm-site.xml;ambari-web/app/controllers/wizard/step7_controller.js;
5282,ambari-server; test,Dmitry Lysnichenko,supervisor.enable should be removed from Ambari's Storm Config section,Ambari exposes the supervisor.enable property and in some early builds defaults it to true which causes the supervisor's to not launch workers assigned to them. The supervisor's will start up  the assignments are there  but the supervisor's just ignore them. We need to remove the supervisor.enable from Ambari as it seems like a very dangerous switch that doesn't have broad applicability.,1.5.1,1.5.1,62,0,0,0,0,0,0,0,
5301,ambari-web,Andrii Tkach,Table of Confirm Hosts step is collapsed,Steps to reproduce:1. Run hosts registration2. Switch to Registering category3. Wait till all hosts become registeredResult: Table is collapsed.JS error occured: Uncaught Error: assertion failed: calling set on destroyed object,1.5.1,1.5.1,36,0,0,0,0,0,0,2,ambari-web/app/views/wizard/step3_view.js;ambari-web/app/views/wizard/step9_view.js;
5310,ambari-web,Yusaku Sako,Don't do server-client version match check if App.version have not been set on ambari-web,With the new server-client version match check introduced  it is a bit annoying when building ambari-web locally and testing on the server for e2e testing  as the server and client versions must match exactly or you cannot proceed. We'll disable the check if App.version == ''.,1.5.1,1.5.1,46,0,0,0,0,0,0,0,
5311,ambari-web,Yusaku Sako,Falcon fails to deploy,Looks like Falcon service definition on the stack has changed by AMBARI-5278.Currently  any new definition of globals require duplicating them in the UI code but that was not done  so this is breaking Falcon installation.,1.5.1,1.5.1,43,0,0,0,0,0,0,0,
5313,ambari-web,Oleg Nechiporenko,Icon 'Asterisk' on 'Assign Masters'/-Slaves steps does not display with 8-bit depth,,1.5.1,1.5.1,1,0,0,0,0,0,0,0,
5332,,Mahadev konar,Print better logs for openssl issues on centos/rhel 6.5.,Print better logs for openssl issues on centos/rhel 6.5.,1.5.1,1.5.1,9,0,0,0,0,0,0,0,
5340,ambari-web,Antonenko Alexander,Tez DAG Operator hover text not wrapping wide content,When a Hive Tez DAG operator has a plan with very wide content  the text is not wrapped and hence bleeds out of the hover box. An additional problem is that this causes the hover to lose focus and hence close - thereby user cannot even see the hover (opens &amp; closes almost instantly).,1.5.1,1.5.1,54,0,0,0,0,0,0,0,
5342,ambari-server,Dmytro Sen,Ambari YARN UI - Quick Link - JMX breaks if RM port is changed,If you change RM port from 8088 to 50030 for migration of 1.x to 2.x   JVM metrics and few others are missing which results in yarn service summary page having multiple fields with n/a value.Step1: Change property below yarn.resourcemanager.webapp.address = localhost:50030Step 2: Start the service Click on Dashboard JMX is issue  Quick links is issue. RM gets started successfully.,1.4.3,1.5.1,60,0,0,0,0,0,0,2,ambari-server/src/main/java/org/apache/ambari/server/controller/internal/AbstractProviderModule.java;ambari-server/src/test/java/org/apache/ambari/server/controller/internal/JMXHostProviderTest.java;
5344,ambari-server,Myroslav Papirkovskyy,Error with finding FK constraint,Steps: Install Ambari-1.3.2 with Oracle DB. Upgrade ambari to 1.5.0 Run 'ambari-server upgrade' command.Seems like check before execute doesn't work for Oracle. Since we ignore failures this is not block the upgrade.Exception:16:41:36 719 WARN [main] DBAccessorImpl:416 - Error executing query: ALTER TABLE clusterconfigmapping ADD CONSTRAINT FK_clustercfgmap_cluster_id FOREIGN KEY (cluster_id) REFERENCES clusters (cluster_id)java.sql.SQLSyntaxErrorException: ORA-02275: such a referential constraint already exists in the table at oracle.jdbc.driver.T4CTTIoer.processError(T4CTTIoer.java:445) at oracle.jdbc.driver.T4CTTIoer.processError(T4CTTIoer.java:396) at oracle.jdbc.driver.T4C8Oall.processError(T4C8Oall.java:879) at oracle.jdbc.driver.T4CTTIfun.receive(T4CTTIfun.java:450) at oracle.jdbc.driver.T4CTTIfun.doRPC(T4CTTIfun.java:192) at oracle.jdbc.driver.T4C8Oall.doOALL(T4C8Oall.java:531) at oracle.jdbc.driver.T4CStatement.doOall8(T4CStatement.java:193) at oracle.jdbc.driver.T4CStatement.executeForRows(T4CStatement.java:1033) at oracle.jdbc.driver.OracleStatement.doExecuteWithTimeout(OracleStatement.java:1329) at oracle.jdbc.driver.OracleStatement.executeInternal(OracleStatement.java:1909) at oracle.jdbc.driver.OracleStatement.execute(OracleStatement.java:1871) at oracle.jdbc.driver.OracleStatementWrapper.execute(OracleStatementWrapper.java:318) at org.apache.ambari.server.orm.DBAccessorImpl.executeQuery(DBAccessorImpl.java:413) at org.apache.ambari.server.orm.DBAccessorImpl.executeQuery(DBAccessorImpl.java:399) at org.apache.ambari.server.orm.DBAccessorImpl.addFKConstraint(DBAccessorImpl.java:262) at org.apache.ambari.server.upgrade.UpgradeCatalog150.executeDDLUpdates(UpgradeCatalog150.java:375) at org.apache.ambari.server.upgrade.AbstractUpgradeCatalog.upgradeSchema(AbstractUpgradeCatalog.java:177) at org.apache.ambari.server.upgrade.SchemaUpgradeHelper.executeUpgrade(SchemaUpgradeHelper.java:174) at org.apache.ambari.server.upgrade.SchemaUpgradeHelper.main(SchemaUpgradeHelper.java:234)16:41:36 720 WARN [main] DBAccessorImpl:264 - Add FK constraint failed  constraintName = FK_clustercfgmap_cluster_id  tableName = clusterconfigmapping  errorCode = 2275  message = ORA-02275: such a referential constraint already exists in the table,1.5.0,1.5.1,137,0,0,0,0,0,0,0,
5359,test,Dmitry Lysnichenko,unittest NagiosPropertyProviderTest fails,testNoNagiosServerCompoonent(org.apache.ambari.server.controller.nagios.NagiosPropertyProviderTest): Expected no alertstestNoNagiosService(org.apache.ambari.server.controller.nagios.NagiosPropertyProviderTest): Expected no alerts,1.5.1,1.5.1,7,0,0,0,0,0,0,0,
5362,ambari-agent,Siddharth Wagle,Automatic bootstrap failed on CentOS 6.5 (No module named common_functions),SSH bootstrap of agents failed on CentOS 6.5.==========================Copying OS type check script...==========================Could not create directory '/root/.ssh'.Warning: Permanently added 'c6502.ambari.apache.org 192.168.65.102' (RSA) to the list of known hosts.scp /usr/lib/python2.6/site-packages/ambari_server/os_check_type.pyhost=c6502.ambari.apache.org  exitcode=0==========================Running OS type check...==========================Traceback (most recent call last): File '/tmp/os_check_type1396641340.py'  line 22  in &lt;module&gt; from common_functions import OSCheckImportError: No module named common_functionsConnection to c6502.ambari.apache.org closed.SSH command execution finishedhost=c6502.ambari.apache.org  exitcode=1ERROR: Bootstrap of host c6502.ambari.apache.org fails because previous action finished with non-zero exit code (1)ERROR MESSAGE: tcgetattr: Invalid argumentConnection to c6502.ambari.apache.org closed.STDOUT: Traceback (most recent call last): File '/tmp/os_check_type1396641340.py'  line 22  in &lt;module&gt; from common_functions import OSCheckImportError: No module named common_functionsConnection to c6502.ambari.apache.org closed.,1.5.1,1.5.1,110,0,0,0,0,0,0,0,
5371,ambari-web,Oleg Nechiporenko,Dashboard: dashboard actions do not work for non-admin users,For non-admin users action 'Switch to classic dashboard' returns JS error and 'Reset all widgets to default' action throws to Login page.,1.5.1,1.6.0,22,0,0,0,0,0,0,0,
5381,ambari-web,Xi Wang,Installer: 'Undo' button for repo BaseURL is unnecessarily present,STR:on Installer phase go to &lt;cluster&gt;:8080 /#/installer/step1Do not do any updates of 'Base Url' fieldcheck the 'Undo' button for 2.1 stack.Actual Result:Undo is present for all 3 Os reposExpected Result:Undo should be present only after any update of 'BaseURL' field----------Seems  functionally this does not affect us  but might be confusing for users.,1.5.1,1.5.1,52,0,0,0,0,0,1,0,
5382,ambari-server,Myroslav Papirkovskyy,Schema Upgrade failed when upgrading to 1.5.1,While upgrade  schema upgrade fails.Example error output (Oracle):rg.apache.ambari.server.AmbariException: Current database store version is not compatible with current server version  serverVersion=1.5.1.96  schemaVersion=1.4.1.25 at org.apache.ambari.server.controller.AmbariServer.checkDBVersion(AmbariServer.java:479) at org.apache.ambari.server.controller.AmbariServer.run(AmbariServer.java:149) at org.apache.ambari.server.controller.AmbariServer.main(AmbariServer.java:528)and Postgres 11:39:27 364 ERROR [main] AmbariServer:531 - Failed to run the Ambari Serverorg.apache.ambari.server.AmbariException: Current database store version is not compatible with current server version  serverVersion=1.5.1.96  schemaVersion=1.5.0 at org.apache.ambari.server.controller.AmbariServer.checkDBVersion(AmbariServer.java:479) at org.apache.ambari.server.controller.AmbariServer.run(AmbariServer.java:149) at org.apache.ambari.server.controller.AmbariServer.main(AmbariServer.java:528),1.5.1,1.5.1,72,0,0,0,0,0,0,0,
5386,ambari-web,Yusaku Sako,Deploy stuck during generating tasks on Review page (not always reproduced),After the user clicks 'Deploy' in the Installer Wizard  sometimes an error is shown showing 'java.lang.IllegalArgumentException: Could not access base url'. This happens while the wizard tries to save the user-specified repo base URLs.Installer should not be performing validation during deploy  because it had already been done during Select Stacks.,1.5.1,1.5.1,51,0,0,0,0,0,0,0,
5402,ambari-web,Andrii Babiichuk,Remove classic dashboard view from Ambari,remove classic dashboard from Ambari  as it's not used any more and doesn't support new services,1.6.0,1.6.0,16,0,0,0,0,0,0,46,ambari-web/app/templates/main/dashboard.hbs;ambari-web/app/templates/main/dashboard/service/flume.hbs;ambari-web/app/templates/main/dashboard/service/hbase.hbs;ambari-web/app/templates/main/dashboard/service/hdfs.hbs;ambari-web/app/templates/main/dashboard/service/hive.hbs;ambari-web/app/templates/main/dashboard/service/mapreduce.hbs;ambari-web/app/templates/main/dashboard/service/mapreduce2.hbs;ambari-web/app/templates/main/dashboard/service/oozie.hbs;ambari-web/app/templates/main/dashboard/service/storm.hbs;ambari-web/app/templates/main/dashboard/service/yarn.hbs;ambari-web/app/templates/main/dashboard/service/zookeeper.hbs;ambari-web/app/templates/main/service/info/summary.hbs;ambari-web/app/templates/main/service/services/flume.hbs;ambari-web/app/templates/main/service/services/hbase.hbs;ambari-web/app/templates/main/service/services/hdfs.hbs;ambari-web/app/templates/main/service/services/hive.hbs;ambari-web/app/templates/main/service/services/mapreduce.hbs;ambari-web/app/templates/main/service/services/mapreduce2.hbs;ambari-web/app/templates/main/service/services/oozie.hbs;ambari-web/app/templates/main/service/services/storm.hbs;ambari-web/app/templates/main/service/services/yarn.hbs;ambari-web/app/templates/main/service/services/zookeeper.hbs;ambari-web/app/views.js;ambari-web/app/views/main/dashboard.js;ambari-web/app/views/main/dashboard/service.js;ambari-web/app/views/main/dashboard/service/flume.js;ambari-web/app/views/main/dashboard/service/hbase.js;ambari-web/app/views/main/dashboard/service/hdfs.js;ambari-web/app/views/main/dashboard/service/hive.js;ambari-web/app/views/main/dashboard/service/mapreduce.js;ambari-web/app/views/main/dashboard/service/mapreduce2.js;ambari-web/app/views/main/dashboard/service/oozie.js;ambari-web/app/views/main/dashboard/service/storm.js;ambari-web/app/views/main/dashboard/service/yarn.js;ambari-web/app/views/main/dashboard/service/zookeeper.js;ambari-web/app/views/main/service/service.js;ambari-web/app/views/main/service/services/flume.js;ambari-web/app/views/main/service/services/hbase.js;ambari-web/app/views/main/service/services/hdfs.js;ambari-web/app/views/main/service/services/hive.js;ambari-web/app/views/main/service/services/mapreduce.js;ambari-web/app/views/main/service/services/mapreduce2.js;ambari-web/app/views/main/service/services/oozie.js;ambari-web/app/views/main/service/services/storm.js;ambari-web/app/views/main/service/services/yarn.js;ambari-web/app/views/main/service/services/zookeeper.js;
5406,ambari-agent,Erin A Boyd,Pig unit test class named wrong,Typo in unit test. File said class was Hcat rather than Pig,1.5.0; 1.4.4; 1.6.0,1.6.0,12,0,1,0,0,0,0,0,
5412,ambari-agent,Vitaly Brodetskyi,Operation 'Supervisor start' failed during installation but all supervisors are alive,STR:1. Deploy Hadoop by default scenario with all services.2. Try to start Storm.Actual results: 'Start All Services' operation failed because of 'Supervisor start' failed. 'Start Storm' operation does not contain 'Supervisor start' popups  but all supervisors are STARTED after it have finished.,1.5.1,1.5.1,44,0,0,0,0,0,0,0,
